FREEDOM OF INFORMATION,,
23-08-2010-115705-003,21/09/2010,Why was the draft Cultural Property in Armed Conflict Bill dropped from the 2009 legislative programme? What measures are the MOD and the armed forces currently taking to protect cultural property in instances of current armed conflict e.g. Afghanistan?
23-08-2010-121803-004,21/09/2010,How many civil servants employed in the MOD are having their pay abated by a pension awarded from either AFPS 75 or AFPS 05 in year 09/10
23-08-2010-123650-003,21/09/2010,"Text of a written ministerial statement concerning the review of Gurkha terms and conditions of service. A copy of the report of the review of Gurkha terms and conditions of service, which has been redacted so as not to disclose privileged legal advice, will be made available in the Library of the House. I request a copy of the redacted version of the review report."
23-08-2010-150441-001,21/09/2010,"Bordon may be closing down soon. What will happen to the land and the properties the MOD own, will they be made available for private purchase?"
23-08-2010-153952-001,16/09/2010,I am after the list and/or criterea that allows an individual to become eligable for the Manning Control Points for the year 2010.
23-08-2010-154238-001,15/09/2010,MOD replies to EOP summaries. Entries relating to EOP destruction in the classified documents register. Information Policy Working Party Reports
23-08-2010-160701-002,21/09/2010,"Do you have any relevant statistics on the prevalence or rate of PTSD in those serving/ who have served in Iraq and Afghanistan, i.e. concerning the number of cases of PTSD recorded in this population?"
23-08-2010-162448-003,17/09/2010,"I am requesting information relating to UOR spending for the last three years by the MOD.  If possible I would like to see this broken down to programme level, IPT awarding body and who the contract was awarded to."
23-08-2010-163626-004,21/09/2010,"The total amount paid to charities, advocacy groups and think-tanks aiming to improve the protection of the natural environment, reduce greenhouse gas emissions in order to limit climate change or otherwise address environmental issues in the financial year 2009-10.  This should include, but is not limited to, all of the groups listed in the Appendix to this request."
24-08-2010-102005-001,22/09/2010,"All of the Naval, RAF and Army bases across the UK with contact information and address."
24-08-2010-103847-002,21/09/2010,I request the army pension details of specified individual enlisted in 1942
24-08-2010-113211-003,21/09/2010,I am embarking on a research project to discover the numbers of Irish citizens serving past and present in the British Armed Services
24-08-2010-120508-004,22/09/2010,Please provide details of any contracts and/or arrangements entered into in the last 10 years between the Met Office and the BBC for the provision of meteorological data
24-08-2010-123057-005,22/09/2010,Details of all meetings and direct correspondence between  Ministers at Ministry of Defence and Gennaro Mockbel with regards to procurement from January 2004 until December 2005.
24-08-2010-124228-006,22/09/2010,Details of all meetings and direct correspondence between Ministers at Ministry of Defence and Lorenzo Borgogni with regards to procurement from January 2004 until December 2005.
24-08-2010-143046-001,22/09/2010,"Since October 2005, of the officers and soldiers of the British Army granted a career break, how many and what percentage were female and how many and what percentage were for childcare reasons?"
24-08-2010-151131-002,22/09/2010,How many personnel have claimed CEA since it has been available.  The number of claims that have been invesitgated for falsely claiming the allowance
24-08-2010-153724-003,22/09/2010,"The total amount paid to charities, advocacy groups and think-tanks aiming to improve the protection of the natural environment, reduce greenhouse gas emissions in order to limit climate change or otherwise address environmental issues in the financial year 2009-10."
24-08-2010-163154-004,22/09/2010,Seven questions regarding MDP - numbers employed and various questions about ethnic and religious diversity.
25-08-2010-101221-001,22/09/2010,Use of purchasing cards by Government Agencies Which bank provides your purchasing card scheme? What was the total amount of spend placed through the scheme last financial year (1st April 2009  31st March 2010)? When does your contract for the supply of purchasing cards expire? Does the contract have a break clause?
25-08-2010-103500-002,22/09/2010,The latest number on Iraqi civilian casualities that you have in your records Since the war began in March 2003 until 2010.
25-08-2010-112929-004,22/09/2010,"Similar defects to that recorded for XV260 (fuel gauge under-reads by 700 lbs), over the period Jan 2006 to Dec 2006. Also, did XV230 have any work carried out on the fuel gauging system during its EQ1 servicing in 2006?"
25-08-2010-144631-001,23/09/2010,How many combat troops are in Afghanistan?
25-08-2010-145505-002,23/09/2010,"In 1945 a number of British and Commonwealth prisoners of war were 'liberated' from Nazi prison camps by the Red Army. Many of these went missing. What steps the government took at the time to clarify the numbers and the circumstances of the disappearence of these men? What investigations, if any, took place into the fate of these men, and what were the timescales of any investigations?"
25-08-2010-151831-001,15/09/2010,A request that having rigorously tested a FAUX fur cap that its use will be implemented
25-08-2010-154359-001,17/09/2010,"The number of foreign citizens trained at a) Sandhurst  in each year since 1997.  Please also breakdown the figures by nationality.  For each year, please also release the amount of money paid by each country in fees."
25-08-2010-160228-002,17/09/2010,"The number of foreign citizens trained at Britannia Royal Naval College at Dartmouth  in each year since 1997.  Please also breakdown the figures by nationality. For each year, please also release the amount of money paid by each country in fees."
26-08-2010-090434-001,23/09/2010,The floor area that is stated on the Display Energy Certificate for the Main Building in Whitehall.
26-08-2010-092414-002,23/09/2010,Details of your organisations legal services spend for the last 5 financial years. Total spend on legal services A breakdown of your legal services spend by type
26-08-2010-094754-003,23/09/2010,Details of any British Army land vehicles still remaining in Iraq / Kuwait since the end of operation TELIC? Specifically Vehicle type Quantity Reason for being there
26-08-2010-110553-001,22/09/2010,Minutes of a Focus Group Meeting taken by a specified Chief Inspector on or around the 15th September 2009 at DSG Larkhill.
26-08-2010-111051-002,17/09/2010,Are there regular hearing checks carried out on each MOD Police Officer during their career? Does a serving officer need to notify the MOD Police Occupational Health unit of any hearing defect? Does the MOD Police chief constable while working have a staff  driver or does he drive himself to his daily appointments? 
26-08-2010-114950-001,10/09/2010,Staistics for low flying helicopter complaints in northern Ireland in the last 3 years
26-08-2010-123459-001,23/09/2010,Electronic copies of all correspondence sent or received on or about 6 July 2006 by Professor John Mitchell in connection with his work as a Review Editor of the IPCC Fourth Assessment Report DN FER0238017
26-08-2010-123712-002,17/09/2010,"A copy of the document Ministry of Defence (Navy). 1970. ""Working with Asbestos."" N/L 90/66.  Ministry of Defece, Labour Div. (Naval), London."
26-08-2010-133325-001,15/09/2010,"How many officers within the Ministry of Defence Police in the last 12 months, who are on a restricted duties/reasonable adjustments contract who are also in operational posts, are in fact permanently non operational"
26-08-2010-151417-001,20/09/2010,There was a Royal Navy video called 'Cold Water Casualty' Is it available on DVD? If so where can get a copy?
27-08-2010-090810-001,24/09/2010,At the time of writing this 14 members of 40 Commando Royal Marines have died on their current tour of duty in Afghanistan. How many other members of the unit were injured in each incident? What were the injuries specifically? How many remain in hospital? And which hospitals? (UK or Afghanistan?) How many injured will be able to serve again?
27-08-2010-091359-002,24/09/2010,A copy the Met Office organisation chart.
27-08-2010-092247-003,24/09/2010,I would like to know how many RAF and Naval personnel are  employed at chequers today and the role/position of each one.
27-08-2010-092940-004,24/09/2010,I would like to obtain a copy of the group photograph of the intake taken after I finished basic training at Canterbury in 1964. I was in the Queens Own Buffs.
27-08-2010-094557-001,24/09/2010,Where can I find documents relating to land in Bassingbourn approriated by the airforce in WW2 for landing strips.
27-08-2010-101015-002,27/09/2010,Correspondence and minutes from 2006/7 relating to xxxxxx and DTIO and US counterparts regarding the organization of an American announcement that was hoped to reveal that British troops were withdrawing from Basra?
27-08-2010-102101-003,27/09/2010,Minutes of the Afghanistan and Iraq 'Information Campaign Coordination Group'. In particular it would be helpful to have any material relating to dialogue with DoD and CENTCOM.
27-08-2010-104156-004,27/09/2010,The coalition agreement agreed that the renewal of Trident should be scrutinised to ensure value for money. I request the release of all papers evidence and reports prepared as part of this review.
27-08-2010-105416-005,27/09/2010,Please can you release details of all communications since 2003 between MoD and Kevin McCarty (US White House Staff).
27-08-2010-114245-006,27/09/2010,"I would like to know which supplier or suppliers this agency has contracts with for the provision of the following ICT services: Application Support, Hosting, Managed Services, DBA Support, Performance Testing, Penetration Testing"
27-08-2010-120120-005,09/09/2010,"I would like a list of items either lost or stolen between 1st January 2010 and 1st August 2010.  i would like the type of item, the date lost/stolen, whether it was deemed lost or stolen and the value of the item.  I would then like a further column detailing whether the item was recovered."
27-08-2010-120140-007,27/09/2010,Please could you provide details and minutes of all meetings of the Defence Crisis Management Centre which mentioned IO and Media Operations between September 11th 2001 and 2007.
27-08-2010-150708-001,21/09/2010,Any record held by the MOD or the Royal Navy relating to the late Lafayette Ronald Hubbard who served in the US Navy during the WWII.
27-08-2010-151917-004,27/09/2010,What is the geographical extent of Air Policing Area 9?
27-08-2010-155201-005,27/09/2010,"Release details of any spraying, tests, chemical warfare testing or other tests that may have taken place in the skies above Somerset in recent years."
27-08-2010-161224-006,27/09/2010,Copy of an FOI response made in 2006 asking about the crew list when HMS Sikh sunk.
27-08-2010-161913-007,27/09/2010,"MODs expenditure on wastewater (sewer and drainage) repair and maintenance, for the recent most financial year as well as the planned expenditure for the subsequent year?  Who are the current contractors ? If these services are provided as part of a larger maintenance contract which includes other types of maintenance work, provide the names of the afferent specialist sub-contractors. What is the current value of these contracts for each of the contractors? If work is subcontracted to specialist suppliers as part of a larger maintenance contract, please provide the value of the contracts afferent to the sub-contractors also."
