FREEDOM OF INFORMATION,,
MOD Requests to 27 August 2010,,
"CIO-CI-Access Team, Ministry of Defence, CIO-FOI@mod.uk",,
,,
,,
Case Number,Date Due,Request Summary
02-08-2010-091159-001,27/08/2010,"Please give me an excel list of all FOI requests you have had since it became law. for each FOI request, please list: date of request; date of reply; reference number/ID; subject/title of the request [each request on the list should include the subject/title of the request please]; status [whether information was fully released, partially released or withheld]."
02-08-2010-092247-001,31/08/2010,"Provide a map showing the geographic extent of UK internal waters as defined by the UN convention of the law of the sea.  If you are unable to provide a map then a clearly set out description of the limits will suffice, providing it clearly names the points of land and other geographic features upon which the description of the extent of the waters is based."
02-08-2010-094635-002,31/08/2010,Provide a map showing the geographic extent of UK internal waters as defined by the UN convention of the law of the sea.
02-08-2010-094847-002,23/08/2010,"US military men based in Suffolk in 1980 were spooked when they saw a brightly lit UFO land in the forest close to their base. There were other witnesses to the phenomenon but the information has been kept Top Secret - until now.  Known as The Rendlesham File could you please send me a copy before its release.  Until now, only 20 members of the public have set eyes on the file, I would like to see a copy before release."
02-08-2010-095947-001,31/08/2010,I would like to see any records still held by the MoD pertaining to Lancaster III serial SW363 which crashed in Scotland on Jan 12th 1950.
02-08-2010-101005-003,31/08/2010,"Please can you state, for IT procurements currently in progress today (31/07/2010) where the IT spend is likely to be over £1 million, where the policy on Open Source has been applied, and where it hasn't."
02-08-2010-112221-002,27/08/2010,What is the amount paid under the AFCS for injuries in Afghanistan between April 2009 - April 2010.
02-08-2010-112753-004,31/08/2010,"Provide a list of fuel gauge defects for the period May 2006 and May 2007. List should specify nature of defect, rectification, a/c tail number and date.  Also, can you advise me as to XV260's deployment date (Gulf) in 2006, and what was its previous servicing (EQ, Primary, Major etc)?"
02-08-2010-120600-005,31/08/2010,As of 1 July 2010 please advise the number of armed forces uniformed translators/interpreters in 7 languages serving in Afghanistan.
02-08-2010-141306-001,16/08/2010,"Copies of any reports, studies, discussion or other relevant documents relating to MOD studies of ball lightning and/or other atmospheric plasma phenomena.  In particular any papers concerning work done on the possible military applications of ball lightning on the battlefield."
02-08-2010-141754-001,31/08/2010,The number of containers moved by rail.  The number of containers moved by road. The costs of vehicles and equipment by rail and road moves and numbers again from Marchwood to other rail served depots and vice versa in a twelve month period.
02-08-2010-161030-002,31/08/2010,"Request for a regional breakdown of the statistics released in the recent DASA report Quarterly Op HERRICK and Op TELIC Amputation Statistics 1 April 2006 - 30 June 2010 ( published: 30 Jul 2010). For the dates covered in the report provide the numbers of Merseyside servicemen whose injuries included a traumatic or surgical amputation, partial or complete, for either upper or lower limbs or who have been identified as identified as significant multiple amputees.  Provide statistics for the same years for the number of Merseyside personnel deployed in Op HERRICK and Op TELIC diagnosed with psychiatric illnesses."
02-08-2010-161852-001,31/08/2010,"Seven questions requesting information on corporate group buildings window cleaning contract, or contracts for in Greater London."
02-08-2010-162938-001,26/08/2010,"Request for copies of all information and correspondence exchanged between the MOD and the Scottish Government Department of Planning and Environmental Appeals and related information and correspondence between the MOD and North British Windpower and/or agents or advisors to that company, concerning the release of the unclassified version of the Additional Radar Study, from 1st March 2010 to the present date."
03-08-2010-095623-001,26/08/2010,"In February 2010, I received from you stats relating to MDP Officers throughout the force that were PST qualified as of Wednesday 16th September2009 and which were broken down per Division including HQs staff. These stats were to include stats of those not able to qualify and/or are exempt short term and long term for medical reasons.  I now request the same stats from 22 January 2010 up to the end of July 2010.  I also request stats of those officers that fall within the above criteria, that have been referred down the ill health retirement route by line management. For these stats I request the information to be between 16th September 2010 and the end of July 2010."
03-08-2010-100226-002,26/08/2010,Request relates to the policing of the Easington gas terminal in East Yorkshire.  Are MOD armed police still guarding the gas terminal against terrorist attacks? Which sites in Easington are police guarding?  What is the reason for the armed guards?  How often is this reviewed? How many officers guard the site at any one time?  Is the site guarded 24-hours?  How much money has it cost to guard sites in Easington?
03-08-2010-100751-001,01/09/2010,"Statistics regarding personnel who have commissioned from the ranks. Information for the 3 Services, Army, Navy, and RAF for the past 3 years.  Additionally, provide a percentage comparison between those commissioning from within the ranks against those who are direct entry commissions."
03-08-2010-105115-001,01/09/2010,How many employees from your Department have been dismissed from their employment in the last 5 years due to; Abuse of computer systems;  Breach of Computer/Privacy Policies
03-08-2010-145350-001,01/09/2010,According to the website of 'skywatch civil air patrol' they receive taskings from ARCC. Can you advise how many occasions ARCC has tasked skywatch or forwarded requests for air support to skywatch?
03-08-2010-150119-001,01/09/2010,Four questions regarding International Defence Training for Aeronautical Engineering.
03-08-2010-154634-001,01/09/2010,"Reference the numbers of people joining and leaving the army, results for this year.  Are there also any stats that list reasons for leaving the army?"
03-08-2010-161802-002,01/09/2010,The number of requests for information under FOIA received by the Ministry of Defence in each calendar year between 2001 and 2008 inclusive which are still being processed and which have not yet received a substantive reply.
04-08-2010-092446-001,31/08/2010,"Six financial questions BROKEN DOWN for the financial years (or calendar if financial is not possible) 2007-2008, 2008-09, and 09-10 (to date)."
04-08-2010-092854-001,31/08/2010,"All information relating to an incident that took place at RAF Boscombe Down on September 26, 1994.  An aircraft, believed to be American, crashed at Boscombe Down on that day.  Information on the specifics of the accident, what happened, how did the accident occur, were there any casualties?  Also, what aircraft type was involved?  Did the aircraft leave Boscombe Down and if so, where did the aircraft go after leaving?  Are there any pictures of the aircraft?"
04-08-2010-100048-002,02/09/2010,The current whereabouts of Panavia Tornado F2 ZA254 (9253M).
04-08-2010-102105-003,02/09/2010,"Request for missing data (April '06 to March '09) from the website including: Strength of UK Regular Forces by month; Table dimensions: Situation Date, Service; Table subset(s): None; Table statistic: Count;"
04-08-2010-102305-004,02/09/2010,"I am writing to ask about the British schooling system in Germany, and why I have been told my children cannot attend a British school unless I pay thousands per term!"
04-08-2010-103621-002,02/09/2010,I am researching military recruitment and would like information on where in the UK the Armed Services personnel are recruited from.
04-08-2010-105324-001,02/09/2010,Provide in original form the guidelines used by MOD/DVA to assess whether a vetting subject meets any of the criteria that would prevent the granting of access to TOP SECRET or other sensitive information or assets.
04-08-2010-113518-003,02/09/2010,Requesting old charts or plans which relate to the positioning of the WWII degaussing cable range which was placed in the bay of Gibraltar.
04-08-2010-114906-005,02/09/2010,"How many British troops were deployed on operations in Pakistan in the years 2001, 2002, 2003, 2004, 2005, 2006, 2007, 2008, 2009 and 2010 to date?"
04-08-2010-120351-004,02/09/2010,"Please list what tracked vehicles are deployed on operations in Afghanistan, how many of each type and total distance travelled  per type per year over the previous 5 years."
04-08-2010-122016-002,19/08/2010,"On the 15 April 1959 I flew as a member of my school CCF.  Request to confirm that I was on this flight and also that the information supplied is also correct, or if not to correct where appropriate."
04-08-2010-124649-005,13/07/2010,This request is for the specified documents whether held by the Defence Academy HR department (or other departments) or held by a specified individual on DA property/computer networks or electronic systems. 
04-08-2010-153027-001,24/08/2010,"MoD has the use of DEWs Directed Energy Weapons from the 80s.  Where did you arrange that targets can get measured so as the MoD, the HSE ,the HPA,the NRPB,the NHS, the Royal College of Psychiatrists and the Mental Welfare Commission will not be liable for prosecution under Section 134 of the Criminal Justice Act 1988."
04-08-2010-154048-001,02/09/2010,"(1) For the financial years 2007/2008, 2008/2009 and 2009/2010 please provide figures for monies paid out in bonus payments to staff for forecast accuracy.  Please also provide details of the number of staff these bonus payments were paid to. (2)  For each of these financial years please state the highest bonus paid to a member of staff for forecast accuracy."
04-08-2010-160324-002,02/09/2010,(1) Amount of weapons rooms Knocked down in Iraq.  (2) Amount of weapons rooms Britain built of in Iraq.
04-08-2010-164657-003,12/08/2010,"I understand that DSTLis a Public Body.  If this is the case, please could you send me a link to your scheme for equality and diversity and impact assessments that have been undertaken?"
04-08-2010-170304-004,01/09/2010,Requesting a copy of a deed of grant dated 19 August 1985 made between the Secretary of State for Social Services (1) The Secretary of State for Defence (2).
05-08-2010-090145-001,02/09/2010,"Request for the number of animals used for research purposes by the MOD for the whole of 2009.  The species of animals used, and quantities. Presumably all animals used for research purposes are killed, so the figures would be total number of dead.  Also, the types of procedure used, i.e. wounding in an attempt to simulate injuries on the battlefield, or poisoning to simulate a gas attack, etc. Also, the total number of animals used by the MOD for research purposes in each of the last ten years."
05-08-2010-092543-001,02/09/2010,"All information involving the investigation of bullying between a specified individual and a specified individual investigated by a specified individual between January 2009 - date.  Also, copies of all e-mails and letters."
05-08-2010-133102-001,25/08/2010,"Provide updates to list of names and contact details of top 2 layers of management within SPVA, including e-mail addresses.  Any information/organisation charts relating to the structure of SPVA."
05-08-2010-163659-001,03/09/2010,"Request for all further files previously unreleased in regards to the Cosford UFO incident which took place on March 30 and 31, 1993.  Also, an official MoD comment on this incident and whether the MoD would consider re-opening this file for investigation in the matter of public interest."
06-08-2010-093303-001,03/09/2010,"Provide a table providing a detailed breakdown by grade of the number of MOD civil servants made redundant in each of the last 10 years who received payouts under the current redundancy scheme (the CSCS) equivalent to 6 x annual salary/pay, 5 x annual salary/pay, 4 x annual salary/pay, 3 x annual salary/pay, 2 x annual salary/pay and 1 x annual salary/pay."
06-08-2010-100336-001,03/09/2010,"Historical data to illustrate a simple point: as unit costs of major platforms, countries must progressively cut back fleets of aircraft, surface warships, etc. The trend is particularly acute for British forces."
06-08-2010-120600-002,03/09/2010,"(1) 	How many sworn officers in total at your force were promoted to a higher rank in the last year (in the twelve months to the end of July 2010)?( 	How many sworn officers with more than 27 years service at your force were promoted to a higher rank in the last year (in the twelve months to the end of July 2010)?"
06-08-2010-163921-001,06/09/2010,"Please send me the Ministry of Defence's Structural Reform Plan, plus any/all related progress updates?  My request relates to the following statement issued on the Downing Street website on 17 July:  The Prime Minister has announced new plans to hand power to the public with every department publishing a plan that sets clear priorities and measureable milestones."
06-08-2010-164428-001,03/09/2010,Reference the history of an ex MOD boat I have restored and would be greatful for any records or direction you could offer. Built by Watercraft in Shoreham for the MOD as a tender to a Navy Ship.
06-08-2010-165432-002,06/09/2010,"Reference a Martin Baker ejector seat from a Navy Buccaneer.  Which aircraft this particular seat is from, what happened to the aircraft, if the seat has saved a life and who's if it has. The seat carries the serial number 166, and is a 6MSB/2 seat (Martin Baker MK6)."
09-08-2010-094955-001,02/09/2010,"Reference to DTR and work being done by the DTC  (1) If the SDSR produces significant reduction in the 'volume' of MoD technical training are a range of fallback options being costed to include a 'single site' or' two site' solution as well as the 'three site' solution that has already been investigated?  (2) Can you confirm that the costings of the fallback plan(s) will not simply be a scaling in proportion to the volume of trainees required as this is far too simple a model to reflect a 'true' comparator cost.  (3) Details of any meetings between Carwyn Jones Welsh Assembly AM, Cheryl Gillan MP  and Commodore King and copies of any correspondence between them.  (4) Details of costs to date for the DTC IN St Athan."
09-08-2010-100043-001,06/09/2010,"RAF TG13 SE Fitt was last evaluated by the Joint Services Job Evaluation Team in 2007/2008.  I would like to know the scores for each rank by rank SAC to WO. Also, prior to the evaluation, were any of the ranks in the lower pay banding and if so which ones."
09-08-2010-100531-001,06/09/2010,"RAF TG19 Chefs was last evaluated by the Joint Services Job Evaluation Team in 2007/2008, possibly early 2009. I would like to know the scores for each rank by rank SAC to WO for the last evaluation of this trade.  Also, prior to the evaluation, were any of the ranks in the lower pay banding and if so what ranks."
09-08-2010-100917-001,06/09/2010,"RAF TG17 Pers Spt was last evaluated by the Joint Services Job Evaluation Team in 2008.  Previous to this, when was the TG evaluated and what were the scores for the previous evaluation, by rank, for each rank."
09-08-2010-101459-002,06/09/2010,Some TG18 Log (Movs) on the posted strength of 1 AMW at RAF Lyneham are in receipt of daily crew pay. From what date was this awarded and what was the justification for the award.
09-08-2010-102535-003,06/09/2010,"Please send me the page adjacent to SMS/82/149/7A which starts SMS/80/242 and is headed ""All Trades Card One"".  This would have been for the Buccaneer aircraft that a specified person worked on."
09-08-2010-104539-002,06/09/2010,For each of the last five financial years (from 2005/6 - 2009/10) and for the first four months of 2010/11:  How many emergency training exercises has the MoD organised; What was the scenario?  which organisations participated?  How many paid actors were hired to participate. What roles did they take on (or examples thereof); What was the total cost for each year of hiring actors to participate in emergency training exercises?
09-08-2010-105923-002,06/09/2010,For each of the last five financial years (from 2005/6 - 2009/10) and for the first four months of 2010/11: How many emergency training exercises has the MoD organised?  What was the scenario?  Which organisations participated?  How many paid actors were hired to participate. What roles did they take on (or examples thereof)?  What was the total cost for each year of hiring actors to participate in emergency training exercises?
09-08-2010-125938-004,07/09/2010,"Details of the uniforms and orders of dress for Officers of the Grenadier Guards.  Specifically, I would like full details of Full Dress, No 1 Dress, Service dress and Mess Dress  to include orders of dress and when worn; pattern, colour and material of cloth; pattern, colour, material and size of buttons, badges of rank and other accoutrements, as well as guidance on the correct wearing and positioning of them."
09-08-2010-130618-003,06/09/2010,Please send me the following information for your organisation? No of employees (Split by full time & part time); Payroll Supplier; Payroll Product Used; Payroll Contract Renewal Date; Length of Payroll Contract Who has responsibility for the Payroll Solution; Cost of Payroll Solution.  HR Supplier; HR Product Used; HR Contract Renewal Date; Length of HR Contract; Who has responsibility for the HR Solution; Cost of HR Solution.
09-08-2010-131033-001,07/09/2010,"Please could you release to me any correspondence between MoD officials/ministers and Lord Robertson of Port Ellen which mentions the company Northrop Grumman, or the awarding of security contracts in general."
09-08-2010-140917-002,02/09/2010,Requestor's updating of wording to a previous request.
09-08-2010-142550-001,07/09/2010,Reference subsidies paid to the three armed forces magazines.  Please include global cost to the Exchequer and cost of camera equipment and pay to service photographers.
09-08-2010-145541-003,03/09/2010,"Recently a request was made to the Lord Mayor of Newcastle-on-Tyne by HQ RRF or AHQ RRF to exercise the Regiments Privilege of marching through the City of Newcastle on April 23rd 2011. I would be most grateful if a copy of this letter, or letters be sent to me."
09-08-2010-153222-002,07/09/2010,"I would be most grateful if you would produce a response to the original FOI request (dated 23 July 2010) using the information that resulted from the Parliamentary Question by Jenny Willott MP as suggested by you.  Please would you also provide the same details for any databases containing the personally identifiable information on more that 100,000 individual members of the public that are held by the Ministry of Defence, and that have been introduced since the reply to the Parliamentary Question in October 2009."
10-08-2010-093150-001,07/09/2010,"Information regarding an MoD Site at Queen Camel (51? 1'38.20N , 2?35'10.77W).  Have heard speculation that there is an Underground Bunker at the site. Information regarding this and the purpose of the 'ariel' units on the site, would be appreciated.  The site is referred to as Camel Hill Site, RNAS Yeovilton in the Royal Naval Air Station Yeovilton and Merryfield Airfield Byelaws 1988.  What is the connection between Camel Hill and RNAS Yeovilton?"
10-08-2010-100057-001,07/09/2010,"Reference the Grand Hotel, Culver Parade, Sandown, IOW:  (1) During the 1939/45 war, the hotel was occupied wholly by Military personnel; (2) There was a military unit excavated/built under the dance floor of The Grand Hotel;  (3) Culver Parade itself was made a no go area to all but the Military, for the duration of its occupation; (4) On leaving the island said - Military closed off the entrance by filling in and capping with a concrete covering.  I would appreciate any light you can shed on this."
10-08-2010-101421-002,07/09/2010,"Requesting details of the number of claims of civilian fatalities caused as a result of operations involving UK forces in Afghanistan reported to the MOD in each year for which figures are available since 2001.  Please supply details of the provincial district in which each purported civilian fatality, or fatalities, was reported to have taken place.  Also supply the number of reported cases investigated by the MOD in each year for which figures are available since 2001 and details of the outcome of those investigations."
10-08-2010-101536-001,07/09/2010,"I would like copies of all paperwork, plans, photographs and any other material relating to the disposal of Fort Amherst, Dock Road, Chatham, KEnt.  I would also like copies of any quadrennial reports or other reports relating to the maintenance and review of the site mentioned above, including any pictures and plans."
10-08-2010-104200-003,02/09/2010,How many Lt Col are quartered in Type 4 quarters in Blenheim Park or in the Aldershot area (below entitlement).  How many Type 3 quarters are available in the Aldershot area unoccupied?
10-08-2010-104649-002,06/09/2010,"Copies of any lease agreements/tenancy agreements between MOD and its service personnel in relation to properties situated within the land within Castle Park, Whitby.  Also information relating to the extent of land owned by MOD prior to 1996.  Any evidence as to whether service personnel were granted permission/licence to use the site, and in particular the playground and/or tennis courts."
10-08-2010-112606-001,07/09/2010,"I would like to request the most recent figures on the level of suicide in the armed forces. Specifically, I would like: the number of suicides within the last year; the number of attempted suicides within the last year; the discharge rate of anyone who attempted suicide."
10-08-2010-113814-002,07/09/2010,I would like to know how much money the MOD spent on the following newspapers between 1st January 2010 and 8th August 2010: The Sun; The Times; The Telegraph; The Guardian; The Independent; The Mirror.
10-08-2010-114710-003,07/09/2010,"I would like details of flights made by the Royal Family in MOD aircraft between 1st January 2010 and 8th August 2010.  I would like the member's name, destination, date of flight(s) and type of aircraft."
10-08-2010-120814-004,19/08/2010,Information on reports written by specified individual due to be published in the open literature shortly.
10-08-2010-121614-005,25/08/2010,"Contact details of key people within the organisation that deal with the following areas: Heads of Service or/and Managers responsible for Energy; Heads of Service or/and Managers responsible for Innovation; Heads of Service or/and Managers responsible for Human Resources Training; Heads of Service or/and Managers responsible for Learning and Skills; Heads of Service or/and Managers responsible for Communications (Press).  Please include full contact name, actual job title, direct contact numbers and direct email addresses."
10-08-2010-154050-001,08/09/2010,Please provide:  (a) The number of Reaper armed remotely piloted air systems deployed by the UK military in Afghanistan; (b) The number of times Reaper systems have been deployed on operations in each month for which records are available since the system entered operational service: (c) Details of the number of times weapons have been discharged from Reaper systems in each month for which records are available since the system entered operational service.
10-08-2010-161434-001,07/09/2010,(1) Which company bought the Victor B2 (SR) Aircraft from 543 Squadron based at RAF Wyton after disbandment between 1974 and 1980 (or about that time)? (2) At what date were the ex 543 Squadron Victor Aircraft disposed of?  (3) What was the disposal?  (4) What were the radiation readings of the ex 543 Squadron Aircraft? (5) What safety measures were taken (if any) and what was the recorded contamination at the time of disposal of each aircraft? Please quote each aircraft number against each reading.
11-08-2010-092805-001,06/09/2010,Various questions concerning Military Provost Guard Service.
11-08-2010-101629-001,08/09/2010,What is the cost of the annual families day event (this year on 9th August) at RAF Scampton is to the taxpayer.
11-08-2010-103249-001,08/09/2010,Information about any air craft flying over Wigan on the tenth of August 2010 at 23:35 and if it is a military craft in production or something that needs to be reported to the ministry as a UFO.
11-08-2010-104439-002,09/09/2010,"How many persons suffering from Post Traumatic Stress Disorder have you treated, year on year since 2000?  What interventions do you use, CBT, EMDR?  Which is most successful?  How many treated successfully?"
11-08-2010-105420-002,09/09/2010,Request for any recorded interviews or information on the incident in Rendlesham forest of an alleged buffo encounter.
11-08-2010-113854-003,09/09/2010,"I am contacting you because we are carrying out an investigation for a documentary film regarding the sinking of a ship in Cape Palos in 1917.  The ship in question is the THORDISA (also called LILLA, LLILIA DUBILD, or the CARBONERO)."
11-08-2010-115707-002,09/09/2010,All the information in the MoD's Afghan Claims Database for 2010 from January 1 to date.
