FREEDOM OF INFORMATION,,
11-08-2010-115744-003,07/09/2010,All information on allowances/ moneys and individual amounts claimed by staff at MDPGA Devon region 5 and copies of all receipts and claim forms pertaining to the claims over the last three years for each individual.
11-08-2010-120117-004,08/09/2010,Copies of all documents and communications between specified individual and the MOD regarding the Cosford Incident.
11-08-2010-120235-004,07/09/2010,How many of these personal who are on these restricted and recuperative duties are currently carrying out these duties away from their normal station or contracted station.
11-08-2010-144917-001,09/09/2010,"(1)  How many serving MOD Police officers, specifically uniformed officers on unarmed/armed guarding duty (not headquarters staff or admin staff) suffer from any form of hearing defect?  (2)  Do any MOD police officers use any form of hearing aid to assist them performing their respective unarmed/armed Police duties?"
11-08-2010-145106-002,03/09/2010,Specified individual requesting all management documents and emails relating to individual's employment.
11-08-2010-150900-001,09/09/2010,(1)  Provide the number of people who have committed suicide after returning from operations in Afghanistan or Iraq each year for the past five years. (2)  Break the figures down by age and rank?   (3)  Provide data on the number of attempted suicides every year for the past five years?
11-08-2010-151831-002,08/09/2010,"Searching for MoD Defence Estates Technical Bulletin 2001 entitled Limiting  Progressive Collapse issued 20 August 2001 (Draft ), on the defence estates website, do you have a copy available? "
11-08-2010-153954-001,07/09/2010,(1)  Details on the predicted savings from the DTR/DII and FDSCI at their outset and what were the initial costings for these initiatives at their outset?  (2) Details of what comparators were used in the bidding process for the DTR/DII and FDSCI?  (3) Details of the actual costs so far for the DTR/DII and FDSCI? (4) Details of the DTR/DII and FDSCI costs to date?  (5) Details of how the DTR/DII and FDSCI have monitored their costs and kept these to within their initial guidelines and their initial predicted costs? (6) Details of overspend for the DTR/DII and FDSCI?
11-08-2010-155459-003,13/08/2010,"(1) How many staff were included in the Award Group for DSDA Explosives Business Stream Band C1?  (2) Who were the staff I was assessed against (names only)?  (3)  What were the overall performance assessments in bands within this Award Group e.g. 1 x A; 4 x A-, etc?  (4)  What was the overall distribution of awards grouped by Standard, Higher and Top e.g. 15 x Standard; 3 x Higher; 2 x Top?"
12-08-2010-093413-001,09/09/2010,How many British Civil Servants have been granted extension beyond their 5 year tour length in Germany since 1 Apr 10?
12-08-2010-101415-001,10/09/2010,"Asking if the Browndown site [Gosport/Lee on Solent] is for sale and if so how is it being disposed of, auction or has a price been set"
12-08-2010-110613-002,09/09/2010,"Request for SAR statistics updated as far as available and also any clarification needed regarding its use. Also, let me know exactly what form of acknowledgment is required eg 'MOD/DASA statistics' (?)"
12-08-2010-110913-002,06/09/2010,Requesting the outcome of a request for information regarding an air accident involving a Lincoln aircraft at Welton Lincolnshire on 14th July 1951. If possible could you advise me of where I can find this information.
12-08-2010-130722-003,10/09/2010,"(1) How many officers are currently serving in the MDP at English stations, who have only ever been trained in Scottish Law? (2) How many officers are currently serving in the MDP at Scottish stations, who have only ever been trained in English Law?"
12-08-2010-134424-001,10/09/2010,"Looking for the marital status of the UK Armed Forces, including individuals who are single, divorced etc."
12-08-2010-135639-001,10/09/2010,"Provide the average length of service at promotion, and the percentage chance of promotion from entry and from the rank below, for Air Traffic Controllers and for Personnel Administration trades.  Also, provide detail of the training for Air Traffic Controllers with an indication of when they would expect to be promoted with each level of qualification and the relevant pay band when acting sergeant.  Finally, indicate which pay band ATC and Personnel administration are paid at for each relevant rank."
12-08-2010-153358-001,09/09/2010,Number of employees (Split by full time  and  part time): Payroll Supplier; Payroll Product Used; Payroll Contract Renewal Date; Length of Payroll Contract - Who has responsibility for the Payroll Solution Cost of Payroll Solution.  HR Supplier; HR Product Used; HR Contract Renewal Date; Length of HR Contract - Who has responsibility for the HR Solution Cost of HR Solution.
12-08-2010-161701-001,08/09/2010,I am currently conducting  research into the circumstances leading to the death of Lt. Chinner at Fromelles. I would be very grateful if Oxford Archaeology and/or the Ministry of Defence would kindly release to me any information as to evidence of trauma sustained by Lt. Eric Harding Chinner.
13-08-2010-101357-001,10/09/2010,Requesting information held by the MOD/RAF on the procurement of the de Havilland Mosquito.
13-08-2010-112708-001,10/09/2010,How many Open FOIA requests are currently awaiting reply? From what date?
13-08-2010-120108-001,10/09/2010,"(1) 	How many men/women are there in the armed forces in the UK in total (both active and non-active duty.  (2) 	How many active servicemen/women are there in the UK armed forces at the moment?  (3) 	How many injuries are obtained each year from men and women on active duty (this can include psychological and mental injuries)?  (4) 	What are the different types of injury that are common from men and women in the armed forces?"
13-08-2010-145420-001,13/09/2010,"(1) PJHQ is requested to provide a copy of the contract between MOD/PJHQ and Frontier Medical for the provision of medical contractors deployed on operations.  (2) Could PJHQ also provide information on the number of medical contractors, by specialties, that have been deployed on operations for each year, in Iraq and Afghanistan since 2003."
16-08-2010-100710-001,14/09/2010,Total number of MoD Civilian Staff employed at 102 Logs Brigade Germany including break down of industrial and non industrial staff.  Copy of the Hospitality book at DGT and  E with specific details of notifications by Rear Admiral Al Rymer and copies of correspondence between Rear Admiral Al Rymer and Deborah Hayes Times Defence Editor. Plus copies of correspondence between Liam Fox MP and representatives from Bell Pottinger.
16-08-2010-103505-001,13/09/2010,The investigation reports of the following aircrafts:  (1) Mosquito IV  Fighter Command  Squadron: Lost on 1944.11.01 (2) Halifax B.V. Bomber Command  Squadron: Lost on 1943.11.25.
16-08-2010-110058-002,14/09/2010,Reference Power Line Erthanet. Have MOD received any complaints from their personnel when using their communication equipment in the UK of interference to the frequencies used.
16-08-2010-111234-003,14/09/2010,"Information on the papers of the War Office's Directorate of Tactical Investigation, which operated during the war.  In particular, the papers or files from the Directorate of Tactical Investigation's Questionnaire and War Diary Section."
16-08-2010-115805-004,14/09/2010,"How many people were discharged ( include administrative discharge) at RAF Akrotiri, Cyprus in 1981 and 1982?"
16-08-2010-122421-002,14/09/2010,"Six questions relating to external full time degree courses attended by serving army personnel, paid for by the MOD for 2008/2010 (this excludes civilian staff) in study at Batchelor, Masters and Doctorate level."
16-08-2010-124643-003,14/09/2010,"A copy of the Safety Improvement Notice, DNSR issued on 22 April 2010 relating to the failure to remove hull test blanks on HMS TIRELESS and HMS TURBULENT."
16-08-2010-130117-004,14/09/2010,"(1) Between the year 2000 and the present year of 2010, how many training exercises have been conducted over the Lake District?  (2) Between the year 2000 and the present year of 2010, how often has there been a nea-miss?  Either: any occasion where a report of a near-miss mid-air collision has been filed to the relevant agency(s); any occasion where an RAF pilot has expressed concern over other aircraft, too close or not, in his vicinity during a practice operation; any report by private pilots about a near-miss with an MOD aircraft in the skies of Cumbria.  (3) Has there, in the last decade, been any occasion when an accident, a mid-air collision or otherwise, nearly occurred?  (4) What measures are in place to ensure the safety of the residents in Cumbria and those of private pilots when the RAF is conducting an exercise?  (5) Could you confirm why Cumbria is used so frequently as a training ground for military aircraft and is it the most-used part of the UK for such training?"
16-08-2010-130636-005,14/09/2010,"The MOD have released 6 batches of files via the National Archives under FoIA relating to UFOs.  A number of redactions in some of those files relating to a specified individual, some of which appear to be unnecessary, including the titles of some of his books, references to him in newspaper articles, and responses to members of the public related to the nature of his work when he was at Sec(AS)2.  I would like to know what that specific policy is, and the rationale for it, ideally having sight of any relevant documents.  Has the MoD received any suggestion from the specified individual or his representatives implying a risk of legal action if he was unhappy with the release of any unredacted material?"
16-08-2010-144238-001,14/09/2010,Any statistics you have / are available to provide regarding the disposal sales agency revenues form their textiles contract.
16-08-2010-152523-001,13/09/2010,The total number of troops (reserves and regular) that have been deployed to both Iraq (2003-2009) and Afghanistan (2001- current).
16-08-2010-153614-002,14/09/2010,"Request for files that are listed in the catalogue of the National Archives at Kew, but are marked as retained in the department."
16-08-2010-154216-003,14/09/2010,"The number of journalists from British news organisations (both local and national) that have been embedded with the military in both Iraq and Afghanistan each year from 2001 to the present.  Also, how much the embedded system of reporting has cost the MOD since 2001 to the present on a year by year basis."
16-08-2010-155109-004,10/08/2010,"Information exchanged in meetings held between the MoD and directors of North British Windpower Limited at Graham Terrace, London SW1 concerning Fallago Rig Windfarm, to include the dates, times, purpose and attendees of those meetings."
16-08-2010-155717-005,07/09/2010,"The number,  cause and response to any alerts at Torness East Lothian in 2008, 2009 & 2010 that have been caused by aircraft flying too close, entering restricted airspace or following unusual or unauthorised flight planes or other reasons."
16-08-2010-161137-006,07/09/2010,"The object, purpose and results of the recent flight and approach trials that have been taking place around Torness in East Lothian.  Also, provide any information related to tests & trials to ascertain gaps in air defence radar coverage caused by windfarms in East Lothian and Scottish Borders"
16-08-2010-161720-007,06/09/2010,"A list of everyone - person and organization, department or company, private individuals, ministers or officials who have received copies (to include classified, unclassified and summaries or extracts) of the Additional Radar Study carried our in association with the BWEA into radar mitigation for windfarms at RAF Brizlee Wood."
16-08-2010-162214-008,06/09/2010,"The date, location, purpose and attendees of any meeting between Vice Admiral Tim Laurence and either Sir John Chilcot, Sir Malcolm Rifkind or Michael Ancrum in 2009 or 2010."
16-08-2010-163004-009,26/08/2010,Information given to the new Secretary of State for Defence and his associated Ministers since they took up office concerning the Additional Radar Study report into the possible mitigation or effects of wind turbines on radar.
16-08-2010-163500-010,26/08/2010,Information and correspondence exchanged between the MoD and the Scottish Government's DPEA Dept of Planning and Environmental Appeals concerning the release of the unclassified version of the Additional Radar Study since March 2010 until current date.
16-08-2010-163904-011,25/08/2010,Information on the costs to the MoD of the Air Defence Radar Additional Radar Study commissioned by the MoD 24 September 2009 together with a list of any contributors to that cost.
16-08-2010-165833-012,25/08/2010,Information included in the unclassified version of the Air Defence Radar Additional radar Study commissioned by the MoD 24 September 2009.  Also indicate which members of the BWEA this report has been circulated to
16-08-2010-170351-013,25/08/2010,A list of staff at the MoD that have met with Sir John Chilcot since 2009 including date and location of meeting
16-08-2010-170958-014,16/08/2010,Information contained in the MoD's consultation response to the Scottish Government's section 36 application for Wester Dod/Aikengall II windfarm.
16-08-2010-172108-015,14/09/2010,Information regarding file released under the terms of the FoIA in redacted form to TNA (TNA ref. DEFE24-2000) who then made the file available to the public in February of this year.
16-08-2010-173448-016,13/09/2010,"Confirm whether or not this is the view formed by the MoD, regarding previous FOI requests and if so, how the specified individual is aware of the MoD views?"
17-08-2010-095301-001,14/09/2010,Unredacted copies of enclosure 19 from file D/Sec(AS)/64/3 part E dated 4/11/96 and the letter dated 25/10/96 from a member of the public which it is in response to.
17-08-2010-100503-002,14/09/2010,Information regarding Indian doctors in first world war.
17-08-2010-103000-003,15/09/2010,Clarification on some figures received for list provided from the MoD press office.
17-08-2010-103635-004,03/09/2010,The general arrangement plans and/or line drawings of HMS ENDURANCE to build a scale model.
17-08-2010-122343-005,15/09/2010,I would like to know if RAFVR(T) Officers have any jurisdiction over Officers holding full service commissions in HM Armed Forces?
17-08-2010-122916-006,15/09/2010,The RAF records of a specified late Wing Commander including details of any decorations etc.
17-08-2010-140329-001,14/09/2010,A copy of all e-mails sent by HQAC staff regarding the website Air Cadet Central.
17-08-2010-140627-002,14/09/2010,A copy of all e-mails sent to HQAC regarding Air Cadet Central.
17-08-2010-161644-002,13/09/2010,(1) The minimum level of officer who can authorise: (a) a USAF flight originating from a UK RAF base to operate in an LFA after 23.00; (b) the operation of RAF and Army rotary wing aircraft in an LFA but not over MoD owned land and under 250 feet. (2) The criteria laid down in each case that have to be addressed in order for such authorisation to be given.
17-08-2010-162348-001,09/09/2010,"Details regarding the minimum Standard of Protection (SoP) of any section(s) of sea wall falling under the responsibility of MoD to maintain or improve on the Northern and Eastern flanks of Great Wakering and Shoeburyness?  Also, identify the location(s) of such section(s) providing only that minimum standard?  Lastly, what is the maximum SoP provided by any section(s) of sea wall falling under the responsibility of MoD to maintain or improve on the Northern and Eastern flanks of Great Wakering and Shoeburyness?"
17-08-2010-162743-002,03/09/2010,"Reference the re-thatching of Woodmins Cottage (Fifield) and the new doors and gates to Wains Way have taken place without any prior notification to us can you please supply us with all documentation, correspondence with third parties, internal memos including with all consultants and public-private partners, relating to these two properties over the past 10 years including builders/thatchers quotes for the carrying out of these works and the final contracts for works carried out, including all photographs taken of these buildings to date. Also, a copy of this financial year's planned works for repairs to any part of Choulston Farm."
17-08-2010-163229-003,31/08/2010,"All copies of all internal memos, reports and all other documents, and correspondence between the Defence Estates and any of its agents, including consultants and public-private partners and the specified family and any other correspondence with other third parties such as neighbours, Parish Council, the Electricity Board etc concerning our field bordering Meadow View, and Meadow View over the past 10 years."
17-08-2010-163620-004,26/08/2010,"Copies of all minutes notes correspondence and other records concerning internal discussions within Defence Estates and between its agents (including all public-private partners and external discussions involving other departments or third parties relating in any way to Figheldean New Buildings, part of Choulston Farm over the past five years.  Also an explanation as to why the senior land agent and Commanding Officer were trespassing on Choulston Farm last market day (Tuesday)."
18-08-2010-080258-001,31/08/2010,Disaggregate the cost data provided in response to previous request.  A split between domestic production and imports and between portable guided missiles/launchers and all other light weapons.
18-08-2010-085428-001,23/08/2010,Information relating to strategy or policy relating to information technology in your organisation.
18-08-2010-090315-002,15/09/2010,Tyneham village situated on the tank training ranges in Dorset ask for a donation for parking.  This money is per the notice used for the upkeep of Tyneham valley.  Please send me a copy of the accounts showing the income received and how this money is spent for the year 2008/2009.  As no tickets are issued how can you guarantee that all monies donated are being accounted for?  Who oversees the expenditure of this money?  Are their trustees overseeing the expenditure?
18-08-2010-091438-003,15/09/2010,The cost of providing security for HRH Prince Harry's 2008 tour of duty in Afghanistan.
18-08-2010-092031-004,15/09/2010,"The total yearly spend to all private contractors, contracting companies and consultants in Afghanistan for each of the last five financial years. Request a breakdown of the figures during this time illustrating which and how many contracts were paid to different specialised areas such as security, logistics etc."
18-08-2010-093334-005,15/09/2010,"How many vacant properties and how much unused land does defence estates (MOD) currently own in Gibraltar? Also, is any MOD land or property to be disposed of in Gibraltar in the future?"
18-08-2010-094120-006,15/09/2010,"How many Muslims joined the British army. Do they have special rights ex. to pray 5 times a day, to eat special dishes etc.  Are they accepted by the others? Was it any problem to create the special conditions for them? How they execute the tasks given to the? Do they salute to the other officers representing different religions. ."
18-08-2010-094953-007,15/09/2010,"A copy of the review, Review of UK Nuclear Weapon Safety Criteria - A Report by the Nuclear Weapon Safety Criteria Review Working Group, Draft A, 7 Feb 0 and any subsequent updates?"
18-08-2010-101106-001,15/09/2010,Estimated Defence Expenditure Outturn in the UK from 1990 to 2008.
18-08-2010-115801-008,20/08/2010,"How many troops in Afghanistan, in the last 3 years on a month-by-month basis, have suffered heat exhaustion and heat stroke in and out of vehicles"
18-08-2010-121350-009,15/09/2010,"How many personnel from the Armed Forces were subject to initial or periodic-review of developed vetting in 08/09. Of those personnel, how many declared “in response to MOD Form 1938 question 30 b or c“ that they either cross-dressed, were transvestite, transgendered or gender dysphoric? "
18-08-2010-162028-002,16/09/2010,"The brief compiled for the Minister Kevan Jones regarding specified individusl's complaint against awarding a specified individual Death in Service Benefits.  Also, any other paperwork supplied to that Minister regarding my complaint."
18-08-2010-163829-001,16/09/2010,"The latest casualty and fatality tables (attached) specific to the battalions 1st Mercian, 1st Duke of Lancs, 2nd Duke of Lancs and 4th Duke of Lancs?"
18-08-2010-171004-003,16/09/2010,A detailed breakdown of all MoD ?running costs? ? as covered by Liam Fox?s definition - for the last full financial year? 
18-08-2010-171449-004,16/09/2010,"(a) Items of art that were moved into each ministerial private office - including an estimate of the approximate value of each item if available, details about the artist and who owns the art - since 12 May 2010. (b) Items of art that were moved into offices occupied by Special Advisers in your Department - including an estimate of the approximate value of each item if available, details about the artist and who owns the art - since 12 May 2010. (c) Free-standing or wall clocks - including their age and approximate value if available - that are in ministerial private offices since 12 May 2010.  (d) Free-standing or wall clocks - including their age and approximate value if available - that are in offices occupied by Special Advisers in your Department since 12 May 2010."
19-08-2010-093042-001,16/09/2010,(1) How many (a) paintings and (b) other works of art have gone missing from Ministry of Defence premises in each year since 1997? (2) How many of these (a) paintings and (b) other works of art have been (i) stolen and (ii) lost? (3) What are the titles of the (a) paintings and (b) other works of art that have been stolen or lost? (4) What is the value of each (a) painting and (b) other work of art that has been stolen or lost? (5) How many (a) paintings and (b) other works of art have been bought by the Ministry of Defence since 1997 and what were the dates of purchase? (6) How much was paid for each work of art? (7) What were these works of art called? 
19-08-2010-093427-002,16/09/2010,"List which media organisations have had representatives embedded with the British Armed Forces in Afghanistan since January 2006, where they were embedded and what was the duration of their embed? "
19-08-2010-100614-003,16/09/2010,Seven questions relating to the fallback plan for DTR can the DTC at St Athan.
19-08-2010-103615-001,16/09/2010,Investigate the data in table 2.14 regarding numbers of non-UK service personnel and see whether it can be broken down into the contributing nationalities.
19-08-2010-113607-001,17/09/2010,"The number of foreign citizens trained at (a) Sandhurst (b) Britannia Royal Naval College at Dartmouth and c) the Royal College of Defence Studies in each year since 1997.  Also, breakdown the figures by nationality."
19-08-2010-120708-002,17/09/2010,Could I please have a copy of DCI JS 53/99.
19-08-2010-152659-001,17/09/2010,Copy of the new Secretary of State's Health Safety Policy Statement.
20-08-2010-103040-001,17/09/2010,"Receipt and spendings budgets for 2009 and 2010, broken down by institutions you receive money from, including the amount of money received from each."
20-08-2010-112041-002,26/08/2010,"Information on the contamination investigation and remediation for land at Ha Ha Rd, Woolwich."
20-08-2010-120522-003,16/09/2010,"Copy of jobs logged for Abbey Court, Waterbeach, Cambridge"
20-08-2010-122111-004,07/09/2010,How many employees does the authority/department have and vehicles use and the CO2 emissions.
20-08-2010-151802-001,20/09/2010,A copy in full of any data about specified individual that you hold.
20-08-2010-152704-002,20/09/2010,"I'd like to speak to somebody about Forces ID cards, the checks that are undertaken into date of birth and the potential for these cards to satisfy retailers' obligations under age-restricted sales legislation"
20-08-2010-153845-003,20/09/2010,The article refers to a new maintenance strategy called 'Contracting for Availability' and I was interested to see if I could get more information regarding this approach for possible inclusion into our contracts.
20-08-2010-154542-004,20/09/2010,How many non SFA empty houses are in Aldershot that could be either sold or let.
20-08-2010-160944-005,20/09/2010,"Details of all the service personnel who have gone AWOL in the past ten years, all those who have subsequently been prosecuted for desertion and the sentences they have been given and where they have been detained."
20-08-2010-170519-006,14/09/2010,Details of Low Flying Helicopter.
20-08-2010-171252-007,16/09/2010,The list and/or criteria that allows an individual to become eligible for the Manning Control Points for the year 2010.
23-08-2010-092809-001,17/09/2010,Detailed breakdown by regiment of the numbers of soldiers who have been recorded absent without leave in the last twelve months (August 2009 to August 2010).
23-08-2010-093510-002,17/09/2010,Breakdown of the number of soldiers who were registered as being absent without leave from May 24 2010 up to the present. Please could you break these down by army navy and airforce.
23-08-2010-101811-001,20/09/2010,"Whether a financial reserve has been made in the ministry of defence budget for the court case 1,000 nuclear test veterans and widows."
23-08-2010-111434-002,21/09/2010,What medical specialities does the army require from its civilian doctors
