"Post Unique Reference","Name","Grade (or equivalent)","Job Title","Job/Team Function","Parent Department","Organisation","Unit","Contact Phone","Contact E-mail","Reports to Senior Post","Salary Cost of Reports (£)","FTE","Actual Pay Floor (£)","Actual Pay Ceiling (£)","","Professional/Occupational Group","Notes","Valid?"
"1167535","General Sir P Wall KCB CBE ADC Gen","OF-9","Chief of the General Staff","CGS is the professional head of the Army. He is responsible for generating a balanced and integrated Army capability, and for maintaining the fighting effectiveness, efficiency and morale of the Service. He reports to the Chief of the Defence Staff (CDS). As a member of the Defence Council and the Army Board, the Defence Ministerial Committee, the Defence Board, the Chiefs of Staff Committee and the Senior Appointments Committee he contributes to the conduct of Defence higher level business, with a particular responsibility for providing specialist advice on Army matters. He chairs the Executive Committee of the Army Board.","Ministry of Defence","Ministry of Defence","Army","01264 886108","LF-Sec-Group@mod.uk","XX","N/D","1.00","165000","169999","","Military","","1"
"1603303","N/D","OF-6","Provost Marshall (Army)","Provost Marshal (Army) (PM (A)) is the Head of Service and Director of The Provost Branch of the Adjutant General’s Corps. The Provost Branch comprises 3 distinct organisations: the Royal Military Police; the Military Provost Staff; and the Military Provost Guard Service. PM (A) is appointed by CGS with responsibility to provide the necessary military police, custodial and guarding services to the Army, whilst acting as CAA &I for investigations, detention and close protection. PM (A) is also appointed by the Secretary of State for Defence as Inspector of Military Establishments (Army) (I of ME (A)).","Ministry of Defence","Ministry of Defence","Army","01264 886108","LF-Sec-Group@mod.uk","1167535","N/D","1.00","N/A","","","Military","Salary cost of report not inclusive of LEC salaries","1"
"1173817","N/D","OF-6","Army Inspector","The Army Inspector is the 1* conscience of the Army and reports directly to CGS. His mission is: ‘to ensure appropriate assurance and regulation for all Army activity across Defence, in order to enhance and sustain the operational effectiveness and reputation of the Army, now and in the future’.","Ministry of Defence","Ministry of Defence","Army","01264 886108","LF-Sec-Group@mod.uk","1167535","N/D","1.00","N/A","","","Military","","1"
"1601327","Lieutenant General N P Carter CBE DSO","OF-8","Team Leader Army 2020","The Army 2020 Study will be proposing a model for the Army in 2020 designed to deliver against current Military Tasks, yet sufficiently flexible to deliver against future tasks, given a regular Army of 82,000 and a trained reserve of 30,000. The Study’s work will cross all Defence Lines of Development, underpinned by an enduring requirement to deliver the moral, physical and conceptual components of fighting power. Recognising that sustaining the campaign in Afghanistan remains Defence’s Main Effort, a way point for the Study's recommendations will be the Interim Force Structure of 2015 which envisages a regular Army of 89,360 and trained reserve of 30,000.","Ministry of Defence","Ministry of Defence","Army","01264 886108","LF-Sec-Group@mod.uk","1167535","N/D","1.00","125000","129999","","Military","Filling Commander Field Army liability, a post which has been deleted. The post of Team Leader A2020 will fold on completion of the Army 2020 project; likely Q4 2012.","1"
"1178844","Major General J R Everard CBE","OF-7","Assistant Chief of the General Staff","ACGS’s Mission is to support CGS in his roles, and set the conditions for the Army to contribute to success on operations by influencing MOD decision making, securing resources, converting Defence policy into Army policy, ensuring coherence across the DLoDs – both across the Army and within Arms and Services – and developing the Army of the future.","Ministry of Defence","Ministry of Defence","Army","01264 886108","LF-Sec-Group@mod.uk","1167535","N/D","1.00","N/A","","","Military","","1"
"1174823","N/D","OF-6","Brigadier General Staff","The General Staff’s Mission is to formulate policy for the Army, as directed by the Chief of the General Staff, and communicate that policy as authoritative direction for execution by the Army.","Ministry of Defence","Ministry of Defence","Army","01264 886108","LF-Sec-Group@mod.uk","1178844","N/D","1.00","N/A","","","Military","","1"
"1170393","Vacant","OF-6","Brigadier Equipment Strategy (Army)","BES(A) is responsible for the Army Equipment Strategy. He represents the Army ‘User’ for equipment capability management and planning in order to sustain the Army’s capability to fi ght at all scales of effort and at the highest intensity as required within Defence Planning Assumptions. BES(A) supports Army HQ in capability delivery as required.","Ministry of Defence","Ministry of Defence","Army","N/A","LF-Sec-Group@mod.uk","1178844","N/D","1.00","N/A","","","Military","","1"
"1574502","N/D","OF-6","Brigadier Media and Communication (Army)","On behalf of CGS, BMC(A) plans and coordinates all Army communication activities in direct support of Defence Media and Communications' objectives. BMC(A) is required to conduct agile, coherent and influential internal and external communication in order to improve an understanding of the Army and thereby maintain, protect and enhance the Army's capability and reputation. BMC(A) directs all Army communication assets, from press officers and presentation teams to publications and websites.","Ministry of Defence","Ministry of Defence","Army","01264 886108","LF-Sec-Group@mod.uk","1178844","N/D","1.00","N/A","","","Military","","1"
"1601318","N/D","OF-6","Director Plans","To direct Army HQ forward planing, force development, organisational change, resource planning and use information as a resource.","Ministry of Defence","Ministry of Defence","Army","01264 886108","LF-Sec-Group@mod.uk","1178844","N/D","1.00","N/A","","","Military","","1"
"1598314","General Sir Nick Parker KCB CBE","OF-9","Commander Land Forces","Commander Land Forces is to establish Land Force Command integrating the Field Army, the Reserves, the Firm Base, and the JHC; generate land forces for Op HERRICK; generate land forces for other national and overseas operations, including contingency forces; as Standing Joint Commander (UK) provide the military support to national operations, including support to the 2012 Olympic Games; develop a land force collective training strategy; develop Reserve Forces, implementing the recommendations of the 2010 Reserves Commission; integrate the Reserves into a WFC alongside the Regular Army; provide the Firm Base as a foundation for the institutional wellbeing of the Army and its families with necessary supporting functions, including issues enshrined in the Service Personnel Command Paper; and deliver the reduced civil service manpower structure within CLF, minimizing detriment to outputs.","Ministry of Defence","Ministry of Defence","Army","01264 886108","LF-Sec-Group@mod.uk","1167535","2381718858","1.00","165000","169999","","Military","Structural change, CinC LF has transformed into Commander Land Forces. Once the incumbent departs the post will be downgraded to OF-8. Salary cost of report not inclusive of LEC salaries.","1"
"1162954","Major General D M Cullen OBE","OF-7","Chief of Staff Land Forces","Chief of Staff Land Forces is responsible for the command and management of Army HQ including: the coordination of work across all Lines of Development, supported by DG LS&E on the Logistics and Equipment lines; the development and implementation of the LF communications plan in support of Defence and Army communications plans; and driving change and continuous improvement across the HQ.","Ministry of Defence","Ministry of Defence","Army","01264 886108","LF-Sec-Group@mod.uk","1598314","44275016","1.00","N/A","","","Military","","1"
"1654603","Major General the Duke of Westminster KG CB OBE TD DL","OF-7","Deputy Commander Land Forces","Responsible for recruiting and training of Reserves for current and future operations, in conjunction with DG ART. DCLF will direct the staff and coordination of the force generation and deployment of the Reserves within the Army for Op HERRICK, contingency and UK operations. DCLF will assist CLF in migrating TA C2 under the Regular Army structure.","Ministry of Defence","Ministry of Defence","Army","01264 886108","LF-Sec-Group@mod.uk","1598314","N/D","1.00","N/A","","","Military","Does not draw a salary TA Officer, no UKP liability","1"
"01330433","N/D","OF-6","Assistant Chief of Staff Support","Assistant Chief of Staff Support controls the Land Forces plans and resources staff and has responsibility for delivering organisational and structural change within the Field Army.","Ministry of Defence","Ministry of Defence","Army","01264 886108","LF-Sec-Group@mod.uk","1598314","N/D","1.00","N/A","","","Military","New post augmenting the new Commander Land Forces Headquarters, recognising the additional responsibilities passed from Personnel Support Command to Commander Land Forces. Principal of which is the responsibility for delivery of the Firm Base.","1"
"1601488","N/D","OF-6","Assistant Chief of Staff Operations","The Commitments Directorate (Cts Dir) has 3 branches: Counter-Terrorism & United Kingdom Operations (CT & UK Ops), which includes the Standing Joint Commander UK (SJC(UK)); Counter-Improvised Explosive Devices (C-IED); and Operations Commitments (Ops Cts).","Ministry of Defence","Ministry of Defence","Army","01264 886108","LF-Sec-Group@mod.uk","1598314","N/D","1.00","N/A","","","Military","Previous post title: Director Commitments","1"
"1601441","N/D","OF-6","Director Olympics","Support Standing Joint Commander in coordinating and delivering military and security support to the 2012 Olympic Games.","Ministry of Defence","Ministry of Defence","Army","01264 886108","LF-Sec-Group@mod.uk","1598314","N/D","1.00","N/A","","","Military","Lifed post using COS Field Army liability","1"
"1227878","Major General J I Bashall CBE","OF-7","General Officer Commanding 1 (UK) Armoured Division","Contribute to the delivery of Op ENTIRETY to ensure optimal contribution, in all aspects, towards the successful execution of a COIN campaign in Southern Afghanistan. Prepare force elements and individuals for current operations, primarily Afghanistan, and readiness within allocated resources. As directed, contribute to the correct allocation of in-service equipment capability to enable Force Preparation and Generation; manage and maintain equipment allocated to 1 (UK) Div. As directed, deliver the required collective training for all Force Elements assigned to 1 (UK) Div. Improve our service to families, especially during periods when a family member is deployed on operations. Confirm understanding of leadership and discipline standards. Increase and enhance the deployability of soldiers within 1 (UK) Div. When required, allocate Force Elements in support of Army Interoperability and International Security Activities.","Ministry of Defence","Ministry of Defence","Army","01264 886108","LF-Sec-Group@mod.uk","1598314","N/D","1.00","N/A","","","Military","","1"
"1167986","N/D","OF-6","Commander 7 Armoured Brigade","Comd 7 Armd Bde is to command OPCOM troops and prepare and deliver force elements in role in order to contribute to the Land Command and UK Defence capability. As directed, deliver the required collective training for all Force Elements assigned to 7 Armd Bde. Increase and enhance the deployability of soldiers within 7 Armd Bde.","Ministry of Defence","Ministry of Defence","Army","01264 886108","LF-Sec-Group@mod.uk","1227878","N/D","1.00","N/A","","","Military","","1"
"1169246","N/D","OF-6","Commander 20 Armoured Brigade","Comd 20 Armd Bde is to command OPCOM troops and prepare and deliver force elements in role in order to contribute to the Land Command and UK Defence capability. As directed, deliver the required collective training for all Force Elements assigned to 20 Armd Bde. Increase and enhance the deployability of soldiers within 20 Armd Bde.","Ministry of Defence","Ministry of Defence","Army","01264 886108","LF-Sec-Group@mod.uk","1227878","N/D","1.00","N/A","","","Military","","1"
"1229309","N/D","OF-6","Commander Artillery 1 (UK) Division","Comd Arty 1 (UK) Div is to command OPCOM troops, prepare and deliver force elements within the Divisional Artillery Group and facilitate the planning and delivery of all Fires and Influence activity within 1 (UK) Div.","Ministry of Defence","Ministry of Defence","Army","01264 886108","LF-Sec-Group@mod.uk","1227878","N/D","1.00","N/A","","","Military","","1"
"1172125","Major General J G Lorimer DSO MBE","OF-7","General Officer Commanding 3 (UK) Division","Contribute to the delivery of Op ENTIRETY to ensure optimal contribution, in all aspects, towards the successful execution of a COIN campaign in Southern Afghanistan. Prepare force elements and individuals for current operations, primarily Afghanistan, and readiness within allocated resources. As directed, contribute to the correct allocation of in-service equipment capability to enable Force Preparation and Generation; manage and maintain equipment allocated to 3 (UK) Div. As directed, deliver the required collective training for all Force Elements assigned to 3 (UK) Div. Improve our service to families, especially during periods when a family member is deployed on operations. Confirm understanding of leadership and discipline standards. Increase and enhance the deployability of soldiers within 3 (UK) Div. When required, allocate Force Elements in support of Army Interoperability and International Security Activities.","Ministry of Defence","Ministry of Defence","Army","01264 886108","LF-Sec-Group@mod.uk","1598314","N/D","1.00","N/A","","","Military","","1"
"1223786","N/D","OF-6","Commander 1 Mechanised Brigade","Comd 1 Mech Bde is to command OPCOM troops and prepare and deliver force elements in role in order to contribute to the Land Command and UK Defence capability. As directed, deliver the required collective training for all Force Elements assigned to 1 Mech Bde. Increase and enhance the deployability of soldiers within 1 Mech Bde.","Ministry of Defence","Ministry of Defence","Army","01264 886108","LF-Sec-Group@mod.uk","1172125","N/D","1.00","N/A","","","Military","","1"
"1169362","N/D","OF-6","Commander 4 Mechanised Brigade","Comd 4 Armd Bde is to command OPCOM troops and prepare and deliver force elements in role in order to contribute to the Land Command and UK Defence capability. As directed, deliver the required collective training for all Force Elements assigned to 4 Armd Bde. Increase and enhance the deployability of soldiers within 4 Armd Bde.","Ministry of Defence","Ministry of Defence","Army","01264 886108","LF-Sec-Group@mod.uk","1172125","N/D","1.00","N/A","","","Military","","1"
"1140683","N/D","OF-6","Commander 12 Mechanised Brigade","Comd 12 Mech Bde is to command OPCOM troops and prepare and deliver force elements in role in order to contribute to the Land Command and UK Defence capability. As directed, deliver the required collective training for all Force Elements assigned to 12 Mech Bde. Increase and enhance the deployability of soldiers within 12 Mech Bde.","Ministry of Defence","Ministry of Defence","Army","01264 886108","LF-Sec-Group@mod.uk","1172125","N/D","1.00","N/A","","","Military","","1"
"1215776","Eliminated","OF-6","Commander 19 Light Brigade","Comd 19 Lt Bde is to command OPCOM troops and prepare and deliver force elements in role in order to contribute to the Land Command and UK Defence capability. As directed, deliver the required collective training for all Force Elements assigned to 19 Lt Bde. Increase and enhance the deployability of soldiers within 19 Lt Bde.","Ministry of Defence","Ministry of Defence","Army","N/A","LF-Sec-Group@mod.uk","1172125","N/D","1.00","N/A","","","Military","19 Light Brigade deleted as a result of SDSR, Brigade Commander's post eliminated.","1"
"1172331","N/D","OF-6","Commander Artillery 3 (UK) Division","Comd Arty 3 (UK) Div is to command OPCOM troops, prepare and deliver force elements within the Divisional Artillery Group and facilitate the planning and delivery of all Fires, Targeting and Air-Land Integration activity within 3 (UK) Div.","Ministry of Defence","Ministry of Defence","Army","01264 886108","LF-Sec-Group@mod.uk","1172125","N/D","1.00","N/A","","","Military","","1"
"1151649","Major General S A Burley MBE","OF-7","General Officer Commanding Theatre Troops","Th Tps is responsible for the provision of Combat Support (CS) and Combat Service Support (CSS) operations world-wide in support of the UK’s Defence Strategy. GOC Theatre Troops commands approximately 32,000 regular and reserve personnel, and a further 1100 civil servants.","Ministry of Defence","Ministry of Defence","Army","01264 886108","LF-Sec-Group@mod.uk","1598314","N/D","1.00","N/A","","","Military","","1"
"1242034","N/D","OF-6","Commander 8 Force Engineer Brigade","Comd 8 Force Generates the C-IED TF, MSSG, RE support to HQ AIR, the RE Works Gp and co-ordinates the training for the Engr Gp for HERRICK. Much of this is beyond OPCOM units. He is also CRE Fd Army and Standing Joint Force Engr in PJHQ.","Ministry of Defence","Ministry of Defence","Army","01264 886108","LF-Sec-Group@mod.uk","1151649","N/D","1.00","N/A","","","Military","","1"
"1260044","N/D","OF-6","Commander 1 Signals Brigade","Comd 1 Sig Bde is to command Operational Command troops, and prepare and deliver Command Support and General Support Communication Information Systems to Headquarters Allied Rapid Reaction Corps in order to contribute towards the UK military commitment to NATO.","Ministry of Defence","Ministry of Defence","Army","01264 886108","LF-Sec-Group@mod.uk","1151649","N/D","1.00","N/A","","","Military","","1"
"1149069","N/D","OF-6","Commander 2 Signal Brigade","Comd 2 Sig Bde is to deliver specialist Information Communication Services at endorsed readiness in order to enable effective command and control of Expeditionary, OGD and UK Operations.","Ministry of Defence","Ministry of Defence","Army","01264 886108","LF-Sec-Group@mod.uk","1151649","N/D","1.00","N/A","","","Military","","1"
"1266346","N/D","OF-6","Commander 11 Signals Brigade","Comd 11 Signal Brigade commands and FORGEN the 5 x Campaign Signal Regiments for HERRICK; EWSI capability for HERRICK and contingent ops; and Level 3 technical support for worldwide Army CIS and Log NEC capability. In addition the Bde delivers complex CIS projects onto operations and provides CIS support to PDT for HQ TFH and its BGs as well as JFSp(A).","Ministry of Defence","Ministry of Defence","Army","01264 886108","LF-Sec-Group@mod.uk","1151649","N/D","1.00","N/A","","","Military","","1"
"1484098","N/D","OF-6","Commander 101 Logistics Brigade","Comd 101 Log Bde is to command OPCOM troops and prepare, maintain and when ordered, deploy designated Force Elements in order to provide Joint Force Suppport and, if necessary, Land Component 3rd Line Logistic capability.","Ministry of Defence","Ministry of Defence","Army","01264 886108","LF-Sec-Group@mod.uk","1151649","N/D","1.00","N/A","","","Military","","1"
"1167141","N/D","OF-6","Commander 102 Logistics Brigade","Comd 102 Log Bde is to command OPCOM troops and prepare, maintain and when ordered, deploy designated Force Elements in order to provide Joint Force Suppport and, if necessary, Land Component 3rd Line Logistic capability.","Ministry of Defence","Ministry of Defence","Army","01264 886108","LF-Sec-Group@mod.uk","1151649","N/D","1.00","N/A","","","Military","","1"
"1217095","N/D","OF-6","Commander 104 Logistics Support Brigade","Comd 104 Log Sp Bde is to command OPCOM troops and prepare, maintain and when ordered, deploy designated Force Elements in order to provide Joint Force Suppport and, if necessary, Land Component 3rd Line Logistic capability.","Ministry of Defence","Ministry of Defence","Army","01264 886108","LF-Sec-Group@mod.uk","1151649","N/D","1.00","N/A","","","Military","","1"
"1474760","N/D","OF-6","Commander 2 Medical Brigade","2 Med Bde is to: a. Op ENTIRETY. Contribute to the optimal delivery of Op ENTIRETY in order to ensure the sucessful execution of the COIN campaign in Afghanistan. b. Force Generation. Prepare Force Elements and individuals for current operations, primarily Afghanistan, and readiness within allocated resources.","Ministry of Defence","Ministry of Defence","Army","01264 886108","LF-Sec-Group@mod.uk","1151649","N/D","1.00","N/A","","","Military","","1"
"1167888","Major General N J Caplin CB","OF-7","General Officer Commanding British Forces Germany","General Officer Commanding British Forces Germany is to deliver the Firm base, championing overseas support, whilst managing the drawdown in Germany, in order to provide land military capability in the most effective and efficient manner.","Ministry of Defence","Ministry of Defence","Army","01264 886108","LF-Sec-Group@mod.uk","1598314","N/D","1.00","N/A","","","Military","","1"
"1225305","N/D","OF-6","Deputy Commander British Forces Germany","Support GOC British Forces Germany in delivering principal BFG outputs and achieveing the BFG mission.","Ministry of Defence","Ministry of Defence","Army","01264 886108","LF-Sec-Group@mod.uk","1167888","N/D","1.00","N/A","","","Military","","1"
"1523140","N/D","OF-6","Director British Forces Germany Health Service","To improve the health of the Army by assuring the delivery of appropriate, safe and timely healthcare, ensuring that the Army is supported by robust and sustainable services in order to maximise operational effectiveness.","Ministry of Defence","Ministry of Defence","Army","01264 886108","LF-Sec-Group@mod.uk","1167888","N/D","1.00","N/A","","","Military","Post previously under command General Officer Commanding UK Support Command.","1"
"1146049","Major General G P R Norton CBE","OF-7","General Officer Commanding London District and Major General The Household Division","To Deliver State Ceremonial and Public Duties in London and Windsor; Force generate and prepare regular and TA force elements; Provide the necessary Firm Base support within boundaries in order to meet CLF’s operational requirements and wider Defence needs.","Ministry of Defence","Ministry of Defence","Army","01264 886108","LF-Sec-Group@mod.uk","1598314","N/D","1.00","N/A","","","Military","Post previously previously under command Adjutant General.","1"
"1146077","N/D","OF-6","Deputy Commander London District","Support GOC London District in delivering principal London District outputs and achieving the London District Mission.","Ministry of Defence","Ministry of Defence","Army","01264 886108","LF-Sec-Group@mod.uk","1146049","N/D","1.00","N/A","","","Military","","1"
"00386481","Major General C J Boag CBE","OF-7","General Officer Commanding Support Command","Support Command is to: - Provide the necessary support to the successful delivery of both UK Operations and the execution of Op HERRICK. - Achieve the specified tasks in support of the achievement of Firm Base Outputs - As directed, support the sustainment of the Army's Moral Component in order to deliver success on operations in Afghanistan and at home, and thereafter the Army of the future.","Ministry of Defence","Ministry of Defence","Army","01264 886108","LF-Sec-Group@mod.uk","1598314","N/D","1.00","N/A","","","Military","","1"
"1662048","N/D","OF-6","Chief of Staff Support Command","Chief of Staff Support Command is responsible for the command and management of HQ Support Command.","Ministry of Defence","Ministry of Defence","Army","01264 886108","LF-Sec-Group@mod.uk","00386481","N/D","1.00","N/A","","","Military","New post using deenrichment of OF-7 liability from GOC 5 Division, post deleted under Project AVANTI.","1"
"1167034","N/D","OF-6","Commander 2 (South East) Brigade","2 (South East) Brigade is the Regional formation of the Army in the South East of England, part of the Support Command. The Brigade is to provide the necessary Firm Base support within boundaries including British Gurkhas Nepal and Brunei Garrison, in order to meet CLF's operational requirements and wider Defence needs.","Ministry of Defence","Ministry of Defence","Army","01264 886108","LF-Sec-Group@mod.uk","00386481","N/D","1.00","N/A","","","Military","","1"
"1253061","N/D","OF-6","Commander 15 (North East) Brigade","15 (NE) Brigade is the regional brigade which looks after the Army's interests in the North East of England. The Brigade is to provide the necessary Firm Base support within boundaries in order to meet in CLF's operational requirements and wider Defence needs.","Ministry of Defence","Ministry of Defence","Army","01264 886108","LF-Sec-Group@mod.uk","00386481","N/D","1.00","N/A","","","Military","","1"
"1459738","N/D","OF-6","Commander 38 (Irish) Brigade","38 (Irish) Brigade is the regional brigade which commands operations and delivers the Firm Base in Northern Ireland in order to meet CLF's operational requirements and wider Defence needs.","Ministry of Defence","Ministry of Defence","Army","01264 886108","LF-Sec-Group@mod.uk","00386481","N/D","1.00","N/A","","","Military","","1"
"1168245","N/D","OF-6","Commander 42 (North West) Brigade","42 (North West) Brigade is the regional brigade which looks after the Army's interests in North West England and the Isle of Man. The Brigade is to provide the necessary Firm Base support within boundaries in order to meet in CLF's operational requirements and wider Defence needs.","Ministry of Defence","Ministry of Defence","Army","01264 886108","LF-Sec-Group@mod.uk","00386481","N/D","1.00","N/A","","","Military","","1"
