"1168553","N/D","OF-6","Commander 43 (Wessex) Brigade","43 (Wessex) Brigade is the Army Regional formation in the South West of England. It provides the necessary Firm Base support within boundaries in order to meet CLF's operational requirements and wider Defence needs.","Ministry of Defence","Ministry of Defence","Army","01264 886108","LF-Sec-Group@mod.uk","00386481","N/D","1.00","N/A","","","Military","","1"
"1168742","N/D","OF-6","Commander 49 (East) Brigade","49 (East) Brigade covers East Midlands and East Anglia. The brigade is responsible for providing the necessary Firm Base support within boundaries in order to meet CLF's operational requirements and wider Defence needs.","Ministry of Defence","Ministry of Defence","Army","01264 886108","LF-Sec-Group@mod.uk","00386481","N/D","1.00","N/A","","","Military","","1"
"1167292","N/D","OF-6","Commander 51 (Scottish) Brigade","51 (Scottish) Brigade is to provide and manage effectively Infrastructure Support, Military Capability, Representation and resources within Scotland. The Brigade is to provide the necessary Firm Base support within boundaries in order to meet in CLF's operational requirements and wider Defence needs.","Ministry of Defence","Ministry of Defence","Army","01264 886108","LF-Sec-Group@mod.uk","00386481","N/D","1.00","N/A","","","Military","","1"
"1168111","N/D","OF-6","Commander 143 (West Midlands) Brigade","143 (WM) Brigade covers the West Midlands. It provides the necessary Firm Base support wihtin boundaries in order to meet CLF's operational requirements and wider Defence needs.","Ministry of Defence","Ministry of Defence","Army","01264 886108","LF-Sec-Group@mod.uk","00386481","N/D","1.00","N/A","","","Military","","1"
"1178769","N/D","OF-6","Commander 145 (South) Brigade","145 (South) Brigade is the Army Regional formation in the South of England, and it forms part of the 4th Division in Regional Forces. It provides the necessary Firm Base support within boundaries in order to meet CLF's operational requirements and wider Defence needs.","Ministry of Defence","Ministry of Defence","Army","01264 886108","LF-Sec-Group@mod.uk","00386481","N/D","1.00","N/A","","","Military","","1"
"1168154","N/D","OF-6","Commander 160 (Wales) Brigade","160 (Wales) Brigade is to provide the necessary Firm Base support within Wales in order to meet CLF’s operational requirements and wider Defence needs.","Ministry of Defence","Ministry of Defence","Army","01264 886108","LF-Sec-Group@mod.uk","00386481","N/D","1.00","N/A","","","Military","","1"
"00472483","Major General N H Eeles","OF-7","General Officer Commanding Scotland","GOC Scotland is to act as the army's principal representative in Scotland. He is to contribute to the development of a sustainable and politically acceptable basing plan for Scotland and, in support of GOC London District, deliver the required level of State Ceremonial and Public Duties in Scotland.","Ministry of Defence","Ministry of Defence","Army","01264 886108","LF-Sec-Group@mod.uk","1598314","N/D","1.00","N/A","","","Military","","1"
"1596792","Air Vice-Marshal C Dixon CB OBE","OF-7","Commander Joint Helicopter Command","Provide designated Force Elements to conduct and support operations in pursuit of the UK’s Defence Aim.","Ministry of Defence","Ministry of Defence","Army","01264 886108","LF-Sec-Group@mod.uk","1598314","292035159","1.00","N/A","","","Military","","1"
"1599388","N/D","OF-6","Deputy Comd Joint Helicopter Command","JHC provides battlefi eld helicopter (BH) and air assault force elements to conduct and support operations within designated readiness and capabilities, in order to support the UK’s Defence strategy. The JHC commands all the BH of the Royal Navy, Army and Royal Air Force, operating over 250 aircraft including the Sea King and Lynx helicopters of the Royal Navy’s Commando Helicopter Force; the Chinook, Puma and Merlin helicopters of the Royal Air Force and the Apache, Lynx, Gazelle and Bell 212 helicopters and the Islander fi xed wing aircraft of the Army Air Corps.","Ministry of Defence","Ministry of Defence","Army","01264 886108","LF-Sec-Group@mod.uk","1596792","N/D","1.00","N/A","","","Military","","1"
"1596498","N/D","OF-6","Director Developemnt/Director Army Aviation Joint Helicopter Command","As Director Development and Director Army Air Corps, Brigadier David Short is responsible for all future planning and developments of the JHC ranging from Front Line Operations to Exercises in the UK. As professional head of the AAC, Brig Short is responsible for the values, ethos, image (including media) and general well-being of the AAC. DAAvn is to give direction and professional advice on Army Aviation (AAvn) and AAC matters; act as the CAA&I and to be the Release to Service Authority (RTSA) for all Army aircraft, in order to sustain the delivery of military aviation capability in pursuit of the UK’s Defence aim.","Ministry of Defence","Ministry of Defence","Army","01264 886108","LF-Sec-Group@mod.uk","1596792","N/D","1.00","N/A","","","Military","","1"
"1221027","N/D","OF-6","Commander 16 Air Assault Brigade","Comd 16 Air Assault Bde is to command OPCOM troops and prepare and deliver force elements in role in order to contribute to the Land Command and UK Defence capability. As directed, deliver the required collective training for all Force Elements assigned to 16 Air Assault Bde. Increase and enhance the deployability of soldiers within 16 Air Assault Bde.","Ministry of Defence","Ministry of Defence","Army","01264 886108","LF-Sec-Group@mod.uk","1596792","N/D","1.00","N/A","","","Military","","1"
"1591926","Lieutenant General J D Page CB OBE","OF-8","Commader Force Development and Training","Commander FDT is to optimise the delivery of Army capability in order to ensure success on operations now and in the future.","Ministry of Defence","Ministry of Defence","Army","01264 886108","LF-Sec-Group@mod.uk","1167535","407754346","1.00","125000","129999","","Military","","1"
"1591929","N/D","OF-6","Chief of Staff Force Development and Training","Direct and coordinate the staff output within FDT to optimise the the delivery of Army capability through cohernet support to subordinate and superior organisations.","Ministry of Defence","Ministry of Defence","Army","01264 886108","LF-Sec-Group@mod.uk","1591926","N/D","1.00","N/A","","","Military","","1"
"1605168","N/D","OF-6","Director Training","D Trg(A) provides the Army HQ’s 1* focal point for the Training Line of Development.  Part of Army HQ, D Trg(A) comprises of 4 staff branches: Individual Training, Training Development, Training Capability and Collective Training.","Ministry of Defence","Ministry of Defence","Army","01264 886108","LF-Sec-Group@mod.uk","1591926","N/D","1.00","N/A","","","Military","","1"
"1603839","Major General P W Jaques","OF-7","Director General Logistics, Support and Equipment","DG LS&E is to manage the Army's Equipment Capability through life in order to support current and future operations. Main Effort: Ensuring that our operational commanders are resourced with the equipment capability that they need to succeed.","Ministry of Defence","Ministry of Defence","Army","01264 886108","LF-Sec-Group@mod.uk","1591926","N/D","1.00","N/A","","","Military","","1"
"1605127","N/D","OF-6","Head Information Superiority","The Directorate is the focal point for all ISTAR policy, planning, doctrine, training and equipment capability matters within Army HQ. The Directorate also acts as the single Army authority for the provision of policy, direction and professional advice to PJHQ, MOD and other service commands on both G2 and ISTAR issues within the Land Environment. The Directorate focuses on delivering coherent ISTAR capability for the Current Operating Environment and offers Army subject matter expertise to Defencewide ISTAR programmes that will deliver enduring capabilities. The G2 Ops team ensures the effective delivery of intelligence on political and military developments in operational areas, and those areas where developing situations could lead to the involvement of British Forces within the Army.","Ministry of Defence","Ministry of Defence","Army","01264 886108","LF-Sec-Group@mod.uk","1603839","N/D","1.00","N/A","","","Military","","1"
"1604346","N/D","OF-6","Director Logistics","D Log (A) is the Army’s 1* Logistic Proponent and lead for all logistic policy and plans, logistic support, and CSS operational capability matters, including assurance, in order to support the provision of Force Elements (FE)","Ministry of Defence","Ministry of Defence","Army","01264 886108","LF-Sec-Group@mod.uk","1603839","N/D","1.00","N/A","","","Military","","1"
"1604479","N/D","OF-6","Director Equipment","The Equipment Directorate’s mission is to equip and support the force now and in the future in order to allow it to train and fight. It is the lead on UOR and Equipment Plan capability integration and achieves its objectives through the coordinated efforts of three branches, each headed up by an Assistant Director.","Ministry of Defence","Ministry of Defence","Army","01264 886108","LF-Sec-Group@mod.uk","1603839","N/D","1.00","N/A","","","Military","","1"
"1272850","Major General R R Davis CBE","OF-7","Director General Army Recruiting and Training","Deliver the required number of appropriately trained and motivated officers and soldiers in order to meet the current and future operational requirements of the Army and Defence.","Ministry of Defence","Ministry of Defence","Army","01264 886108","LF-Sec-Group@mod.uk","1591926","N/D","1.00","N/A","","","Military","","1"
"1167722","N/D","OF-6","Director Rectruit Training (Operations)","Plan and execute the Army’s national recruiting campaign. Provide functional support and co-ordination to the regional chain of command executing the regional element of the Army’s national recruitment campaign. Deliver the required number of appropriately trained and motivated service personnel. Direct and manage the recruiting, development, selection and training pipeline.","Ministry of Defence","Ministry of Defence","Army","01264 886108","LF-Sec-Group@mod.uk","1272850","N/D","1.00","N/A","","","Military","","1"
"1448299","N/D","OF-6","Commandant School of Infantry","Mission: “To deliver trained officers and soldiers in accordance with the statement of training requirement in order to support the operational requirements of the Army and defence”. The School of Infantry (Sch of Inf) trains and qualifies officers, warrant officers, non-commissioned officers, other ranks, and recruits for the Infantry and wider Army in battlefield leadership and dismounted close combat. It does this in three principal establishments: The Infantry Training Centre at Catterick, the Infantry Battle School at Brecon, and the Support Weapons School at Warminster.","Ministry of Defence","Ministry of Defence","Army","01264 886108","LF-Sec-Group@mod.uk","1272850","N/D","1.00","N/A","","","Military","","1"
"1538780","N/D","OF-6","Commandant Royal School of Military Engineering","The Royal School of Military Engineering (RSME) provides training in all engineering disciplines, which provide the unique range of skills that are fundamental to the Military Engineer as well as delivering Military working animals, handlers and maintainers. Military Engineer skills include the command and management of engineer tasks, combat engineering, artisan, technical and professional engineering, communication, watermanship and driving specialist engineer vehicles.","Ministry of Defence","Ministry of Defence","Army","01264 886108","LF-Sec-Group@mod.uk","1272850","N/D","1.00","N/A","","","Military","","1"
"1226744","N/D","OF-6","Commander Collective Training Group","CTG is to deliver to the Field Army and others the most effective education, training and training support within resources in order to prepare force elements to succeed on current, contingent and future operations. It is also to deliver a coherent and relevant training progression across the Collective Training Establishments (CTEs), and fulfil responsibilities for the construct and refine functions of collective training in accordance with Collective Training Governance.","Ministry of Defence","Ministry of Defence","Army","01264 886108","LF-Sec-Group@mod.uk","1272850","N/D","1.00","N/A","","","Military","","1"
"1261026","N/D","OF-6","Commander Initial Training Group","Mission. Train Regular and TA soldiers to the quantity and standards directed by the Training Delivery Authority (TDA) and the Training Requirements Authority (TRA) in order to prepare them for Phase 2 training. Initial Training Group delivers relevant, progressive, challenging and safe training for Regular and TA soldiers, facilitating their successful transition to Phase 2 training. Through Values Based Leadership by inspirational Permanent Staff, we lay the foundations of military character in our Soldiers under Training. By contextualising the Soldiers’ education and training, we prepare them both for Phase 2 training and subsequent operations in Afghanistan.","Ministry of Defence","Ministry of Defence","Army","01264 886108","LF-Sec-Group@mod.uk","1272850","N/D","1.00","N/A","","","Military","","1"
"1212786","N/D","OF-6","Commander Defence College of Logistics & Personnel Administration","Deliver integrated logistic support and personnel administration training to all four services to the quantity and standards directed by the TDA and TRA in order to support the operational requirements of Defence. Furthermore, Garrison Commander for Deepcut, Pirbright and Mychett.","Ministry of Defence","Ministry of Defence","Army","01264 886108","LF-Sec-Group@mod.uk","1272850","N/D","1.00","N/A","","","Military","","1"
"1232962","Major General B Brealey","OF-7","Director General Capability","DG Capability’s mission is to lead the Army’s, Force Development, Capability Development and Warfare Development effort in order to ensure success on current and future operations.","Ministry of Defence","Ministry of Defence","Army","01264 886108","LF-Sec-Group@mod.uk","1591926","N/D","1.00","N/A","","","Military","The post of DG Capability was previously DG Land Warfare.","1"
"1671307","N/D","OF-6","Capability Director Combat","Capability Director Combat is to drive a process of capability development that is led by force design, sets properly designed and costed Key User Requirements, is effectively integrated and coherent across Defence Lines of Development (DLoD), is underpinned by thorough investigation and analysis, identifies the capabilities required for the future (expressed as functional concepts, CONEMPs and CONUSEs), and contributes to the construction of a balanced and affordable Land Programme.","Ministry of Defence","Ministry of Defence","Army","01264 886108","LF-Sec-Group@mod.uk","1232962","N/D","1.00","N/A","","","Military","Formed through the merger two Arms and Service Directors; Director Royal Armoured Corps and Director Infantry.","1"
"1001","N/D","OF-6","Capability Director Combat Support","Capability Director Combat Support is to drive a process of capability development that is led by force design, sets properly designed and costed Key User Requirements, is effectively integrated and coherent across Defence Lines of Development (DLoD), is underpinned by thorough investigation and analysis, identifies the capabilities required for the future (expressed as functional concepts, CONEMPs and CONUSEs), and contributes to the construction of a balanced and affordable Land Programme.","Ministry of Defence","Ministry of Defence","Army","01264 886108","LF-Sec-Group@mod.uk","1232962","N/D","1.00","N/A","","","Military","Formed through the merger two Arms and Service Directors; Director Royal Artillery and Engineer in Chief (Army).","1"
"1002","N/D","OF-6","Capability Director Combat Service Support","Capability Director Combat Service Support is to drive a process of capability development that is led by force design, sets properly designed and costed Key User Requirements, is effectively integrated and coherent across Defence Lines of Development (DLoD), is underpinned by thorough investigation and analysis, identifies the capabilities required for the future (expressed as functional concepts, CONEMPs and CONUSEs), and contributes to the construction of a balanced and affordable Land Programme.","Ministry of Defence","Ministry of Defence","Army","01264 886108","LF-Sec-Group@mod.uk","1232962","N/D","1.00","N/A","","","Military","Formed through the merger two Arms and Service Directors; Director Electrical and Mechanical Engineers and Director Royal Logistic Corps.","1"
"1003","N/D","OF-6","Capability Director Information","Capability Director Information is to lead development and X-DLOD Integration of designated deployable C4ISR capabilities in order to enable success on operations, now and in the future.","Ministry of Defence","Ministry of Defence","Army","01264 886108","LF-Sec-Group@mod.uk","1232962","N/D","1.00","N/A","","","Military","Formed through the merger two Arms and Service Directors; Director Intelligence and Signals Officer in Chief (Army).","1"
"1296288","Eliminated","OF-6","Director Royal Armoured Corps","DRAC is to provide coherence across the DLoDs, through the provision of policy, direction and professional advice to the Army and Defence on Mounted Close Combat, Ground Mounted Manned Reconnaissance, HCav/RAC issues, All Arms AFV Technical Training and CBRN Defence in order to sustain the delivery of military capability from the Army now and in the future. DRAC is also the lead proponent for CBRN.","Ministry of Defence","Ministry of Defence","Army","N/A","LF-Sec-Group@mod.uk","1232962","N/D","1.00","N/A","","","Military","","1"
"1235458","Eliminated","OF-6","Director Royal Artillery","DRA is to provide coherence across DLoDs, through the provision of policy, direction and professional advice (including CAA&I) to the Army and Defence on artillery1, in order to sustain the delivery of military capability from the Land Component, both now and in the future. DRA provides advice to the chain of command on force generation and the programming of force elements against the Operational Commitments Plot. Concurrently, DRA contributes to the development of the capability required for future confl ict, across all LoDs, whilst providing subject matter expertise in support of UORs. DRA owns the Royal Artillery’s liability, managing it across 16 regular and 7 territorial units, with responsibility for recruiting to it, and for setting manning priorities. Furthermore, DRA promotes the standards, values and military ethos of the Royal Artillery, and safeguards its heritage through the Royal Artillery Institution. DRA is also the proponent for terminal control issues for all Joint Fires systems (inc mortars and Forward Air Controllers, but not indirect tank gunfi re), airspace management within battlespace management, and targeting mensuration and geolocation.","Ministry of Defence","Ministry of Defence","Army","N/A","LF-Sec-Group@mod.uk","1232962","N/D","1.00","N/A","","","Military","","1"
"1201597","Eliminated","OF-6","Engineer in Chief (Army)","EinC(A) is to provide coherence across the DLoDs, through the provision of policy, direction and professional advice to the Army and Defence on all Military Engineer (ME) and Royal Engineer (RE) matters in order to sustain the delivery of military capability from the Army both now and in the future.","Ministry of Defence","Ministry of Defence","Army","N/A","LF-Sec-Group@mod.uk","1232962","N/D","1.00","N/A","","","Military","","1"
"1443914","Eliminated","OF-6","Signals Officer in Chief (Army)","SOinC(A) is to promote excellence in Army signalling and Electronic Warfare and to improve operational effectiveness by developing the Land Environment Command Support capability, principally in order to deliver success in Afghanistan, but also a capability for likely contingencies and other subsequent hybrid operations.","Ministry of Defence","Ministry of Defence","Army","N/A","LF-Sec-Group@mod.uk","1232962","N/D","1.00","N/A","","","Military","","1"
"1442314","Eliminated","OF-6","Director Infantry","D Inf is to provide coherence across the DLODs, through the provision of policy, direction and professional advice to the Army and Defence on Dismounted Close Combat and Infantry issues in order to sustain the delivery of military capability in the Land environment both now and in the future. D Inf is the Competent Army Authority (CAA) and Training Requirements Authority (TRA) for Dismounted Close Combat, Skill at Arms, Military Capacity Building (MCB), Pyrotechnics, WARRIOR, BULLDOG, PPV, FRES and UV, and the proponent for Arms Drill. D Inf also provides assurance of training (distributed) and 1st party audit of TRA/Training Delivery Authority (TDA) training assurance activities.","Ministry of Defence","Ministry of Defence","Army","N/A","LF-Sec-Group@mod.uk","1232962","N/D","1.00","N/A","","","Military","","1"
"1143483","Eliminated","OF-6","Director Intelligence Corps/Commandant Defence Intelligence and Security Centre","Comdt DISC is responsible for the delivery of individual intelligence training for all 3 Services. D Int Corps is to provide coherence across the DLODs, through the provision of policy, direction and professional advice to the Army and Defence on all Military Intelligence and Intelligence Corps regimental matters in order to sustain the delivery of military capability from the Army both now and in the future.","Ministry of Defence","Ministry of Defence","Army","N/A","LF-Sec-Group@mod.uk","1232962","N/D","1.00","N/A","","","Military","","1"
"1182808","Eliminated","OF-6","Director Royal Logistics Corps","DRLC’s mission is to provide coherence across the Lines of Development, through the provision of policy, direction and professional advice to the Army and Defence on Logistic Support and other logistic and RLC regimental matters in order to sustain the delivery of military capability from the Army both now and in the future.","Ministry of Defence","Ministry of Defence","Army","N/A","LF-Sec-Group@mod.uk","1232962","N/D","1.00","N/A","","","Military","","1"
"1180453","Eliminated","OF-6","Director Electrical & Mechanical Engineering","DEME(A) is to provide coherence across the DLoDs, the provision of policy, direction and professional advice to the Army and Defence in support of Equipment Capability and REME matters in order to sustain military capability in the Land environment both now and in the future.","Ministry of Defence","Ministry of Defence","Army","N/A","LF-Sec-Group@mod.uk","1232962","N/D","1.00","N/A","","","Military","","1"
"1614114","N/D","OF-6","Director Force Development","The Director Force Development sets the long term agenda for Army Transformation. The directorate looks out to the medium and long term in order to identify trends and drivers that will impact on future force development in its widest sense. It is a cross DLOD activity and enables DGLW to offer evidentially based advice to Comd FDT as he sets priorities across his command and as he seeks to influence senior decision makers in both the Army and Defence.","Ministry of Defence","Ministry of Defence","Army","01264 886108","LF-Sec-Group@mod.uk","1232962","N/D","1.00","N/A","","","Military","","1"
"00919010","N/D","OF-6","Director Land Warfare","Director Land Warfare is to lead Warfare Development involving: a. The production and advocacy of relevant Tactical Doctrine. b. The systematic utilization of experience. c. Driving the learning of lessons pan capability and Defence Lines of Development. d. Ensuring individual and collective training is teaching what they should. e. The provision of a reach-back focus for deployed/deploying formations and units.","Ministry of Defence","Ministry of Defence","Army","01264 886108","LF-Sec-Group@mod.uk","1232962","N/D","1.00","N/A","","","Military","","1"
"1147829","Major General T P Evans DSO MBE","OF-7","Commandant Royal Military Academy Sandhurst","Train and educate sufficient quality Regular/TA officers and soldiers in order to support the operational requirements of the Army and Defence.","Ministry of Defence","Ministry of Defence","Army","01264 886108","LF-Sec-Group@mod.uk","1591926","N/D","1.00","N/A","","","Military","","1"
"1149947","N/D","OF-6","President Army Officer Selection Board","The Army Officer Selection Board is responsible for the selection of Potential Officers for training and education to command soldiers in peace and operations and for specialist functions within the Army. The Army Officer Selection Board (AOSB) is based at Westbury in Wiltshire and is responsible for the assessment and selection of all Regular, Territorial Army and Professionally Qualified Officers","Ministry of Defence","Ministry of Defence","Army","01264 886108","LF-Sec-Group@mod.uk","1147829","N/D","1.00","N/A","","","Military","","1"
"1591920","Lieutenant General Sir Mark Mans KCB CBE","OF-8","Adjutant General","As the Army’s Principal Personnel Officer, the Adjutant General is to: a. Support the delivery of a sufficient number of capable and motivated personnel, b. Lead the Army’s Personnel and Infrastructure Lines of Development, c. On behalf of Defence, provide the policy lead for Children and Young people and the Army’s Cadet Forces. in order to enhance and sustain the operational effectiveness of the Army, now and in the future.","Ministry of Defence","Ministry of Defence","Army","01264 886108","LF-Sec-Group@mod.uk","1167535","157992086","1.00","125000","129999","","Military","","1"
