FREEDOM OF INFORMATION,,
14-09-2010-121409-007,07/10/2010,What Wethersfield civilian posts are currently shown as vacant broken down by grade and department/section?
14-09-2010-121851-008,07/10/2010,Full details of investigation file into concerns involving Merlin helicopter
14-09-2010-143842-002,12/10/2010,"Doucuments/reports relating or mentioning the hunt for a unknown submarine between may 1958 and febuary 1960 in the Golfo Nuevo, Argentina"
14-09-2010-144523-001,10/09/2010,Has any individual with a gender identity been recommended for a medical board of survey on the grounds of transsexualism and if they have how many have been subsequently medically discharged?
14-09-2010-145230-003,28/09/2010,"A Literature Review of the Practical Application of Bacteriophage Research - the number of copies that are now in circulation in the UK amongst interested parties and potential stakeholders etc., and when these were sent out?"
14-09-2010-152018-002,10/09/2010,"How much revenue was raised in the most recent financial accounting period to date by the Ministry of Defence's Directorate of IPR's sale of images, and how much does the Directorate cost to run?"
14-09-2010-155643-004,12/10/2010,"Copies of: AP3392, Vol 5, Leaflet 118 extant in 1998 (as referred to in Para 1033 of Queen's Regulations for the RAF, Major Revision 6/Aprril 1998); The predecessor of the document; Any document extant in 1997 setting out MOD or RAF policy on transvestites and transvestism (cross-dressing)."
14-09-2010-155826-004,11/10/2010,"In the year 2009-2010 how many complaints counted in the official publication ""Military Low Flying in the United Kingdom"" Statistical Appendix were found to be fully justified and that the RAF/NATO were in breach of the rules?"
14-09-2010-164455-005,28/09/2010,Details of poss contract for Mil hospital in Bergen-Hohne and info regarding the date for the withdrawal of UK personnel from Germany.
14-09-2010-164757-005,12/10/2010,"Statistical information for each year since and including 2005  the number of  complaints of  (i); sexual assaults; (ii); rape and  (iii),  other sexual attacks that have taken place within each of the British Army, Royal Navy and Royal Air force, broken down into figures for each Service."
15-09-2010-092226-001,12/10/2010,"How many service personnel committed suicide in each of the last 10 years, broken down by armed service? How many service personnel were recorded as carrying out deliberate self harm in each of the last 10 years, broken down by armed service?"
15-09-2010-093322-002,12/10/2010,Any papers prepared for ministers about the sale of the Married Quarters Estate from 1996
15-09-2010-095146-003,12/10/2010,Information held or exchanged on any meetings held between or correspondence exchanged between Sir Malcolm Rifkind MP & Julian Chafer of Defence Estates from 1 January 2009 until current date.
15-09-2010-102812-002,13/10/2010,Nuclear test veterans enrolled onto medical research programmes
15-09-2010-110030-003,13/10/2010,How much has your department spent on consultancy costs and project advisory costs in the financial year 2009/2010
15-09-2010-124552-004,11/10/2010,Files kept by the Ministry of Defence on xxxxxx or meetings that he participated in with British officials
15-09-2010-134619-001,31/08/2010,DTUS intake and graduation figures
15-09-2010-145107-002,13/10/2010,All unpublished correspondence between the MoD and Boeing  relating to the MoD contract with Boeing for Chinook helicopters
15-09-2010-150143-003,13/10/2010,Number of Armed forces personnel who have had counselling for substance abuse in each of the last ten years; the number of Armed forces personnel who have had treatment for substance abuse in each of the last ten years
15-09-2010-151013-001,13/10/2010,Nine questions regarding the Department's current Accounts Payable processes
15-09-2010-151446-004,13/10/2010,All documents and communications related to the policy on recruitment of bomb disposal experts
15-09-2010-152049-002,13/10/2010,"Copy of article RN Surface Abandonment From Submarines Trial Order and Report, Trial E280 (2006) Hopkins, N. SUBIPT Defence Logistics Organisation"
15-09-2010-152759-003,13/10/2010,Number of diesel vehicles currently operated by the Police department and the number of occasions any of these vehicles has been misfilled with petrol requiring unscheduled servicing during each of the last two years
15-09-2010-171912-004,13/10/2010,"What events hosted by public relations / public affairs firms have they spoken at or attended since the coalition Government came into power on 12 May 2010 for ministers Liam Fox, Nick Harvey, Gerald Howarth, Andrew Robathan, Peter Luff, Lord Astor"
15-09-2010-172327-005,13/10/2010,"Details of any emails and letters sent between the Conservative party co-Chairman Andrew Feldman and your department's ministers, special advisers, diary secretaries or officials"
16-09-2010-102805-001,13/10/2010,The nationality of a man who died after suffering a fatal injury on board an RAF helicopter in Iraq in April 2004 and individuals who died in UK military custody in Iraq
16-09-2010-110350-002,13/10/2010,Fifteen questions regarding various Framework Agreement Contracts
16-09-2010-114554-003,23/09/2010,Five questions regarding the Blue Book and the names of all participants in the British Nuclear Test Programme
16-09-2010-115224-001,11/10/2010,"Follow on request from 25-06-2010-131215-00, was the person who was involved the tradesman or the supervisor?"
16-09-2010-155245-002,14/10/2010,"A copy of the outcome of the lessons learned project in 2008 relating to air tankers, as referred to in the Public Accounts Committee report Delivering Multi-“Role Tanker Aircraft Capability"
16-09-2010-155813-003,14/10/2010,The cost to the Department of the Ecodriver installation managed service presented
16-09-2010-164909-001,14/10/2010,Removal of the redaction of the name of desk officers who corresponded with members of the public
16-09-2010-170450-002,14/10/2010,"Policy regarding redaction of references to xxxxxx, request desk instructions relating to such redactions"
16-09-2010-170910-003,14/10/2010,Provide any records which are held of meeting refered to in TNA file DEFE24-2000 between the Head of Sec(AS) and DOMD
17-09-2010-085849-001,14/10/2010,"For the calendar year 2002, 2003, 2004, 2005, 2006 the number of allegations made against Armed Forces personnel for sending or attempting to send human body parts to the UK"
17-09-2010-100658-001,12/10/2010,How many Military personal claims in the past 5 years relating to back injuries
17-09-2010-101818-002,15/10/2010,Numbers of nurses and/or all medical professionals within the services broken down to include regular and territorial troops
17-09-2010-103022-003,13/10/2010,Quantitative data on overseas deployments: Troop numbers; Duration; Cost; Type of mission; National or multinational - From 1945 to the current era
17-09-2010-105121-002,14/10/2010,"How many Navy and Army 'commercial' service divers have been diagnosed with asthma over the last 10 years? How many Navy, Army and RAF service sports divers have been diagnosed with asthma over the last 10 years?"
17-09-2010-114639-002,15/10/2010,The number of individual claimants that the MOD pays a benefit to for people that suffer mesothelioma (an asbestos-related disease)
17-09-2010-120722-003,15/10/2010,"For the calendar years 2007, 2008, 2009 and 2010 the number of allegations made against Armed Forces personnel for sending or attempting to send human body parts to the UK"
17-09-2010-151118-001,15/10/2010,"Whether you have a dress code for your staff, or whether staff have been sent any memos about their attire since 1st January 2008"
20-09-2010-093815-001,07/09/2010,"(1) How many DV subjects had their DV related interviews, enquiries and investigations conducted by RAF Pers Sy staff without the involvement of DVA in 06/07, 07/08 and 08/09?  And, (2) How many DV clearance cases did DVA refer as contentious to PSyA (RAF) (including his staff) for clearance decision in 06/07, 07/08 and 08/09?"
20-09-2010-100543-001,18/10/2010,Detail and rules on how MoD calculates pensions for RN medical officers with a service attributable injury who are discharged through Naval Medical Board Of Survey and subsequent employability board along with the pay tables that are used.
20-09-2010-101706-002,18/10/2010,"To model the Sea Harrier FA2 and dimensions for the model; some drawings of the fuselage, wing and empennage."
20-09-2010-102141-002,18/10/2010,(1) The annual cost of the University Royal Naval Units; (2) The annual cost of operating and maintaining the 14 patrol vessels attached to the University Royal naval units; (3) The complete cost and number of royal naval personnel required to run the University Royal Naval Units.
20-09-2010-102451-003,18/10/2010,"(1) The annual charge to the Marine Management Organisation for Fishery Protection work; (2) what is the annual cost of the contract with Bee Systems for the 3 fishery protection vessels; (3) how many RN personnel are employed, at sea and shoreside, on Fishery protection work and what is their annual cost."
20-09-2010-102820-004,18/10/2010,How many (1) seagoing ships are commanded by 4 ring captains; (2) shore establishment are commanded by 4 ring Captains: (3) how many serving 4 ring captains there are in the royal navy.
20-09-2010-104004-005,18/10/2010,"Details of all UFO / UAP sightings reported to the MoD from 1st Jan 2009 - to date.  I am keen to see the full records for last year, as well as all sightings reported so far for 2010."
20-09-2010-104232-003,18/10/2010,"On the 25th September 1946, a Dakota KN 414 took off from Kai Tak air strip Hong Kong, it crashed two minutes after take-off. I am looking for any information possible to find the truth as to what happened to that aircraft on that day."
20-09-2010-110553-004,18/10/2010,Currently researching for my Housing Degree dissertation on adapted housing for injured service personnel and problems with availability and planning permission. I would like to approach a small group of personnel who are willing to be part of a focus group.
20-09-2010-110907-006,15/10/2010,A list of all items removed from Nimrod aircraft for the Mk4.
20-09-2010-112119-005,18/10/2010,"Would you please forward all documentation regarding the removal of The Royal Northumberland Fusilier Collection from its present location in Alnwick Castle, to the Royal Regiment of Fusiliers Museum currently located in Bury Lancashire."
20-09-2010-114602-007,18/10/2010,"The accident happened on 19 March 1970, when a Hawker Hunter, flying out of RAF Gutersloh, crashed into a hillside near the village of Henglarn.  I would like to know the findings of the Board of Enquiry into that accident."
20-09-2010-120140-008,18/10/2010,"What is the breakdown, in actual figures and as a proportion of the total personnel, of Hindus, Muslims, Sikhs, Jews, Buddhists, atheists and Christians in (a) each of the three Services individually."
20-09-2010-145607-001,18/10/2010,"Any documents, reports, emails and minutes of meetings or other relevant materials of discussions, correspondence or other business relating to British diplomatic and internal discussions with Israel regarding Hamas and Britain's willingness to recognise Hamas after the 26/01/06 elections and up until 31/12/06."
20-09-2010-150246-002,18/10/2010,"Can you send me copies of the oldest set of ground plans you have for the site at RAF Bentwaters, including any sites in the surrounding environment that might be connected to the main site ie tunnels, pipework etc.  Also, who currently owns the RAF Bentwaters site?"
20-09-2010-150901-003,18/10/2010,"A copy of the RAF Drill Manual AP 818, as I would like to read it as I hope to join the RAF as an Officer in the next couple of years."
20-09-2010-152112-004,18/10/2010,"Copies of various documents, which arose from research carried out by Salford University's Institute of Acoustics on behalf of the MoD."
20-09-2010-152845-005,18/10/2010,"(a) A copy of the diary of Gerald Howarth, including all entries between 12 May 2010 and up to the date you reply to this request.  (b) Also, details of all appointments scheduled between the date you reply to this request and 27 July 2011. (c) As (a) and (b) for Peter Luff."
20-09-2010-161620-002,15/10/2010,The yearly cost of private personnel in Afghanistan (i/e security personnel etc) do you think those figures would be accessible within the limit?
21-09-2010-092224-001,18/10/2010,"Five questions relating to a series of incidents in Afghanistan in which local civilians have been either killed or wounded by British forces.  The incidents took place on December 24 and 30, 2008 and January 3, 19, 27, March 26, May 19, 28, September 30 and November 10 in 2009, all in Helmand."
21-09-2010-101340-001,21/09/2010,The numbers of Irish citizens serving past and present in the British Armed Services and their motives for enlisting.
21-09-2010-104051-002,22/09/2010,Five questions relating to Air Command and Apprenticeship Training Management:
21-09-2010-112604-003,27/09/2010,"A brief summary of UFO sightings done year by year and noting the area - the format is fantastic, but the year only goes back to 1997. I am specifically looking for 1995 and especially 1996."
21-09-2010-113113-003,18/10/2010,I would like to know how many non-British service personnel are serving in the military at the moment.
21-09-2010-113814-004,18/10/2010,I would like to know how many military ID cards are currently lost and how many are in known circulation.
21-09-2010-114150-001,14/10/2010,Request for Air Accident Report for accident at Ternhill airfield on 10 Jan 2007.
21-09-2010-114308-004,27/09/2010,"The numbers of servicemen and women who have been treated as casualties in Afghanistan in the last four years, preferably year by year."
21-09-2010-114557-005,18/10/2010,How much money is invested in sending careers advisors over to other countries out with the United Kingdom?
21-09-2010-130134-001,15/10/2010,"Request a service record for RAF serviceman, including medals awarded."
21-09-2010-131025-002,19/10/2010,Request for (a) JSP 886 The Defence Logistic Support Chain Manual; Volume 3 Support Chain Management; Volume 7 Integrated Logistic Support.
21-09-2010-145244-003,19/10/2010,"Hercules c130k,s how many still operational and withdrawn from use (stored) and for disposal."
21-09-2010-160715-004,12/10/2010,"Information guidance, rules, procedures or standing orders for MOD staff relating to meetings held with non MOD staff or at premises with the Defence, or Government, Estates."
21-09-2010-161203-005,19/10/2010,I would like to see all the original calculations and documents leading to the decision on the number of radiators in my living room.
22-09-2010-111240-001,19/10/2010,(a) How many (UK and Commonwealth) forces personnel have lost their lives in conflicts since 1948 and (b) How many lost their lives in each conflict.
22-09-2010-114620-001,18/10/2010,"How much money has been spent by the MOD on security contractors around the world between 1 January 2010 and 20 September 2010 broken down by country, date contracted, type of contract and cost of contract."
22-09-2010-121452-002,18/10/2010,"How much money was spent by the MOD on birthday cards between 20 September 2009 and 20 September 2010, broken down by month.  I would like exactly the same information for Christmas cards."
22-09-2010-132637-001,19/10/2010,Copies of: any legal or medical advice provided to RAF Physical Education policy staffs to endorse the late-2009 changes to the RAF policy - any medical or occupational health consultant SME advice provided to RAF Physical Education policy staffs since 1 Jan 10.
22-09-2010-144148-002,19/10/2010,Information the Oil and Pipelines Agency holds relating to current development of its strategy for the operation and maintenance of the Government Pipelines and Storage System (GPSS).
22-09-2010-145640-003,19/10/2010,What is the cost of Develop Vetting (DV) a Royal Naval Reservist?
22-09-2010-154459-004,20/10/2010,Several questions relating to the use of RAF Wainfleet.
22-09-2010-155551-001,20/10/2010,Information on fuel gauge change on XV230 EQ1 servicing.
22-09-2010-155817-005,20/10/2010,"Various questions relating to the reviews the department announced since May 11, 2010."
22-09-2010-161349-006,20/10/2010,"(1) While the Trade Unions have challenged changes to the Civil Service Compensation Scheme and the introduction of the new scheme has been prevented, is there a policy within MoD of not releasing Civil Servants on redundancy terms until resolution?  (2) How many Civil Servants in grades E2 to B1 are there within MoD who are in the Re-deployment pool and available for release on redundancy terms, broken down into grades and TLBs."
22-09-2010-165707-007,20/10/2010,Contact details for your procurement officer or IT procurement for this website or the department?
22-09-2010-170823-008,20/10/2010,Copies of:  the 1994 Officer Assessment Study and the Defence Leadership Centre Strategic leadership Survey 2004.
23-09-2010-094434-001,11/10/2010,"Information held by the Ministry of Defence relating to a 2006 Safety Improvement Notice, issued by the Defence Nuclear Safety Regulator (DNSR) in respect of the air transport of highly enriched uranium loads."
23-09-2010-103334-001,20/10/2010,How many personnel (both civilian and military) have taken legal action against the MoD in the past three years?
23-09-2010-105604-002,20/10/2010,"Information about the BAe146 Atmospheric Research Aircraft (ARA), in particular, what are the Met Office's annual operating costs for this aircraft and how many hours does the aircraft fly annually?"
23-09-2010-112815-003,20/10/2010,What Applications are you currently using for: E-learning and learning Performance Management Talent Management.
23-09-2010-115229-004,20/10/2010,I would like to have a hard copy of the Global Strategic Trends - Out to 2040.
23-09-2010-120949-005,20/10/2010,"Details in respect of the following framework agreements, of the suppliers who applied for inclusion on each agreement, and were successful and not successful at the PQQ and ITT stage, together with information on the values of each sub lot."
23-09-2010-143245-001,21/10/2010,"Details of the most recent quarterly hospitality and business expenses submitted by senior civil servants (director general level and above), or the URL of such details; and copies of receipts submitted in support of those claims."
23-09-2010-153603-002,21/10/2010,Sixteen questions regarding Departmental Expenses.
24-09-2010-094214-001,19/10/2010,"How much money was spent on OTC Adventurous Training between 21 September 2009 and 21 September 2010, broken down by OTC division, date of the trip, nature of the trip (skiing, diving, climbing etc), cost and number attending.  The same information for the period 21 September 2007 to 21 September 2008 and 21 September 2008 to 21 September 2009."
24-09-2010-094823-002,19/10/2010,A list of meetings which have occurred between each of the ministers in your department and outside interest groups between May 1 2010 and June 30 2010.
24-09-2010-095418-003,19/10/2010,Information on the reasons why women cant join the infantry.
24-09-2010-100049-001,21/10/2010,"The total amount of compensation paid by the Ministry of Defence to soldiers involved in each of the following conflicts: Afghanistan, Iraq, Kosovo, Bosnia, Northern Ireland and Falklands."
24-09-2010-100149-004,19/10/2010,(1) The number of laptops belonging to the MoD that were lost during 01st April 2009 - 31st March 2010. (2) The number of laptops belonging to the MoD that were stolen during 01st April 2009 - 31st March 2010.  (3) The number of mobile telephones belonging to the MoD that were lost during 01st April 2009 - 31st March 2010.  (4) The number of mobile telephones belonging to the MoD that were stolen during 01st April 2009 - 31st March 2010.
24-09-2010-101413-002,21/10/2010,Information about what type of use would be permitted at the site within existing planning consent and regulations.
24-09-2010-105352-003,21/10/2010,"To map all PEXA locations that are in close proximity to oil and gas fields, request for the SHP files showing all the PEXA locations in UK waters?"
24-09-2010-110424-005,13/10/2010,Reference the Additional Radar Study to the BWE: What was the date of the release?  To whom at the BWEA was the report sent?  What information was sent with the report in covering letters or associated emails?  Under what terms was it released to the BWEA?
24-09-2010-110934-006,19/10/2010,The date when a Ministry of Defence Police Agency officer attached to the Divisional Support Group in York) attested under the Ministry of Defence Police Act 1987. 
24-09-2010-112058-004,21/10/2010,Request relating to correspondence between Prince Andrew and ministers in your department.
24-09-2010-115541-005,21/10/2010,"What is the cost per pair of boots recently bought from Hayes and Cann, a company likely to close at the end of October after cancellation of its very specialised air force boot contract?  Also, would the Hayes and Cann boot contract be reconsidered and perhaps reselected if costs were close to alternatives outside the UK?"
24-09-2010-121054-006,21/10/2010,I have experienced lack of clarity as to the access rights to the byway shown on the attached map. It is my understanding that this is open to public access providing the red flags are not flying. Please can you confirm this?
24-09-2010-142442-001,21/10/2010,"Can you please confirm that para 2 of the SoS Health and safety Statement which states: ""Within the United Kingdom we comply with all legislation which extends to the UK (including legislation giving effect to the UK international obligations"", means that Euratom and UK national legislation which implements the requirements of Euratom now includes military activities?"
24-09-2010-143651-001,22/10/2010,"(1) How many staff, at any grade, have signed a settlement (or compromise) agreement with your organisation? Of these how many were signed by whistleblowers?  (2) Of these compromise agreements how many included a confidentiality clause. How many of these clauses were signed by whistleblowers? (3) How many of staff have made a claim against your organisation under the Public Interest Disclosure Act 1998? (4) How many staff who made a claim under PIDA then went to an employment tribunal? (5) How many of these cases were successful for the claimant and the total amount awarded to each individual? (6) Provide copies of all the compromise agreements you have entered into with staff at any grade."
24-09-2010-150451-001,22/10/2010,"All annual legal costs incurred by the Ministry of Defence in the last 10 years, broken down year by year.  Also, If possible, this expenditure broken down into specific areas as per your records"
24-09-2010-151032-002,22/10/2010,How much did the MoD pay out in the Incidental Expenses in the year 2009?
24-09-2010-151404-002,22/10/2010,Information on Project Borona and British Forces Germany.
24-09-2010-151528-003,22/10/2010,Copies of all correspondence between the MOD and the Royal Household between 1 January 2010 and 24 September 2010.  I would like to request solely the MOD's side of the correspondence.
24-09-2010-165752-004,22/10/2010,"Information and pictures on the Junior Tradesmen Regiment Troon, Dundonald Camp, Troon.  Who would now hold the regiment records as it was disbanded in 1974."
27-09-2010-094813-001,22/10/2010,"Provide me with all documents produced by the MoD since 1st May 2010 - including internal correspondence, emails, memos, reports, presentations etc - on the subject of HMS Victory, Lord Nelson's flagship now in drydock in Portsmouth.  Also provide me with the most recent document produced by or for the MoD on the current state of the vessel, in terms of its maintenance, general state of repair, work required on her etc."
27-09-2010-095917-002,22/10/2010,"With reference to the parliamentary question 8 Apr 2010: Has your department commissioned individuals from the panel of independent investigators in the last 30 months, and for what purpose? How much has your department spent on private detectives in the last 30 months, and for what purpose? Please supply any relevant documentation. "
27-09-2010-100529-003,25/10/2010,Three questions relating to civilian Ministry of Defence staff charged with a disciplinary offence relating to fraud or other deception from 1 January 2008 until the date for which the most recent statistics are available.
27-09-2010-101541-004,25/10/2010,"How many accidents (health and safety) were reported to the MOD between 25 September 2009 and 25 September 2010 that involved MOD staff.  I would like the date and nature of each accident please.  Accidents need only include those on UK soil, i.e., not in Afghanistan, Iraq or anywhere abroad."
27-09-2010-102005-005,25/10/2010,"Information on how to find out about a specified individual's war record and what the letters mean, for example what is the second airborne division?"
27-09-2010-145734-001,22/10/2010,Clarification of request for a list of items stolen between 21 September 2009 and 21 September 2010 with values above £500.
27-09-2010-151314-002,25/10/2010,Provide details of all allowances and their value paid to Information technology (IT) or Communication Information Systems (CIS) Staff within the MOD and its Agencies.
27-09-2010-154711-003,25/10/2010,Four questions relating to insurance on military personnel killed or injured on active duty.
