FREEDOM OF INFORMATION,,
MOD Requests to 01 October 2010,,
"CIO-CI-Access Team, Ministry of Defence, CIO-FOI@mod.uk",,
,,
,,
Case Number,Date Due,Request Summary
31-08-2010-094310-001,27/09/2010,"I am searching for the full air accident report for an air crash on 17 September 1959, of serial no. XA424 (Gannet AS4) operating from RNAS Culdrose. All three servicemen on board were killed, whilst trying to land at Winkleigh, North Devon. "
31-08-2010-095915-002,28/09/2010,Does your dept have any blueprints of the Volkswagen Schwimmwagen from the time the British occupied part of Germany after the war including the VW factory in Wolfsburg?
31-08-2010-100652-003,28/09/2010,"Details about foreign recruitments, especially with Commonwealth countries, such as Canada?"
31-08-2010-103544-004,27/09/2010,Provide all minutes and communications of the Media Group chaired by Director News between September 11th 2001 and December 2005.
31-08-2010-110126-002,28/09/2010,"For research on the management of the Book of Reference (BR) by various navies to set up a special team to control, manage and administrate the BRs in the Malaysian Navy. Some information from the Royal Navy as the RMN itself were originated from RN and to use most of the BRs from UK as guidance."
31-08-2010-112811-003,28/09/2010,"For a dissertation on PTSD amongst those serving in the military. How may social workers the MoD employs, and how many (if any) are deployed?"
31-08-2010-114255-004,28/09/2010,How many MoD civilians and service personnel have been disciplined for personal use of the internet.
31-08-2010-131024-005,28/09/2010,Supply information currently held by the MOD for a proposed third Phase of Crystal Rig Windfarm (Crystal Rig III) in East Lothian/ Scottish Borders including any information exchanged with the developers or the Scottish Government.
31-08-2010-131827-006,28/09/2010,"Provide the total number of days lost through staff sickness, discipline or suspension for the years 2007, 2008 and 2009, if possible, within the statutory cost, break this down by month."
31-08-2010-132409-007,28/09/2010,Request for further information on answer provided for previous request submitted.
31-08-2010-145522-001,16/09/2010,Request for disclosure of documents.
31-08-2010-153337-004,28/09/2010,(1) Provide the number of occasions where surveillance as regulated by the Regulation of Investigatory Powers Act has been used in respect of assessing the validity or extent of compensation claims being made by injured servicemen since 2000.  (2) Of the total number of occasions identified in response to question 1 on how many occasions has the claim for compensation been rejected?  (3)  What was the total cost to the MoD of these surveillance operations broken down by financial year? 
01-09-2010-104417-001,28/09/2010,"(1) The citation for the DSO of specified individual awarded 6 Sep 1940.  (2) Any records pertaining to the events immediately prior to, during and after the sinking of U13 by HMS Weston 3 May 1940.  (3) Any records pertaining to Operation ROBIN especially the reasons for and outcome of the operation."
01-09-2010-112302-003,28/09/2010,The number of servicemen and women treated by Defence Medical Services for mental health conditions thought to be related to their deployment in Iraq since 2003 and Afghanistan since 2005.
01-09-2010-114840-001,28/09/2010,"(1) Total amount of severance pay/redundancy pay that has been paid to staff in your Department in the financial year 2007/8, 2008/9 and 2009/10 (separate totals for each year).  (2) Number of staff who received severance pay/redundancy pay in the financial year 2007/8, 2008/9 and 2009/10. (separate totals for each year).  (3) The top five amounts paid out in severance pay/redundancy pay in the financial year 2007/8, 2008/9 and 2009/10, and, if possible, a job description of the people receiving the money. If providing a job description would identify the individuals involved."
01-09-2010-123914-001,29/09/2010,(1) How many instances have their been of unauthorised access to your Departments information systems [computer systems] over the last 5 years?  (2) How many attempted instances have there been of hacking [or other forms of computer infiltration techniques] to gain access to your Departments information systems [computer systems] for which have been prevented?
01-09-2010-125708-002,29/09/2010,"How much does your Department spend on protecting the information systems network [such as anti virus software, hardware and consultancy work] for the last financial year?"
01-09-2010-131312-003,22/09/2010,"If the MET office has a purchasing card programme: (1) Which bank provides your purchasing card scheme? (2) What was the total amount of spend placed through the scheme last financial year (1st April 2009 - 31st March 2010)? (3) When does your contract for the supply of purchasing cards expire?  (4) Does the contract have a break clause?  If the organisation does not have a purchasing card programme, please could you confirm this is the case. If the organisation has more than one programme could you provide answers for all the programmes that are currently running in the organisation."
01-09-2010-154522-001,20/09/2010,Information regarding the admission of 8000 Ukrainians at the end of World War II into the United Kingdom.
01-09-2010-165457-002,29/09/2010,Request relates to a series of incidents in Afghanistan in which local civilians have been either killed or wounded by British forces. 
02-09-2010-101743-001,23/09/2010,Information regarding the Contract placed by Defence Equipment and Support on QinetiQ to provide range testing services.
02-09-2010-104813-002,31/08/2010,Between what points are the baselines from which the breadth of the territorial sea adjacent to Great Britain is measured drawn?
02-09-2010-111252-003,07/09/2010,Could you let me know how much gets paid out to Service Officers each year in respect of boarding school fees for their children.
02-09-2010-112056-001,21/09/2010,Information relating to the Armed Forces: No of employees split by full time and part time; payroll and HR supplier; payroll and HR product used; payroll and HR contract renewal date; length of payroll and HR contract; who has responsibility for the payroll and HR solution; cost of payroll and HR solution.
02-09-2010-122835-004,30/09/2010,"Reference FOIA answer from DECC that 1 official from the MoD attended a two hour long ?Peak Oil Workshop? organised by DECC on the 2nd of July 2009.  Provide copies of all records held by the MoD related to this workshop (e.g. notes, reports, memos, emails, transcripts, presentations etc.)."
02-09-2010-145136-001,30/09/2010,"As of 1 September 2010 how many senior officers of the Royal Navy were serving at sea?  (1) in command of a Fleet  (2) In command of a Flotilla.  (3) In command of a Warship, by Senior Officers--- Captains Commodores and Admirals."
02-09-2010-162813-002,30/09/2010,"The number or percentage of recruits to the British army from the Republic of Ireland in 2009, 2008 and 2007. Any breakdown of where they signed up to the army ie Northern Ireland, England etc would also be helpful."
03-09-2010-095833-001,30/09/2010,"Four questions on plans Department has made in order to comply with the Government’s ‘one in one out’ regulatory policy, which began on 1st September 2010,"
03-09-2010-100648-002,30/09/2010,"Six questions on the numbers of civil servants and ministers in the Ministry of Defence methods of travel during the months of June, July and August 2010. "
03-09-2010-101657-003,30/09/2010,"Number of TG18 Logistics (Movements) personnel are in receipt of Specialist Pay (Flying Crew). In accordance with JSP 754 Chapter 6 Section 18 Paragraph 06.1803 personnel of No 1 AMW (MAMF) receive Specialist Pay (Flying Crew)(SP(FC)) on a Non Continuous Basis (NCB). How many personnel from 1 AMW are in receipt of SP(FC), from what date was SP(FC) awarded to qualifying members of No 1 AMW and what was the full justification of the award of SP(FC) to those personnel."
03-09-2010-101750-001,30/09/2010,Provide copies of all correspondence to and from your organisation and  1.1: The Conservative Party and related agencies/brokers; 1.2: The Liberal Democrats and related agencies/brokers.
03-09-2010-102244-004,30/09/2010,"Reference the British military caches (a total of 33) which were uncovered by the Austrian Police and Army in 1959, 1960 and 1965.  Request the documents relevant to the establishment of these Weapons caches, and documents relating to the Austrian discovery of these documents; for example, correspondence within the Ministry of Defence, communication between the various parties involved in the United Kingdom and communication with the officials in the Austrian government."
03-09-2010-103605-005,30/09/2010,Details of any meetings (including minutes) between any of the listed former public servants with any civil servants at Grade 5 level and above within the Ministry of Defence over the last two years to discuss business involving their current employer. 
03-09-2010-105708-006,30/09/2010,"Supplier spending data for the Ministry of Defence, Media and Sport, as per the 'Communities and Local Government and arm's length bodies' spending data 2009-10? published 12 August 2010 including all suppliers in the listed primary and secondary areas."
03-09-2010-112416-002,30/09/2010,"Any documents that show diplomacy with the local decentralized social groups that make up Iraq or Afghanistan, as well as giving permission to reference the relevant portions of those documents in my paper."
03-09-2010-115255-003,30/09/2010,"Requesting parts catalogue for FV432 Armoured Personnel Carriers, AESP 2350-T-251-711."
03-09-2010-120304-007,09/09/2010,"Of the Afghan standing army, which we and NATO are training to take over security - ie. (a) the percentage from pro-Taliban tribes and (b) how that army is to be paid for?"
03-09-2010-152210-001,01/10/2010,Has there been any incidents of carbon monoxide poisoning involving the crew inside an AFV whilst operating in a battened down situation or whilst operating main and or coaxial machine-guns.  Also has there ever been any reported incidents of carbon dioxide poisoning in the same vehicles or in any other Armoured fighting vehicles such as APC'c or armoured engineering vehicles?
03-09-2010-153133-002,01/10/2010,"Various questions on the number of suicides by MOD personnel in 2000, 2001, 2002, 2003, 2004, 2005, 2006, 2007, 2008 and 2009."
03-09-2010-154215-001,01/10/2010,EOD Reports 39 Bde Intelligence Summaries. Press Logs Policy for Classified Documents.
03-09-2010-155712-003,01/10/2010,Information on the Met office observing stations and weather radars across the UK.
06-09-2010-114615-001,01/10/2010,(1) How many applications for the 'Elizabeth Cross' have failed?   (2) For what reasons have the applications failed? (3) Provide detail with numbers? (4) Have any of these failures been linked to former officers and soldiers of either the Ulster Defence Regiment (UDR) or Royal Irish Regiments (6) For what reasons have the applications failed? (7) Provide detail with numbers?
06-09-2010-115639-002,04/10/2010,"Please supply a break down of MPGS by rank structure employed in the UK, and if possible by unit location."
06-09-2010-120051-003,04/10/2010,"Please supply information regarding the MPGS service and how many houses or accommodation is supplied to there staff, with costings if possible but the main point is how much housing accommodation they utilise, and if possible a break down of locations or areas if possible."
06-09-2010-132928-001,01/10/2010,"(1) The total number of campaign letters, postcards and emails that appeared to be part of a coordinated campaign you received from June 2009 to July 2010; (2) the breakdown of these numbers by delivery method (letter, postcard and email); (3) A breakdown by topic and/or organisation(s) where you received more that 500 items of correspondence (through any delivery method) that appeared to be part of a coordinated campaign in the period defined above."
06-09-2010-151610-002,24/09/2010,Regarding British nuclear tests Australia and Christmas Island 1957 and 1958.
06-09-2010-153326-002,01/10/2010,"(1) Number of fatalities of aircrew, sorted into broad aircraft type (rotary, jet and fixed wing), country where the accident took place and the number of passengers on board suffering fatal injuries, by year for the past decade.  If possible the jet category could be split further into aircraft type. Also whether RAF or Navy pilots.  (2) Any statistics that show a breakdown of the cause of accidents noted with the above. (3) Age and rank of the pilot. (4) Any statistics regarding bomb service personnel disposal mortality rates for last ten years including breakdown of location/area."
06-09-2010-160342-003,04/10/2010,What proportion of deployed forces in Iraq and Afghanistan were/are female?
06-09-2010-161146-004,04/10/2010,"The number of service leavers per year in the 16 - 25 age group; Further split if possible by: The service they are leaving, Age, Gender, area they live in and reason for leaving."
06-09-2010-162247-003,20/09/2010,Copy of the NWCSP Handling Strategy
07-09-2010-093824-001,27/09/2010,Which supplier or suppliers your organisation has contracts with for the provision of the following ICT services: Application Support; Hosting; Managed Services; DBA; Support; Performance Testing; Penetration Testing.  Specify which of the services each contract covers and include contract end/renewal dates.
07-09-2010-100202-002,04/10/2010,"How many soldiers, airman and sailors have gone AWOL from active service, broken down by year, over the past five years?"
07-09-2010-101324-004,04/10/2010,"If there was great civil unrest in England to the point of the British Police force not being able to handle the situation, a civil war scenario, is there a procedure where the British Army would Police the streets of England as a peace keeping force?  Or is there any similar procedure that involves the British Army concerning civil unrest to the point of civil war in England?"
07-09-2010-102320-005,04/10/2010,"How much public money has been spent on dining furniture (table and chairs) for the Commanding Officers residence at JHC/RAF Station Aldergrove in the past five years, and what is the present location of furniture procured?"
07-09-2010-102858-006,04/10/2010,All information held within communications (emails/faxes/letter/ or whatever format they were made) between MoD/Army and Historic Scotland from 1st June 2010 to present related to the flying of (a) the Union flag at Edinburgh Castle and (b) the Saltire at Edinburgh Castle.
07-09-2010-103244-007,04/10/2010,"Broken down by year and region, over the past ten years, can you provide me with how many UFO reports have been made in Afghanistan?"
07-09-2010-104701-008,04/10/2010,"On Monday, October 27, 2008, a hangar at Wattisham Airfield in Suffolk was evacuated after what was initially believed to be a live missile was discovered on an Apache helicopter. The hangar was reopened by 3.45pm. Wattisham Airfield has now launched an investigation. Could you submit documents relating to the investigation?  A summary of the investigation, its outcome and action taken as a result, including, if applicable, persons (name and/or position) reprimanded over the incident."
07-09-2010-133248-001,05/10/2010,Six questions on internet abuse at work.
07-09-2010-145608-002,05/10/2010,Four questions regarding details of the total amount of money spent by the MoD on RN Individual and Unit Training conducted by FOST in the last year broken down into the listed categories.
08-09-2010-092246-001,05/10/2010,Provide the numbers of service personnel killed whilst taking part in a training exercise on Salisbury Plain in 2009 and separately for each year dating back to 2000?
08-09-2010-093049-002,05/10/2010,"Reference the Guardian newspaper published story on July 25, 2010 about 21 incidents in which British troops were said to have shot or bombed Afghan civilians, including women and children. "
08-09-2010-094836-003,05/10/2010,Information on the British Army's use of cluster canisters in the deployment of CS Gas.  I would also like to know if helicopters have ever been used in the deployment of CS gas.
08-09-2010-095221-004,05/10/2010,"Information on Dibenzoxazepine (CR Gas).  I would like to know the date it was authorised for use, the manner in which it was to be deployed and the results of any testing that was carried out on it."
08-09-2010-095551-005,05/10/2010,"Information relating to the use of CS gas by the British Army in The Maze Prison on the 15th and 16th October 1974.  I would like to know the manner in which the CS was deployed, the concentration of the CS and which regiments were involved in its deployment.  Also, I would like to know if helicopters were involved in the deployment of the CS Gas."
08-09-2010-104506-006,05/10/2010,Thank you for the information that 60 uniformed Pashto linguists and 30 Dari linguists were serving in Afghanistan. As a corollary please advise the ranks and service RN RAF Army of: (1) The Pashto linguists and (2) The Dari linguists.
08-09-2010-113803-007,06/10/2010,Reference overall policy statement of how the War Office/MOD has managed army personnel medical records from the end of WW2 to the present day.
08-09-2010-154739-001,06/10/2010,"The Ministry of Defence mounted a Conference in December 1995, on the subject, DEFENCE 2010.  Request for a copy of the full proceedings of the conference. "
08-09-2010-175251-002,06/10/2010,"How many Officers of Air Rank (1*, 2*, 3* and 4*) have retired from the RAF during the period 1st September 2009 to 1st September 2010.  What are their names and what was the last appointment that they held?"
09-09-2010-090624-001,06/10/2010,Ten questions to the Met Office on whether staff are entitled to access Social Networking sites via the organisations network.
09-09-2010-095224-001,06/10/2010,"How many prisoners were first held by the Japanese and how many actually survived and were able to return home.  Also, where were the worst camps and places for our POW's."
09-09-2010-103330-002,06/10/2010,"Reference EQ1 (XV230), some fuel couplings, between rib 2 (Stb) and rib 2 (port) were disturbed/replaced. Provide a list, with location, of those affected."
09-09-2010-112903-003,06/10/2010,State equivalent military and civil service rank of the defence fire risk management organisation officer corps.
09-09-2010-113448-001,07/10/2010,How many UFO sightings have been reported by British Forces in Afghanistan.
09-09-2010-113841-004,07/10/2010,Reference information on site undergoing small-scale redevelopment works.
09-09-2010-122837-005,01/10/2010,"Provide the names of any MOD staff who attended meetings at Grahame Terrace London with directors of North British Windpower Limited or Sir John Chilcot during 2008,2009 and 2010."
09-09-2010-123233-006,29/09/2010,"(1) What the travel and subsistence expenditure for Advanced Techniques Department was for Years 2008/2009/2010.  (2) What the individual costs and class of travel for individuals travelling to the United States over the same period of time as above where.  (3) Provide a copy of the current DSTL travel guidance and regulations. (4) Provide a copy of the policy for DSTL personnel in relation to the acceptance of gifts, and or travel upgrades."
09-09-2010-123931-007,05/10/2010,Provide the number of staff based at Wethersfield civilian staff that are currently in the redeployment pool with a breakdown by grade and department.
09-09-2010-124512-008,07/10/2010,Six questions regarding the sale of Chelsea Barracks.
09-09-2010-125808-001,07/10/2010,"Information regarding the pullout of the British troops out of Germany, especially of the Garrison Hohne."
09-09-2010-150931-002,07/10/2010,"Design details on current bases and camp buildings used in Iraq / Afghanistan in terms of construction, whether they be tents, portable shed constructions etc."
09-09-2010-153740-001,23/09/2010,"A copy of the Unit Inquiry related to the death of a relative, who died in a climbing accident on 29 Aug 2009."
09-09-2010-161248-004,07/10/2010,"(1) The number of accidents in laboratories involving MOD-employed or MOD-funded researchers for the following years: 2009, 2008, 2007, 2006, 2005;  (2) Copies of any reports into safety at MOD laboratories or concerning MOD-sponsored researchers produced in the last 10 years."
10-09-2010-090956-001,07/10/2010,What is the average cost to Develop Vet (DV) a member of the RNR?  How many RNR personnel hold DVs?  What number of RNR Intelligence and Information Operations personnel hold DV status?  How long does a DV last for RNR personnel?  How many days per year do RNR personnel carry out professional trade training?  Is the SDSR looking at the cost of vetting RNR personnel to DV standard and to make savings in this area? What is the total cost to vet RNR personnel to DV standard?
10-09-2010-091615-002,07/10/2010,"Copies of all correspondence between the MoD and the Treasury about the case of FTRS and NRPS personnel retaining their pension and/or any other terminal allowance on completion of Regular service be released. Also, copies of any documents internal to the MoD where the issue was discussed and/or illustrative calculations made about the impact of the loss of pension and/or terminal pay also be released."
10-09-2010-092547-003,08/10/2010,"(a) How many FOI/EIR requests the MOD received by month for 2008,2009, 2010.  (b) By month for 2008, 2009, 2010 how many of the above FOI/EIR requests were responded to within 20 working days."
10-09-2010-093345-004,07/10/2010,"Copies of any assessments made of, passed to, or held by the UK MOD regarding the US government's Human Terrain System programme."
10-09-2010-112811-005,08/10/2010,Reference Help for Heroes and the  armed forces: an approximate figure as to how much the MOD spends on rehabilitation for servicemen and women and how much is the budget.
10-09-2010-121256-006,08/10/2010,A list of all locations in the UK and abroad where the Ministry of Defence has MOD Police Officers stationed and the complement of officers at that station and also specified data regarding recruitment and retention for the past three years.
10-09-2010-144610-001,07/10/2010,What was the distribution of the summary of the Radar Study?
10-09-2010-162417-002,08/10/2010,"Recent information on officer and soldier career progression by corps.  Also, the soldier career progression by Infantry division."
13-09-2010-091409-001,08/10/2010,"Regarding 40 Commando Royal Marines who are based in Taunton, since their deployment to Afghanistan in March / April, how many marines have been very seriously or seriously injured?"
13-09-2010-092519-002,08/10/2010,A list of meetings which have occurred between each of the ministers in your department and outside interest groups since July 1 2010.
13-09-2010-094007-003,08/10/2010,"Unredacted copy of a letter, MoD reference D/Sec(AS)/12/3 part P enclosure 57."
13-09-2010-114938-001,11/10/2010,Request for known retired officer deaths since the publication of the 2007 (and final) biennial Navy List of Retired and Emergency List Officers
13-09-2010-123034-003,11/10/2010,Looking to gain access to AIR 2/13800 - V-Bomber force operational readiness committee 1957-1959.
13-09-2010-141200-001,04/05/2010,"The reorganisation of the high level command structure of HQ Land Forces in 2009, supply an organisation chart / details of the internal directorate structures"
13-09-2010-150204-002,07/09/2010,Five questions regarding the disposal of the ex 543 Squadron Victor B2 (SR) aircraft after 543 Squadron was disbanded and the aircraft disposed of?
13-09-2010-151812-001,11/10/2010,Copies of any material relating to an incident which took place on 21st July 1994 near Alton Barnes the behaviour of a number of helicopters
13-09-2010-163358-002,11/10/2010,"The cost of champagne procurred by the Ministry of Defence for 2010, 2009, 2008"
13-09-2010-165203-004,09/08/2010,I am trying to find where Penhale Camp Perranpoth Cornwall would be advertised for sale and which Estate Agents would be handling the sale
13-09-2010-171410-003,27/09/2010,"During the past year, where and when horses have been used in ceremonial duties by the British Army - and supply details of other animals used by the Army."
13-09-2010-171714-005,09/08/2010,"How many serving officers in the MOD police, RAF police and Royal Military Police have criminal convictions?"
14-09-2010-092644-001,11/10/2010,"Copies of all MOD produced documents (including those produced by the Services or Service Cadet Forces), which relate to the ACO's use of JSP 535"
14-09-2010-094034-002,11/10/2010,Information held by the MOD relating to its consultation by the Scottish Government on Wester Dod Windfarm during 2010
14-09-2010-095144-001,11/10/2010,Electronic copy of MoD policy document AFCPB/MFWG/03
14-09-2010-100009-003,06/10/2010,Information regarding the purpose of HM Armed Forces Toys
14-09-2010-102652-002,11/10/2010,Electronic copy of the following service casualty manuals: BR8886 (Naval Service); AC12874 (Army); AP1933 (RAF).
14-09-2010-110434-004,11/10/2010,Career patterns in the British Army for Other Ranks and for Officers.
14-09-2010-111327-005,11/10/2010,Patterns of service and promotion in the Royal Navy for officers and ratings
14-09-2010-112633-006,11/10/2010,Does the MOD have any plans to follow US example and issue fire resistant military uniforms to all soldiers and other front line personnel in Afghanistan?
14-09-2010-114257-006,05/10/2010,Please disclose all grants for public funding to not-for-profit Royal British Legion who represent veterans and lower level and upper tribunal Hearings.
