FREEDOM OF INFORMATION,,
27-09-2010-161442-004,25/10/2010,"Request all communication between the Ministry of Defence and the Royal Household over the years 2004 to 2010, excluding those documents that are routinely published in the public domain and is still available on the MoD and/or British Monarchy websites."
27-09-2010-163536-001,25/10/2010,Information on HMS Caicos - 1945 Anti-flying bomb patrol details.
27-09-2010-163940-005,25/10/2010,"(1) The number of baggage support staff deployed by the MoD in support of the Queen or Royal Family each year since 2002. (2) The number of occasions they were deployed each year since 2002. (3) Details of the nature of the occasions, including the date, location, engagement and size and make-up of the baggage support team in each case, for each year since 2002. (4) The cost to the MoD of providing baggage support staff in support of the Queen or Royal Family each year since 2002."
27-09-2010-171010-006,25/10/2010,How many department issued mobile phones / smartphones / Blackberry devices are currently in use by staff in your government department?
27-09-2010-171531-007,25/10/2010,"How many Department-issued mobile phone were reported lost or stolen in 2008, 2009 and currently in 2010?"
28-09-2010-092552-001,25/10/2010,Various questions regarding the Strategic Defence and Security Review.
28-09-2010-093202-002,25/10/2010,Various questions regarding the review of the rules governing the awarding of medals as announced in the coalition Government’s manifesto.
28-09-2010-093727-003,25/10/2010,"Regarding the review of the cost of renewing Trident above, when was it originally intended to report; the currently anticipated date of report. "
28-09-2010-094321-004,25/10/2010,Various questions regarding the review of the Defence Reform Review.
28-09-2010-103828-002,26/10/2010,Provide details of the number of British troops suffering from post conflict trauma who have been referred to clinics in the last two financial years and how much that treatment has cost?
28-09-2010-104615-003,26/10/2010,Provide copies of any RIDDOR forms that have been sent to the Health and Safety Executive in relation to the training of new recruits on army camps in each of the last three financial years.
28-09-2010-105543-004,26/10/2010,"Regarding the amounts paid to staff as bonus payments for forecast accuracy, could you provide any information/documentation as to how this calculation is made as well as data to explain how/why staff qualified for such a bonus in the 08/09 year?"
28-09-2010-110903-005,26/10/2010,"Regarding RAF Bentwaters in Suffolk that closed in 1993, requesting all documents on the underground facility and its use."
28-09-2010-135231-001,26/10/2010,Provide a breakdown of the disease or non battle injury category in the field hospital admissions statistics for Operation Telic (Iraq) and Operation Herrick (Afghanistan). Include the types of disease / non battle injury and whether the casualties are civilians or soldiers. Also provide statistics for the number of admissions relating to malnutrition.
28-09-2010-141154-002,26/10/2010,"Details of the sale of RAF Chenies in Hertfordshire and also the sale of the Bovingdon Mast on land at the rear of Corn Close, Long Lane in Bovingdon Hertfordshire.  Specifically, was RAF Chenies offered for sale to NATS and/or other Government agencies?"
28-09-2010-144206-003,26/10/2010,"For each of the years 2007, 2008 and 2009 please provide details of: (1) the number of complaints received by overseas location of delays in or failure to deliver mail. (2) the length of time taken on average to deliver mail to each overseas location. (3) any specific complaints or delays in mail to Bosnia."
28-09-2010-151723-004,26/10/2010,"Photos of the submarine HMS ASTUE (quality: high resolution), or perhaps, could we take some of your homepage."
29-09-2010-091927-001,26/10/2010,"Details regarding Compassionate leave granted to servicemen on operations following the normal birth of a child while the serviceman is in the field of operations and not during the serviceman's R and R, restricted to Op Herrick, Afghanistan, for the period 01 September 2009 - 01 September 2010."
29-09-2010-105057-002,26/10/2010,(a) All MoD owned/controlled airfields within the UK  (b) Any special conditions relating to the use of Dunsfold for night exercises with heavy-lift helicopters.
29-09-2010-105651-003,26/10/2010,"The current number of housing available for British Forces Service Families (service family accommodation) in Bielefeld, Germany for September 2010. In particular the grade c and d type housing.  Out of that number how many are occupied, unoccupied and those undergoing maintenance work and cannot be occupied at present. The same information for Sept 2009 and Sept 1999."
29-09-2010-110815-001,27/10/2010,"Breakdown of data from the following report by Service -  with a split of the Naval Service between Royal Navy and Royal Marines: British Casualties Afghanistan, Edition - 07 Oct 01 - 31 Aug 10 - Afghanistan Casualty and Fatality Tables."
29-09-2010-113539-004,27/10/2010,"I would like to inquire whether there are any aerial photographs taken during for instance reconnaissance flights around 1940 - 1945 and if you could supply them for the purpose as described above?  The area of interest is located at 52.60995393057445?N, 7.7985334396362305?E in Germany, roughly covering the triangle between the villages of Berge, Nortrup and Eggermuehlen."
29-09-2010-140253-001,27/10/2010,"What is the Armed Forces policy for those who do not elect to have reassignment surgery but, are in receipt of a Gender Recognition Certificate. How does the Armed Forces cater for these people; are they considered to have a long term medical condition or are they able to fulfil their normal operational role and continue in the Services without the uncertainty of being placed before an Employability Board?"
29-09-2010-154212-001,27/10/2010,A copy of the 2006 Safety Improvement Notice issued by DNSR relating to the air transport of highly enriched uranium loads; Confirmation and any supporting documentation confirming that the required action(s) in the Safety Improvement Notice have been fulfilled; A list of all Safety Improvement Notices issued by DNSR since January 2005.
29-09-2010-161109-002,27/10/2010,"When a soldier has been injured and therefore disabled as a result of their position in the MOD, how long can they live in the housing that is provided through the MOD after they have been forced to end their career?  How many of these homes have been found to be sub-standard?"
29-09-2010-164046-003,27/10/2010,"(1)  The market rates analysis and any associated paperwork quoted in your letter of 11 March 2010 (copy attached) and Paperclips Special Edition, Feb 2009, which the MOD used to base it's decision to reduce the E1 maximum. (2)  The rates of pay and job evaluations and any associated paperwork gathered from/relating to OGDs and wider private sector which you used to compare with the MOD pay scales. (3) The job evaluations in the E1 and other grades you used to base your decision; i.e. list each job you looked at and supply the job descriptions of each job."
30-09-2010-104811-001,27/10/2010,A relative was a cameraman on a naval helicopter which was filming a naval display off Portland Bill on May 20th 1971.  The relative and three others were killed as the helicopter fell and hit the water.  I would like to see the report on this incident.
30-09-2010-110355-002,28/10/2010,"Who produces the Fairbairn-Sykes Knife, actually issued  to the British armed forces? Which branches are issued with the FS-Knife? Are there any field-experiences?  Has it any special Markings?  What happens with separated knifes? Which other edged Weapons are in use?"
30-09-2010-111757-003,28/10/2010,Information regarding the piloted aircraft that have been used in Afghanistan and how many hours each aircraft type has flown for.
30-09-2010-114205-004,28/10/2010,Information on the cost of operating the various piloted aircraft in the Afghanistan theatre.
30-09-2010-115840-005,28/10/2010,Information regarding the number and the cost of munitions expended by piloted aircraft in the Afghanistan Theatre.
30-09-2010-130525-001,27/10/2010,"Regarding the Bosnian Conflict, when the British Forces were deployed under The United Nations, on a per soldier basis: (1) The amount of funding received by the British Government from the United Nations, per day for an individual soldier. (2) The amount of United Nations pay a soldier received per day whilst deployed  as part of the UN task force."
30-09-2010-152123-002,27/10/2010,Various questions relating to the would be the head of the IT department for the MET Office.
30-09-2010-153122-003,20/10/2010,"Information about the BAe146 Atmospheric Research Aircraft (ARA), in particular, what are the Met Office's annual operating costs for this aircraft and how many hours does the aircraft fly annually?"
30-09-2010-154018-004,28/10/2010,"Information regarding Buccaneer XV157. I'm trying to uncover a detailed history of this particular aircraft, and would like to know its service history, who the pilot/navigator was and ultimately where it was scrapped and if any parts survived. Any other information you have on this aircraft would be of great assistance."
30-09-2010-154930-005,28/10/2010,Information relating to the sinking of the SS Lindisfarne 1942 would be very much appreciated.
01-10-2010-085804-001,28/10/2010,Information relating to the Roll played by Denver Mill (just outside Downham) during the war.
01-10-2010-090509-002,28/10/2010,"Information on the  Commands and Drill movements for the Queens Colour Squadron Continuity Drill Display, 63 Sqn RAF Regiment."
01-10-2010-102630-001,28/10/2010,Confirm that as of 15 September 2010: 294 Captains; 81 Commodores; 25 Rear Admirals; 8 Vice Admirals; 2 Admirals Of which two Captains were serving at sea.
01-10-2010-115304-002,29/10/2010,The number of individuals and total cost of (i) interim managers (ii) specialist contractors (iii) consultants and (iv) agency staff employed by your department in each of the last three financial years.
01-10-2010-153104-001,28/10/2010,"Details of the total cost of a specified individual's driver and use of the car for daily journeys for a year between Surrey and Abbey Wood, broken down into specified categories"
01-10-2010-170952-002,29/10/2010,"Relating to the stories that abound in the internet about the role of RAF propaganda during WWII spreading the myth that carrots improve one's eyesight. I would like to know if there is any basis to this story, and what documents if any I could request."
01-10-2010-171549-003,29/10/2010,"The agenda, meeting notes and correspondence relating to meetings between representatives of A4E Ltd (and their subsidiaries)/ Emma Harrison and representatives of the Ministry of Defence in May 2010, including, but not limited to a meeting on Tuesday 25 May 2010.  Indicate the location, dates and subject matters of meetings in the 6 months prior and after that date with representatives of A4E Ltd (and their subsidiaries) and representatives of the Ministry of Defence."
