FREEDOM OF INFORMATION,,
15-04-2011-121243-006,19/05/2011,"How many outbreaks of fire has there been on nuclear submarines between 1987 and today. How many of these fires have been classed as large scale. How many of these fires have been classed as medium scale. How many of these fires have been classed as small scale. Of the large scale fires, please list which vessels were involved, where the vessels were located at the time of the fires and the exact date of each fire. Of the medium scale fires, please list which vessels were involved, where the vessels were located at the time of the fires and the exact date of each fire."
15-04-2011-131452-009,17/05/2011,"Request details of a Halifax Bomber crash in Germany, 1943."
15-04-2011-140236-001,19/05/2011,"Any and all documents, and radio logs between  the helicopter and the D-Class lifeboat who attended the incident off the coast of Treagddur Bay, North Wales on 21 August 2009."
15-04-2011-144152-001,17/05/2011,Number of employees working on fixed term contracts at MOD and Agencies in the last 3 years.
15-04-2011-145241-002,17/05/2011,"Information concerning de-icing/salt gritting carried out at DSDA Arrochar in January 2009, policies and procedures including any changes."
15-04-2011-150407-003,19/05/2011,"Overall numbers of people in performance categories excellent, good, satisfactory or unsatisfactory by basic salary banding."
15-04-2011-155646-004,19/05/2011,Training materials related to recovery of light vehicles (e.g. TUL/TUM).
15-04-2011-160305-005,19/05/2011,"All briefing documents, policy documents and submissions to ministers on the subject of discharging armed forces personnel who are medically unfit for duty written by Major General Andrew Gregory, director general of army personnel Brigadier Richard Nugee, director of army manning Commodore Jonathan Woodcock, head of armed forces pay and manning."
15-04-2011-160832-006,19/05/2011,For all PPP or PFI signed projects within your department I request to see the following details 1. the names of all companies in each consortium 2. the contract between the consortium and government of each signed project 3. the year on year forecasted payments to each consortium 4. the main document you hold detailing public consultation over the project 5. the agreed roles and responsibilities of each private company within the consortium 6. the total money that each company will receive for each year of the contract 7. any other relevant supporting information that gives insight into the contractual obligations and remuneration of specific companies within each consortium.
15-04-2011-161814-002,19/05/2011,How much the war in Afghanistan has cost the UK since the beginning in 2001 overall?
15-04-2011-170350-007,19/05/2011,"Transcript of an interview that took place at the Asylum Screening Unit, Home Office in Croydon."
18-04-2011-102918-001,19/05/2011,"Please provide copies of floor plans and sections for HMS Invincible, HMS Manchester and HMS Ark Royal."
18-04-2011-105403-003,19/05/2011,Please advise on the body responsible for the naming of UK military operations and where a list of historical and ongoing military operations can be obtained.
18-04-2011-111329-005,19/05/2011," I work for Cambridgeshire and Peterborough Probation Trust and if someone from your HR department could contact me with regard to the recent defence review. I would also like to know what model if any you use e.g. Ulrich, do you operate a ""Shared Services"" route etc this is for benchmarking purposes. "
18-04-2011-114739-006,20/05/2011,Please advise if the MOD Police are affiliated in any way to the Police Federation and if serving MOD police officers are members of the Federation.
18-04-2011-114906-001,18/05/2011,Please provide copies of the accident reports into the air crashes for xxxxxx xxxxxx and xxxxxx in the South China Sea in 1960.
18-04-2011-152537-001,20/05/2011,Please provide details of the numbers of Territorial Army soldiers who have served in Helmand that are attached to infantry battalions.
19-04-2011-093006-001,23/05/2011,Please advise and provide information to various questions regarding the HM Armed Forces Veteran Badges.
19-04-2011-093440-002,23/05/2011,"Please provide a copy of the Nimrod Airworthiness Review Team Report, dated 24th July 1998. "
19-04-2011-094102-003,23/05/2011,Please advise and provide information to various questions about the Royal Air Force Rugby Union.
19-04-2011-123344-004,23/05/2011,"Please advise on the percentage of students, enrolled in university Royal Navy units, go on to have careers within the Royal Navy or Armed Forces and how this information is garnered."
19-04-2011-134840-001,23/05/2011,"Please provide troop numbers for each conflict and overseas posting - including long-term bases such as Cyprus, Germany and Gibraltar, and British involvement in joint operations e.g. UN forces - for each year of Army involvement."
19-04-2011-150822-001,23/05/2011,Please advise on MOD expenditure on external consultants in the FY 2010/11.
19-04-2011-160715-002,23/05/2011,Please advise on what regulation(s) were permitted that allowed for HRH Prince William to be transferred from the Army into the RAF and the resultant consequences if he failed his flying examination.
19-04-2011-164006-003,23/05/2011,Please advise on the value of the contract awarded to Vector Aerospace on the 28 January 2011 to make the Sea King (Search & Rescue) Helicopters Sea Trays and the cost of each Sea Tray. 
20-04-2011-094624-001,23/05/2011,"Please provide a copy of  the publication 'A Review of their Origin, Composition and Methods for Detection: by G.C. Goode and J.R. Morris, AWRE Report No. 022/83'."
20-04-2011-095549-002,23/05/2011,Please provide historical information held on the munitions depot at Leadburn.
20-04-2011-100130-003,23/05/2011,Please provide a copy of Annexes A to the Probabilistic Safety Targets and Assessment of Gross Disproportion referred to in DNSR/22/11/2 dated 4 November 2009.
20-04-2011-101939-004,24/05/2011,"Please advise on the number of military personnel serving in Afghanistan that have declared they may have unintentionally taken drugs while on tour in 2008, 2009 and 2010."
20-04-2011-102500-005,24/05/2011,"Please advise on the number of times British helicopters in Afghanistan have been involved in incidents where they have reported being hit by small arms fire or other weaponry in 2008, 2009, 2010, 2011, the types of aircraft involved and the resultant injuries that occurred."
20-04-2011-105555-006,11/05/2011,Please provide historical information on RAF Menwith Hill.
20-04-2011-115239-001,20/05/2011,Please provide information on St Leonard's Hill House and the use of asbestos.
20-04-2011-131801-002,24/05/2011,"Please advise whether a painting of Sir Winston Churchill, painted by Stanley John North, still hangs in the sergeants mess at Woolwich Army barracks. "
20-04-2011-141514-002,24/05/2011,Please provide details and information on compensation claims made in Afghanistan from 1 January 2011 - March 31 2011. 
20-04-2011-143213-003,24/05/2011,"Please provide copies of all documentation of the meeting between the Defence Secretary, and the defence company, Finmeccanica, to discuss 'UK-French summit implications' in November 2010."
20-04-2011-144016-004,24/05/2011,"Please provide details and information when senior officials at MOD met with David Gould, the executive chairman of the defence company Selex Systems, between 1 March 1 2010 - present."
20-04-2011-145736-005,24/05/2011,"Please provide details and information when senior officials at MOD met with Sir Roger Wheeler, of the defence company Thales UK Air Defence, between 1 January 2009 - present."
20-04-2011-150321-006,24/05/2011,"Please provide details and information when senior officials at MOD met with Sir Richard Mottram, chairman of the commercial company Amey, since he was appointed to the post on 19 August 2008."
20-04-2011-150840-007,24/05/2011,"Please provide details and information when senior officials at MOD met with Sir Robert Walmsley, chairman of the defence EDO(UK), between 1 May 2007 and 20 January 2009."
20-04-2011-152016-008,18/05/2011,Please advise on how a graph depicting the annual precipitation and sunshine hours for Inverness for the past century can be obtained.
20-04-2011-152924-001,20/05/2011,Please provide information to various question regarding the MOD contract with Alix Partners.
20-04-2011-164346-009,24/05/2011,"Please provide a copy of AFM Vol 1, Part 8 Command and Staff Procedures."
20-04-2011-171512-010,24/05/2011,Please provide an organisational chart for the MOD Central Legal Services.
21-04-2011-111121-001,25/05/2011,Please advise on the number of MOD staff that are currently seconded to EU institutions and the cost to the Department.
21-04-2011-112155-002,25/05/2011,"Please provide copies of all recruitment advertisements, shown on television for the British Army, for recruitment campaigns since the 1970s."
21-04-2011-112859-003,25/05/2011,Please provide information to various questions regarding the Defence Dental Services.
21-04-2011-113610-004,25/05/2011,Please provide veteran statistical data for the North East of England.
21-04-2011-122704-005,21/04/2011,Please provide information and details of the Contract Framework Agreement for MOD Office Supplies Framework.
26-04-2011-090322-001,25/05/2011,Please provide an up-to-date map of Kabul.
26-04-2011-091859-002,25/05/2011,Please advise on the number of female service personnel that were aero-medically evacuated from Afghanistan each year due to pregnancy. 
26-04-2011-092229-003,25/05/2011,Please advise on the number of soldiers that have been investigated or caught selling MoD equipment on internet sites such as eBay in the last five years. Please provide a year-by-year breakdown of incidents.
26-04-2011-094111-004,25/05/2011,Please provide an electronic copies of the full and current version of the Dress Regulations and Drill Manual of the Royal Air Force. 
26-04-2011-102104-005,25/05/2011,Please advise whether concise records of the pups that are breed from working dogs are retained.
26-04-2011-102513-006,25/05/2011,Please provide information on the British's official standpoint on building an EU army. 
26-04-2011-103438-001,23/05/2011,Please advise why the RTI 216 application report shows that the Nimrod XV235 was checked on 4 October 2007 and 8 March 2008.
26-04-2011-103857-007,25/05/2011,"Please advise whether any pieces of the hangers at RAF ScuIthorpe, that were demolished in 2009, remain."
26-04-2011-104323-008,26/05/2011,"Please advise on the American army unit stationed at Darland Hall in Rossett, Wrexham North Wales during WWII. "
26-04-2011-104813-009,26/05/2011,Please advise and provide a breakdown on the number of police officers suspended every year from 2007 to 2010.
26-04-2011-111530-011,26/05/2011,"Please advise on the number and cost to store and maintain harriers at RAF Cottesmore, Rutland. Please advise on the number own at the time of the fleet being scrapped in October 2010."
26-04-2011-112259-012,26/05/2011,Please provide a copy of the RAF Board of Enquiries findings into the fatal mid air collision that occurred between 2 Grob aircraft over south Wales on 11 February 2009.
26-04-2011-113122-013,26/05/2011,Please advise whether non-commissioned officers (NCOs) in the Royal Air Force are entitled to request an interview with their Air Officer Commanding (AOC) as part of the due process involved with disciplinary or administrative action.
26-04-2011-113907-014,26/05/2011,"Please advise on the recuperation entitlement for service personnel that have done operational tours. Please advise on the number of service personnel that have done tours in excess of 7, 11, 18 24 months and longer for the last five years."
26-04-2011-114539-015,26/05/2011,Please provide information on the number of occasions where hotel costs were in excess of £200 a night.
26-04-2011-114940-016,26/05/2011,Please advise on the number of positive drugs tests recorded following tests carried out on members of the Armed Forces in 2010.
26-04-2011-115327-017,26/05/2011,Please provide the total amount of local overseas allowance paid for each country for accompanied and unaccompanied pay ranges.
26-04-2011-115910-001,24/05/2011,Please advise whether the value of the Menwith Hill base in North Yorkshire was a figure generated by MOD and the methodology used.
26-04-2011-135618-001,26/05/2011,Please provide information and copies of Cpl Paul E Cramer U.S.M.C. training records with the British Royal Marines in 1942. 
26-04-2011-142832-001,19/05/2011,Please provide a copy of the Royal Navy Traffic advice relating to anti-nuclear demonstrations at Devonport Naval Base.
26-04-2011-143957-001,26/05/2011,Please provide information on the Prisoner of War camp where Giovanni Sabatini was taken during WWII. 
26-04-2011-150555-002,26/05/2011,Please provide a copy of all movement logs for civil aircraft using RAF Kirknewton from 1 November 2009 - 1 February 2011.
26-04-2011-155802-002,13/04/2011,Please provide information to various questions regarding the cost to MOD to provide medical care for service personnel wounded (both physical and mental wounds) in Afghanistan and Iraq since the start of each respective conflict. 
26-04-2011-165835-003,26/05/2011,Please provide information to various questions about the Met Office.
26-04-2011-170412-004,26/05/2011,Please provide a copy of the 2010 Defence Nuclear Environment and Safety Board Assurance Report.
27-04-2011-110854-001,26/05/2011,Please provide electronic copies of various IPCC documentation.
27-04-2011-111509-002,26/05/2011,Please provide information on the 'West Africa Volunteer Force'.
27-04-2011-111824-003,26/05/2011,"Please provide details of QRRN's (Queens Rules Regulations Navy) QRRN Article 0866.6, QRRN article 0876.6, QRRN Article 0844.2 and the relevance and legal purpose of Naval Form C240."
27-04-2011-112403-004,26/05/2011,"Please provide a breakdown of information to various questions regarding recruits under the age of 18 for the periods 2008, 2009 and 2010."
27-04-2011-112720-005,26/05/2011,Please provide a list of email addresses for the War Pensions Committees in the UK and the Isle of Man.
27-04-2011-124029-006,27/05/2011,"Please provide information on the number of MOD procurement deals that have been initiated, but have not seen completion (i.e. procured materials have not entered service), since 2001."
27-04-2011-124809-007,26/05/2011,Please provide a hard copy of the Defence Framework booklet.
27-04-2011-140932-001,27/05/2011,Please advise on the number of incidents were trespassers have taken occupation of land/building and have subsequently been evicted by police and or private contractors or County Court Bailiffs.
27-04-2011-141351-002,27/05/2011,Please provide organigrams information for the MOD organization.
27-04-2011-152916-003,27/05/2011,"Please advise on the cost of ""Guide to airfield pavement design and evaluation"", 2nd edition, 2006.  Publisher: Defence Estates, London, UK and how it can be obtained."
27-04-2011-153819-001,26/05/2011,Please advise on the Armed Forces discharge policy. 
27-04-2011-174154-005,27/05/2011,"Please provide a list of dates when senior officials in the MOD and the former vice-chairman of the defence company Thales UK Air Defence, John Howe, met between 1 January 2007 and 1 March 2009."
28-04-2011-101220-002,27/05/2011,Please advise what details are held of shipping movements or incidents for the English Channel between Portland Bill and St Anvil Head on or around 14 December 1979 when the yacht Caroline of Leigh was sunk.
28-04-2011-105532-001,25/05/2011,Please provide a copy of the transcript record of the advice given to Cllr Smith during his conversation with the MOD on 7 April 2011 and any briefing/information note made in preparation for this conversation regarding DNSR/22/11/2 document authored by Andrew McFarlane which featured in the Guardian article.
28-04-2011-142436-001,31/05/2011,Please provide information to various questions regarding the health issues of Armed Forces personnel in transition to civilian life from 1 June 2008 - 31 December 2010. 
28-04-2011-142707-002,31/05/2011,Please provide a copy of the transfer deed dated 21 December 2010 between the MOD and Fremington Developments LLP referred to in Land Registry Title DN597606.  This relates to the disposal of Fremington Training Camp EX31 3BJ.
28-04-2011-143522-003,31/05/2011,Please provide information on wartime 25 yard small arms ranges.
28-04-2011-143911-004,31/05/2011,Please advise on the number of horses kept by MOD and their various costs.
28-04-2011-151027-005,31/05/2011,Please provide the latest Numerical Atmospheric-dispersion Modelling Environment graphic/map showing the progress across the globe and the UK of the various radionuclides emanating from the Fukushima nuclear plant in Japan since the earthquake struck on 11 March 2011.
