"191196","Vacant","OF-6","Head Certification & Regulation Military Aviation Authority","Regulation. The development, maintenance and promulgation of the MOD’s through-life Flying, ATM, Design and Continuing Airworthiness Regulations, Standards and associated publications; includng translation of MAA policy into the regulatory framework, regulatory review and risk assessment, and consideration of regulatory change, alternative AMC, waiver and sanction activity. Certification. The Certification of all new UK military registered air systems and major changes to type designs, assurance of aircraft structural, propulsion and systems integrity management, the sponsorship, management and maintenance of UK aircraft design and airworthiness standards, and asurance of the safety of ships' aviation facilities. In addition, providing SME input to the development and maintenance of regulation covering all the areas of Certification business.","Ministry of Defence","Ministry of Defence","Head Office and Corporate Services","N/A","HOCSFIN-HeadGroupMailbox@mod.uk","185281","3260111","1","0","0","","Military","","1"
"00111797","John Taylor","SCS2","Chief Information Officer (CIO)","To deliver strategy, policy, guidance and core services in relation to information in order to set the conditions for effective information management and exploitation across Defence.","Ministry of Defence","Ministry of Defence","Head Office and Corporate Services","0207 218 9507","HOCSFIN-HeadGroupMailbox@mod.uk","00179598","1020124","1","110000","114999","","Knowledge and Information Management (KIM)","","1"
"00111801","N/D","SCS1","CIO-Corporate Information-Head","Set policy on records management, provide a corporate memory analysis service and set policy and standards for implementing the Freedom of Information Act, Data Protection Act and Environmental Information Regulations within Defence.","Ministry of Defence","Ministry of Defence","Head Office and Corporate Services","0207 218 9507","HOCSFIN-HeadGroupMailbox@mod.uk","00111797","1231926","1","0","0","","Knowledge and Information Management (KIM)","","1"
"00136404","N/D","SCS1","CIO-Corporate Services Systems Convergence Programme-Head","To programme manage the Corporate Services Systems Convergence programme in order to achieve better value for money decision making, faster payment; faster information flows and reducing the overall cost of running the complete end to end processes.","Ministry of Defence","Ministry of Defence","Head Office and Corporate Services","0207 218 9507","HOCSFIN-HeadGroupMailbox@mod.uk","00111797","323292","1","0","0","","Knowledge and Information Management (KIM)","","1"
"00111803","N/D","OF-6","CIO-Information Strategy & Policy-Head","Develop and maintain the MOD Information Strategy, the Defence ICT Strategy and their supporting Strategic Implementation Plans.","Ministry of Defence","Ministry of Defence","Head Office and Corporate Services","0207 218 9507","HOCSFIN-HeadGroupMailbox@mod.uk","00111797","1992164","1","0","0","","Military","","1"
"00111804","N/D","OF-6","CIO-J6-Head","MOD operations adviser, military planning, direction and prioritisation of joint communication systems","Ministry of Defence","Ministry of Defence","Head Office and Corporate Services","0207 218 9507","HOCSFIN-HeadGroupMailbox@mod.uk","00111797","1634155","1","0","0","","Military","","1"
"00111794","N/D","SCS1","CIO-Defence Security and Assurance Services-Head","Providing independent assessment, expertise and advice to meet the UK’s National and International Defence objectives.","Ministry of Defence","Ministry of Defence","Head Office and Corporate Services","0207 218 9507","HOCSFIN-HeadGroupMailbox@mod.uk","00111797","4361998","1","0","0","","Knowledge and Information Management (KIM)","","1"
"139073","Miss FC Nash","SCS2","Director Central legal Services","Director Central Legal Services reports to the Director General Transformation & Corporate Services and is the primary source of legal advice to Defence and Ministers. Responsibilities include: Being the single source for coordinated and authoritative legal advice on the whole range of Defence business; Providing high quality legal advice and services meeting the needs of Defence in delivering the Defence Vision; Playing an active role in promoting and representing Defence legal interests in dealings with other Government departments in Whitehall; Playing an active role in promoting and representing Defence legal interests internationally and with counterparts in other states;Being a member of the Investment Approvals Board.","Ministry of Defence","Ministry of Defence","Head Office and Corporate Services","0207 218 9507","HOCSFIN-HeadGroupMailbox@mod.uk","00179598","731907","1","95000","99999","","Law","","1"
"139083","N/D","SCS1","Head of Operational International Humanitarian Law Division","tional law relating to overseas military operations including the Department’s main effort in Afghanistan, and over the last year in relation to the Libya campaign. This includes use of force including targeting and ROE, general IHL issues (including emerging areas such as cyber law), weapons issues including nuclear, maritime operations, and drafting/negotiating treaties and MOUs with other states. In addition, we provide advice on the difficult legal and policy issues raised by the court challenges to operations in Iraq and Afghanistan and have often taken the lead in providing strategic direction on handling and tactics.","Ministry of Defence","Ministry of Defence","Head Office and Corporate Services","0207 218 9507","HOCSFIN-HeadGroupMailbox@mod.uk","139073","0","1","0","0","","Law","Added to Position 139073","1"
"139085","N/D","SCS1","Head of Corporate Strategy Law Division","The Corporate Strategy  Law  Division advises on issues arising out of the MOD's transformation strategy, for example on governance issues and the need for legislation as well as the proposals on the future structure of the Armed Forces both the Regular and the Reserve Forces.   It also advises more generally on personnel-related policies, including the development of the redundancy programmes; casework, which concerns such diverse subjects as pay and discrimination issues, discipline and grievance, Armed Forces Compensation Scheme, war pensions and pensions casework and the AFPS projects.","Ministry of Defence","Ministry of Defence","Head Office and Corporate Services","0207 218 9507","HOCSFIN-HeadGroupMailbox@mod.uk","139073","860883","1","0","0","","Law","","1"
"139084","N/D","SCS1","Head of Commercial Law Division","The Commercial Law Division advises across all TLBs within the Department on all aspects of Commercial Law, including contract drafting, contract disputes, the EU and UK Regulatory environment (including Procurement, State Aids, Competition Law and TUPE), International agreements and contracts and also encompasses a Property Law team, which provides advice on aspects of Defence Estates work. The team is also responsible for managing MOD’s panel of external commercial lawyers and servicing the legal elements of CADD’s due diligence activities and the Investment Approvals Committee.","Ministry of Defence","Ministry of Defence","Head Office and Corporate Services","0207 218 9507","HOCSFIN-HeadGroupMailbox@mod.uk","139073","2137273","1","0","0","","Law","","1"
"139086","N/D","SCS1","Head of General Law Division","The General Law Division advises ministers, senior policy and military personnel on a wide range of legal issues including: public inquiries (including Iraq; Gibson; Al Sweady and Northern Ireland inquiries);  inquests; human rights issues; the doctrine of combat immunity; MOD’s overseas interests (Gibraltar and the Sovereign Base Areas in Cyprus); visiting and reserve forces; data protection; freedom of information; negotiating and advising on non-operational international agreements; property, planning and environmental issues; aviation; healthcare; charities and trusts; health and safety legislation; policing law; the regulation of dockyard ports; byelaws relating to MOD property; devolution issues. The team deals with Bill work in these areas and drafts any secondary legislation necessary. The team also advises on sensitive and high profile litigation and inquests.","Ministry of Defence","Ministry of Defence","Head Office and Corporate Services","0207 218 9507","HOCSFIN-HeadGroupMailbox@mod.uk","139073","0","1","0","0","","Law","Added to Position 139073","1"
"139074","N/D","SCS1","Head of Command, Discipline & Constitutional Division","The work of the Command, Discipline & Constitutional Division includes working on the Armed Forces Bill and on subordinate legislation and working closely with other Government Departments where MOD legislation affects an OGD, or an OGD proposes legislation in which the MOD has an interest.","Ministry of Defence","Ministry of Defence","Head Office and Corporate Services","0207 218 9507","HOCSFIN-HeadGroupMailbox@mod.uk","139073","509523","1","0","0","","Law","","1"
"0000057","N/D","SCS1","Head of Intellectual Property Rights","Defence Intellectual Property is responsible for MOD intellectual property Policy. It manages the Departments Crown Copyright delegation from the Office of Public Sector Information, files and manages the MoDs portfolio of Patents, trademarks, and Designs, licensing the same in support of departmental branding effort and wider markets income generation. It also advises all TLB on the application of IPR in contracts, Treaties, MOUs and other international arrangements. FIPR is also responsible for defending MoD against allegations of infringing the Intellectual property of others, and for prosecuting any infringement of the MoDs IP.","Ministry of Defence","Ministry of Defence","Head Office and Corporate Services","0207 218 9507","HOCSFIN-HeadGroupMailbox@mod.uk","139073","1410549","1","0","0","","Law","","1"
"1062831","N/D","OF-6","Air Attaché","Performs the duties of both the Air Attach","Ministry of Defence","Ministry of Defence","Head Office and Corporate Services","0207 218 9507","HOCSFIN-HeadGroupMailbox@mod.uk","1062827","0","1","0","0","","Military","Added to Position 1062827","1"
"196733","Rear Admiral John Gower","OF-7","Assistant Chief of Defence Staff (Nuclear and Chemical and Biological)","formulation of strategic planning advice to COS and ministers, MOD’s 2* policy lead for CBRN, and Arms, Counter Proliferation.","Ministry of Defence","Ministry of Defence","Head Office and Corporate Services","0207 218 9507","HOCSFIN-HeadGroupMailbox@mod.uk","140333","0","1","110000","114999","","Military","Added to Position 140333","1"
"1055692","Air Vice Marshal Bob Judson","OF-7","Assistant Chief of Defence Staff Operations","Operational strategy and planning; direction and conduct of operations at the strategic level; maintenance of policy context for planning and conduct of operations; Defence Crisis Management Organisation process;Joint Capability; Middle East/Central America/South America (inc Peru, Colombia, Ecuador, Venezuela)","Ministry of Defence","Ministry of Defence","Head Office and Corporate Services","0207 218 9507","HOCSFIN-HeadGroupMailbox@mod.uk","1055683","0","1","110000","114999","","Military","Added to Position 1055683","1"
"00144814","N/D","SCS1","Counsellor Defence Acquisition and Technology","Responsible for the management and direction of a team of civilian and military staff organized as a Defence Equipment team, a Science and Technology team and a Command, Control, Communications, Computers, Intelligence, Surveillance and Reconnaissance (C4ISR) team. Together their responsibilities include: support to operations; delivery of a step change in the US-UK science and technology relationship; development of the US-UK Bilateral Defence Acquisition Committee; support to UK capability procurement and development; and support to UKTI objectives for the US.","Ministry of Defence","Ministry of Defence","Head Office and Corporate Services","0207 218 9507","HOCSFIN-HeadGroupMailbox@mod.uk","1062827","0","1","0","0","","Policy","Added to Position 1062827","1"
"00144816","N/D","SCS1","Counsellor Defence Policy and Nuclear","Responsible for management and direction of a civilian and military staff organized as a Defence Policy Team and a Nuclear Strategic Deterrent and Chemical Biological and Radiological Defence (NSD & CBRD) Team. The Defence Policy Team promotes cooperation and dialogue with the US defence community on strategic defence and national security issues and supports policy work on current military operations issues. The NSD & CBRD Team supports US/UK collaboration on nuclear deterrence; weapon stockpile reduction, testing and compliance and threat reduction; as well as, collaboration on chemical, biological, radiological,nuclear defence; and dialogue on ballistic missile defence.","Ministry of Defence","Ministry of Defence","Head Office and Corporate Services","0207 218 9507","HOCSFIN-HeadGroupMailbox@mod.uk","1062827","0","1","0","0","","Policy","Added to Position 1062827","1"
"1055683","Lieutenant General Richard Barrons","OF-8","Deputy Chief of Defence Staff (Military Strategic Operations)","Director of Operations. Joint responsibility (with DG Sec Pol for delivering strategy and planning for operations, directs and conducts operations at the strategic level)","Ministry of Defence","Ministry of Defence","Head Office and Corporate Services","0207 218 9507","HOCSFIN-HeadGroupMailbox@mod.uk","00109715","268912","1","130000","134999","","Military","","1"
"1128589","N/D","OF-6","Deputy Director Combined Joint Operations from the Sea Centre of Excellence","The Deputy Director (DDir) of CJOS COE is responsible for the daily operations, development and production of the Centre’s Programme of Work, and its future vision. As the Director is dual hatted with Commander Second Fleet, the DDir generally takes the commanding role. He forges close links with ACT, NATO commands and authorities, international organizations (including the UN), NATO national authorities as well as academic institutions in order to deliver the Centres’ extensive Programme. He also takes a lead role in promoting UK military interests in the Norfolk area including supporting visits of UK ships and senior personnel. CJOS COE is a joint and combined MOU-based organization with IMO status. It is a source of maritime expertise on all aspects of NATO transformation of joint expeditionary operations from the sea to the sponsoring nations. It is made up of 32 personnel from 13 NATO nations.","Ministry of Defence","Ministry of Defence","Head Office and Corporate Services","0207 218 9507","HOCSFIN-HeadGroupMailbox@mod.uk","1062827","0","1","0","0","","Military","Added to Position 1062827","1"
"189101","N/D","SCS1","Head DIU Pol And Disclosure Unit","Policy on judicial and external scrutiny of MOD business, Policy & Disclosure","Ministry of Defence","Ministry of Defence","Head Office and Corporate Services","0207 218 9507","HOCSFIN-HeadGroupMailbox@mod.uk","188553","970634","1","0","0","","Policy","","1"
"180361","N/D","SCS1","Head Public Inquiries","Policy on judicial and external scrutiny of MOD business, public enquiries","Ministry of Defence","Ministry of Defence","Head Office and Corporate Services","0207 218 9507","HOCSFIN-HeadGroupMailbox@mod.uk","188553","419363","1","0","0","","Policy","","1"
"1570344","N/D","OF-6","Head Targeting & Information Operations","Direction and conduct of current and future operations at the strategic level by providing advice and coordination of MOD Targeting, Information Operations (IO), Computer Network Operations (CNO) and Special Capability efforts, policy and capability development.","Ministry of Defence","Ministry of Defence","Head Office and Corporate Services","0207 218 9507","HOCSFIN-HeadGroupMailbox@mod.uk","1055692","1853141","1","0","0","","Military","","1"
"1131246","N/D","OF-6","Military Attaché","The Military Attach","Ministry of Defence","Ministry of Defence","Head Office and Corporate Services","0207 218 9507","HOCSFIN-HeadGroupMailbox@mod.uk","1062827","0","1","0","0","","Military","Added to Position 1062827","1"
"00144805","N/D","SCS2","Minister (Defence Materiel)","The senior Ministry of Defence Civil Servant in the United States. As Civil Secretary, he has responsibility for financial management governance of the BDS-US budget. As Minister (Defence Materiel), he is responsible to HMA for all aspects of the UK/US defence equipment acquisition, technology and logistics policy, programmes and process.","Ministry of Defence","Ministry of Defence","Head Office and Corporate Services","0207 218 9507","HOCSFIN-HeadGroupMailbox@mod.uk","1062827","0","1","80000","84999","","Policy","Added to Position 1062827","1"
"1131246","N/D","OF-6","Naval Attaché","The Naval Attaché and his staff act as the principal advisers on maritime matters to Her Majesty's Ambassador and the Defence Attaché; represent the Royal Navy and Ministry of Defence (Navy) in the US; act as principal points of contact between the UK Ministry of Defence and the US Chief of Naval Operations, US Marine Corps and the US Coast Guard Service; and oversee arrangements for Royal Navy ships visits to the US.","Ministry of Defence","Ministry of Defence","Head Office and Corporate Services","0207 218 9507","HOCSFIN-HeadGroupMailbox@mod.uk","1062827","0","1","0","0","","Military","Added to Position 1062827","1"
"142227","N/D","SCS1","Operations Directorate - Head Afghanistan Policy","Operational strategy and planning; direction and conduct of operations at the strategic level; maintenance of policy context for planning and conduct of operations. Afghanistan Policy Matters","Ministry of Defence","Ministry of Defence","Head Office and Corporate Services","0207 218 9507","HOCSFIN-HeadGroupMailbox@mod.uk","142008","408476","1","0","0","","Policy","","1"
"1586951","N/D","OF-6","Operations Directorate - Head Ops B","Operational strategy and planning; direction and conduct of operations at the strategic level; maintenance of policy context for planning and conduct of operations. Counter Terrorism Operations","Ministry of Defence","Ministry of Defence","Head Office and Corporate Services","0207 218 9507","HOCSFIN-HeadGroupMailbox@mod.uk","142008","1442833","1","0","0","","Military","","1"
"143581","N/D","SCS1","Operations Directorate - Head Counter Terrorism & UK Policy","Operational strategy and planning; direction and conduct of operations at the strategic level; maintenance of policy context for planning and conduct of operations. Counter Terrorism Policy","Ministry of Defence","Ministry of Defence","Head Office and Corporate Services","0207 218 9507","HOCSFIN-HeadGroupMailbox@mod.uk","142008","445164","1","0","0","","Policy","","1"
"1055711","N/D","OF-6","Operations Directorate - Head Ops A","Operational strategy and planning; direction and conduct of operations at the strategic level; maintenance of policy context for planning and conduct of operations. Overseas Operations matters","Ministry of Defence","Ministry of Defence","Head Office and Corporate Services","0207 218 9507","HOCSFIN-HeadGroupMailbox@mod.uk","142008","1345063","1","0","0","","Military","","1"
"184000","N/D","SCS1","Operations Directorate - Head Special Forces & Legal Policy","Operational strategy and planning; direction and conduct of operations at the strategic level; maintenance of policy context for planning and conduct of operations. Special Forces and Legal Issues","Ministry of Defence","Ministry of Defence","Head Office and Corporate Services","0207 218 9507","HOCSFIN-HeadGroupMailbox@mod.uk","142008","777702","1","0","0","","Policy","","1"
"140333","N/D","SCS3","Director General Security Policy & Operations","MOD's principal adviser on defence contribution to HMG security policy and shaping international relations","Ministry of Defence","Ministry of Defence","Head Office and Corporate Services","0207 218 9507","HOCSFIN-HeadGroupMailbox@mod.uk","00109715","312293","1","125000","129999","","Policy","","1"
"141691","N/D","SCS2","Director International Security Policy","Security co-operation activiity - NATO/EU/UN, Europe and North Africa, North America, Russia, China, Koreas and Japan; Arms Control and Counter Proliferation, Conflict Pool Director","Ministry of Defence","Ministry of Defence","Head Office and Corporate Services","0207 218 9507","HOCSFIN-HeadGroupMailbox@mod.uk","140333","0","1","85000","89999","","Policy","Added to Position 140333","1"
"188553","N/D","SCS2","Director Judicial Engagement Policy","Policy on judicial and external scrutiny of MOD business, including Iraq and other public enquiries, inquests and significant claims against the department.","Ministry of Defence","Ministry of Defence","Head Office and Corporate Services","0207 218 9507","HOCSFIN-HeadGroupMailbox@mod.uk","140333","0","1","95000","99999","","Policy","Added to Position 140333","1"
"142008","N/D","SCS2","Director Operational Policy","CT & SF Policy; NI and GB issues; policy context for planning and conduct of operations; Iraq/Afghanistan/Iran/South America(inc Brazil, Argentina, Falklands, Chile); Stabilisation Unit Director","Ministry of Defence","Ministry of Defence","Head Office and Corporate Services","0207 218 9507","HOCSFIN-HeadGroupMailbox@mod.uk","1055683","0","1","80000","84999","","Policy","Added to Position 1055683","1"
"142662","N/D","SCS1","Head Arms Control & Proliferation","Provide advice on all aspects of counter-proliferation, disarmament and arms control, both policy and implementation","Ministry of Defence","Ministry of Defence","Head Office and Corporate Services","0207 218 9507","HOCSFIN-HeadGroupMailbox@mod.uk","1055683","916555","1","0","0","","Policy","","1"
"1121412","N/D","OF-6","Head Chemical, Biological, Radiological & Nuclear Policy","Policy lead for countering all aspects of the threat posed by CBRN weapons of mass destruction (WMD)","Ministry of Defence","Ministry of Defence","Head Office and Corporate Services","0207 218 9507","HOCSFIN-HeadGroupMailbox@mod.uk","196733","1513997","1","0","0","","Military","","1"
"1062827","Major General Buster Howes","OF-7","Head of British Defence Staff-United States and Defence Attaché.","The DA is Her Majesty’s Ambassador’s senior adviser on defence issues, and as Head of the BDS-US has responsibility for all military and civilian MoD personnel located both within the Embassy and in 34 states across the USA. Responsibilities include sustaining collective oversight of the bilateral Defence relationship with the USA and all related MOD activity. Pursuing objectives and priorities endorsed by DG Sec Pol.","Ministry of Defence","Ministry of Defence","Head Office and Corporate Services","0207 218 9507","HOCSFIN-HeadGroupMailbox@mod.uk","140333","391923","1","110000","114999","","Military","Added to Position 140333","1"
"1055688","N/D","OF-6","DOC-Head","Produce Defence Operational Lessons and conduct Audit of Defence capability","Ministry of Defence","Ministry of Defence","Head Office and Corporate Services","0207 218 9507","HOCSFIN-HeadGroupMailbox@mod.uk","00109715","525714","1","0","0","","Military","","1"
"135042","N/D","SCS1","Head International Policy France","International acquisition issues within MOD and wider Government & US, FR, the EU (EDA) and NATO; US/UK Defence Trade Treaty; UK-France Higher Level Working Group","Ministry of Defence","Ministry of Defence","Head Office and Corporate Services","0207 218 9507","HOCSFIN-HeadGroupMailbox@mod.uk","141691","342169","1","0","0","","Policy","","1"
"142856","N/D","SCS1","Head International Policy & Planning(Civilian)","Delivery of global military strategic planning; development of security co-operation, conflict prevention and security sector reform in the Levant, Sub-Saharan Africa, South and South East Asia; recruit, direct and support worldwide Defence Attaché and Loan Service network","Ministry of Defence","Ministry of Defence","Head Office and Corporate Services","0207 218 9507","HOCSFIN-HeadGroupMailbox@mod.uk","141691","1848094","1","0","0","","Policy","","1"
"1561030","N/D","OF-6","Head International Policy & Planning(Military)","Delivery of global military strategic planning; development of security co-operation, conflict prevention and security sector reform in the Levant, Sub-Saharan Africa, South and South East Asia; recruit, direct and support worldwide Defence Attaché and Loan Service network","Ministry of Defence","Ministry of Defence","Head Office and Corporate Services","0207 218 9507","HOCSFIN-HeadGroupMailbox@mod.uk","141691","1268022","1","0","0","","Military","","1"
"148649","N/D","SCS1","Head NATO & Europe Policy","Policy advice directed at promoting the UK’s security interests through NATO and the EU and with European partners.","Ministry of Defence","Ministry of Defence","Head Office and Corporate Services","0207 218 9507","HOCSFIN-HeadGroupMailbox@mod.uk","141691","1677558","1","0","0","","Policy","","1"
"142073","N/D","SCS1","Head Defence Security and Priorities","Lead on the Ministry of Defence’s contribution to the development of the National Security Strategy (NSS) and Strategic Defence and Security Review (SDSR);","Ministry of Defence","Ministry of Defence","Head Office and Corporate Services","0207 218 9507","HOCSFIN-HeadGroupMailbox@mod.uk","141691","1238876","1","0","0","","Policy","","1"
"194736","Lieutenant General Simon Mayall","OF-8","Special Representative to the Middle East","Special Representative to the Middle East, on behalf of Secretary of State","Ministry of Defence","Ministry of Defence","Head Office and Corporate Services","0207 218 9507","HOCSFIN-HeadGroupMailbox@mod.uk","00155792","0","1","135000","139999","","Military","Added to Position 155792","1"
