"Post Unique Reference","Name","Grade (or equivalent)","Job Title","Job/Team Function","Parent Department","Organisation","Unit","Contact Phone","Contact E-mail","Reports to Senior Post","Salary Cost of Reports (£)","FTE","Actual Pay Floor (£)","Actual Pay Ceiling (£)","","Professional/Occupational Group","Notes","Valid?"
"109838","N/D","SCS1","Defence Science & Technology Strategy Head","Is responsible for the strategic direction of the Science & Technology (S&T) programme, setting the S&T strategy, policy and ensuring S&T programme delivers the direct benefits to defence, including Assurance and Evaluation programmes. He develops and implements S&T solutions in response to Defence Reform and Transformation in the MOD. He oversees the MOD’s International Research Collaboration programme and ensures the UK participates fully in strategic partnerships and that UK interests are represented.","Ministry of Defence","Ministry of Defence","Head Office and Corporate Services","0207 218 4939","HOCSFIN-HeadGroupMailbox@mod.uk","105230","1040851","1","0","0","","Science and Engineering","","1"
"105234","eliminated","SCS2","Defence Science & Technology Strategic Technologies Director","Post eliminated","Ministry of Defence","Ministry of Defence","Head Office and Corporate Services","N/A","HOCSFIN-HeadGroupMailbox@mod.uk","00105227","0","1","95000","99999","","Science and Engineering","","1"
"178447","N/D","SCS1","Defence Science & Technology Strategic Technologies Head","Responsible for delivery of MOD’s nuclear warhead and propulsion research programmes, including specific responsibilities as Senior Responsible Owner and central customer for the Nuclear Warhead Capability Sustainment Programme. Is the Departmental authority and custodian, on behalf of the MOD Chief Scientific Adviser, of the 1958 UK/US Mutual Defence Agreement and other international nuclear Science & Technology relationships.","Ministry of Defence","Ministry of Defence","Head Office and Corporate Services","0207 218 4939","HOCSFIN-HeadGroupMailbox@mod.uk","105230","897619","1","0","0","","Science and Engineering","","1"
"105230","Dr Bryan Wells","SCS2","Defence Science & Technology Strategy Director","Provides advice to Ministers/senior officials Defence S&T including strategic Missile Defence (MD). Supports the Defence Research & Development (R&D) Board in defining the Science & Technology (S&T) strategy/policy to effectively manage the Research Programme. Identifies more cost effective options for military capability, so investment brings maximum benefit to UK Armed Forces. Oversees the delivery of MOD’s S&T requirement by Dstl and sets the direction of the Defence Innovation Strategy and ensures Dstl creates mutually beneficial relationships with Defence research and technology suppliers. Responsible for development of technical programmes to deal with emerging Chemical Biological Radiological Nuclear (CBRN) threats.","Ministry of Defence","Ministry of Defence","Head Office and Corporate Services","0207 218 9507","HOCSFIN-HeadGroupMailbox@mod.uk","00105227","406703","1","85000","89999","","Science and Engineering","","1"
"00105227","Prof Vernon Gibson","SCS3","Chief Scientific Adviser","CSA is responsible for ensuring that key strategic decisions made by Ministers, senior officials and the Armed Forces are informed by high quality expert scientific advice and analysis. He is deputy chair of MOD's R&D Board, a member of the Investment Approvals Committee and is the technical SRO for the 1958 UK-US Mutual Defence Agreement on nuclear issues. He is process owner for Science & Technology (S&T) and responsible for delivery of the S&T Programme budget, which covers both nuclear and non-nuclear S&T.","Ministry of Defence","Ministry of Defence","Head Office and Corporate Services","0207 218 9507","HOCSFIN-HeadGroupMailbox@mod.uk","00005654","0","1","140000","144999","","Science and Engineering","Added to Position 00005654","1"
"1047423","Stephen Hillier","OF-8","Deputy Chief of Defence Staff (Military Capability)","DCDS(Mil Cap) acts as an identifiable, responsible and strong Capability Sponsor across the MOD Unified Customer in order to deliver capability that meets the endorsed requirements. Priority is given to current operations (particularly Afghanistan) exploiting both Equipment Plan and Urgent Operational Requirement processes. DCDS(Mil Cap)s other key objective is to generate and implement an affordable, balanced and coherent Equipment and Equipment Support Plan which is realistic and has agility. DCDS(Mil Cap) chairs the Military Capabilities Board (MCB) that leads the Capability Sponsor","Ministry of Defence","Ministry of Defence","Head Office and Corporate Services","0207 218 9507","HOCSFIN-HeadGroupMailbox@mod.uk","00109715","351458","1","130000","134999","","Military","","1"
"1431838","Nicholas Pope","OF-7","Director Land Capability and Transformation","D LC&T is a member of the MCB leading on the coordination of battlespace manoeuvre and land environment issues, which provides strategic direction to the coherent delivery of a balanced and affordable Equipment and Support programme.  D LC&T is the Senior Responsible Owner (SRO) for the Urgent Operational Requirements process and for elements of Counter Improvised Explosives Device capability.  D LC&T represents the Capability Sponsor on the Army Board as the Master General of Ordnance.","Ministry of Defence","Ministry of Defence","Head Office and Corporate Services","0207 218 9507","HOCSFIN-HeadGroupMailbox@mod.uk","1047423","0","1","110000","114999","","Military","Added to Position 1047423","1"
"1565824","Mark Green","OF-7","Director Air & Joint Capability and Transformation","D AJC&T is a member of the MCB leading on the coordination of Information Superiority and air environment issues, which provides strategic direction to the coherent delivery of a balanced and affordable Equipment and Support programme.  D AJC&T is the Senior Responsible Owner (SRO) for Defence Information Infrastructure, Operational Information Superiority and Combat Identification.  D AJC&T represents the Capability Sponsor on the Air Force Board.","Ministry of Defence","Ministry of Defence","Head Office and Corporate Services","0207 218 9507","HOCSFIN-HeadGroupMailbox@mod.uk","1047423","0","1","110000","114999","","Military","Added to Position 1047423","1"
"1105905","Henry Parker","OF-7","Director Maritime Capability and Transformation","D MC&T is a member of the MCB leading on the coordination of Precision Attack and maritime environment issues, which provides strategic direction to the coherent delivery of a balanced and affordable Equipment and Support programme.  D MC&T is the Senior Responsible Owner (SRO) for Carrier Strike (CS) and is the JCB member for Complex Weapons (CW) and Testing and Evaluation (T&E).  D MC&T represents the Capability Sponsor on the Navy Board as the Controller of the Navy.","Ministry of Defence","Ministry of Defence","Head Office and Corporate Services","0207 218 9507","HOCSFIN-HeadGroupMailbox@mod.uk","1047423","0","1","110000","114999","","Military","Added to Position 1047423","1"
"1055224","Mark Poffley","OF-7","Assistant Chief of Defence Staff (Capability & force Development)","ACDS(C&FD) is a member of the MCB leading on the Resource Planning and coherence across all the Defence Lines of Development, force structure and performance management","Ministry of Defence","Ministry of Defence","Head Office and Corporate Services","0207 218 9507","HOCSFIN-HeadGroupMailbox@mod.uk","1047423","0","1","110000","114999","","Finance","Added to Position 1047423","1"
"1573670","N/D","OF-6","Head of Special Projects and Chemical Biological Radiological Nuclear Capability","Responsible for the delivery of Defence-wide capability solutions to the MCB related to the ability to deliver; precise, agile and timely effects worldwide for Special Forces; specialist military capability to counter the threat from terrorist weapons and conduct explosive ordnance disposal; and to enhance survivability and reduce degredation of individuals and equipment from CBRN threats .","Ministry of Defence","Ministry of Defence","Head Office and Corporate Services","0207 218 9507","HOCSFIN-HeadGroupMailbox@mod.uk","1565824","978093","1","0","0","","Military","","1"
"1479775","N/D","OF-6","Head of Theatre Airspace Capability","Responsible for the delivery of Defence-wide capability solutions to the MCB related to the ability to deliver capabilities which enable effective and secure air operations and give a joint force the freedom to operate without interference to and from the air environment.","Ministry of Defence","Ministry of Defence","Head Office and Corporate Services","0207 218 9507","HOCSFIN-HeadGroupMailbox@mod.uk","1431838","955965","1","0","0","","Military","","1"
"1564419","N/D","OF-6","Head of Deep Theatre Attack Capability","Responsible for the delivery of Defence-wide capability solutions to the MCB related to the ability to deliver fires against land based targets from all environments.","Ministry of Defence","Ministry of Defence","Head Office and Corporate Services","0207 218 9507","HOCSFIN-HeadGroupMailbox@mod.uk","1105905","1011846","1","0","0","","Military","","1"
"00137389","N/D","SCS1","Head of Joint Training Evaluation & Simulation Capability","Responsible for the delivery of Defence-wide capability solutions to the MCB related to the current and future delivery of joint training and mission preparation capabilities and facilities to test,  evaluate and develop cost-effective military capability.","Ministry of Defence","Ministry of Defence","Head Office and Corporate Services","0207 218 9507","HOCSFIN-HeadGroupMailbox@mod.uk","1105905","463705","1","0","0","","Planning","","1"
"1047472","N/D","OF-6","Head of Air & Littoral Manoeuvre Capability","Responsible for the delivery of Defence-wide capability solutions to the MCB related to the ability to deliver the landing froce from the sea; and attack, lift and find elements by air, to contribute to campaign success as part of a joint and/or coalition force.","Ministry of Defence","Ministry of Defence","Head Office and Corporate Services","0207 218 9507","HOCSFIN-HeadGroupMailbox@mod.uk","1431838","710674","1","0","0","","Military","","1"
"1105937","N/D","OF-6","Head of Above Water Capability","Responsible for the delivery of Defence-wide capability solutions to the MCB related to the ability to provide control and denail of the above water battlespace to allow joint commanders to utilise the seaward flank in military operations.","Ministry of Defence","Ministry of Defence","Head Office and Corporate Services","0207 218 9507","HOCSFIN-HeadGroupMailbox@mod.uk","1105905","852478","1","0","0","","Military","","1"
"1432988","N/D","OF-6","Head of Capability Improvement","Responsible for providing change management and business support to the MCB and champion Through Life Capability Management(TLCM)/Acquisition Reform and innovation to deliver better solutions for defence.","Ministry of Defence","Ministry of Defence","Head Office and Corporate Services","0207 218 9507","HOCSFIN-HeadGroupMailbox@mod.uk","1431838","590991","1","0","0","","Military","","1"
"1047441","N/D","OF-6","Head of Command Control & Information Infrastructure Capability","Responsible for the delivery of Defence-wide capability solutions to the MCB related to the ability to command, inform and amange the battle and bsuiness space collaboratively from the strategic functions of the Department of State to individual military platforms over a defence-wide network.","Ministry of Defence","Ministry of Defence","Head Office and Corporate Services","0207 218 9507","HOCSFIN-HeadGroupMailbox@mod.uk","1565824","2762825","1","0","0","","Military","","1"
"105349","N/D","SCS1","Head of Export Policy Assurance & Assurance","Responsible for the provision of co-ordinated MOD advice on export licencing control applications, protection of capability through monitoring and assessment of the release of military information, technology and equipment to overseas entities, export support and international export control initiatives.","Ministry of Defence","Ministry of Defence","Head Office and Corporate Services","0207 218 9507","HOCSFIN-HeadGroupMailbox@mod.uk","1055232","816661","1","0","0","","Policy","","1"
"174902","N/D","OF-6","Head of Deterrent and Underwater Capability","Responsible for the delivery of a UK operationally independent, continuous and invulnerable strategic nuclear deterrent; providing support to the Senior Responsible Officer for the deterrent and ensure's that the many projects in the deterrent area are managed as a coherent programme.","Ministry of Defence","Ministry of Defence","Head Office and Corporate Services","0207 218 9507","HOCSFIN-HeadGroupMailbox@mod.uk","1105905","1085382","1","0","0","","Military","","1"
"1047516","N/D","OF-6","Head of Expeditionary Logistic & Support Capability","Responsible for the delivery of Defence-wide capability solutions to the MCB related to the ability to deploy and redeploy a force to a theatre of operations and to support and sustain it for the duration of operations.","Ministry of Defence","Ministry of Defence","Head Office and Corporate Services","0207 218 9507","HOCSFIN-HeadGroupMailbox@mod.uk","1431838","994100","1","0","0","","Military","","1"
"1047464","N/D","OF-6","Head of Ground Manoeuvre Capability","Responsible for the delivery of Defence-wide capability solutions to the MCB related to the ability to deliver decisive close combat effects in the land close battlespace.","Ministry of Defence","Ministry of Defence","Head Office and Corporate Services","0207 218 9507","HOCSFIN-HeadGroupMailbox@mod.uk","1431838","1159917","1","0","0","","Military","","1"
"1567623","N/D","OF-6","Head of Intelligence Surveillance Acquisition & Reconnaissance Capability","Responsible for the delivery of Defence-wide capability solutions to the MCB related to the ability to provide accurate, timely and appropriate information and intelligence capabilities, and deliver influence and information effects through information operations.","Ministry of Defence","Ministry of Defence","Head Office and Corporate Services","0207 218 9507","HOCSFIN-HeadGroupMailbox@mod.uk","1565824","1233496","1","0","0","","Military","","1"
"1047497","N/D","OF-6","Head of Resources and Plans Joint","Resource planning for Joint Forces Command and Head Office","Ministry of Defence","Ministry of Defence","Head Office and Corporate Services","0207 218 9507","HOCSFIN-HeadGroupMailbox@mod.uk","1055224","660401","1","0","0","","Military","","1"
"126796","N/D","OF-6","Head of Resources and Plans Army","Resource planning for Army","Ministry of Defence","Ministry of Defence","Head Office and Corporate Services","0207 218 9507","HOCSFIN-HeadGroupMailbox@mod.uk","1055224","767570","1","0","0","","Military","","1"
"1055232","N/D","OF-6","Head of Resources and Plans Air","Resource planning for Air","Ministry of Defence","Ministry of Defence","Head Office and Corporate Services","0207 218 9507","HOCSFIN-HeadGroupMailbox@mod.uk","1055224","691355","1","0","0","","Military","","1"
"1055721","N/D","OF-6","Head of Strategy Management","Responsible for Capability coherence, force structure and performance management","Ministry of Defence","Ministry of Defence","Head Office and Corporate Services","0207 218 9507","HOCSFIN-HeadGroupMailbox@mod.uk","1055224","1436484","1","0","0","","Military","","1"
"1106793","N/D","OF-6","Head of Resources and Plans Navy","Resource planning for Joint Forces Command and Head Office","Ministry of Defence","Ministry of Defence","Head Office and Corporate Services","0207 218 9507","HOCSFIN-HeadGroupMailbox@mod.uk","1055224","765888","1","0","0","","Military","","1"
"00111789","Mark Preston","SCS2","Director Business Resilience (DBR)","Director Business Resilience (DBR) is the Process Owner for Security and Business Continuity. DBR is responsible for setting policy and standards for MOD in these areas and monitoring their implementation and risk management. Key areas of policy activity include: Security (including Physical, Defence Policing, Personnel, Industrial and Scientific & Technical) and Business Continuity. DBR also manages all aspects of common law compensation claims made against the Department.","Ministry of Defence","Ministry of Defence","Head Office and Corporate Services","0207 218 9507","HOCSFIN-HeadGroupMailbox@mod.uk","00179598","0","1","85000","89999","","Policy","Added to Position 00005654","1"
"00111791","N/D","SCS1","DBR-Head of Defence Security Policy","Head of Defence Security and Resilience (DBR-DefSY) is responsible for developing, promulgating and monitoring the Department’s protective security policy and standards; advising Ministers and senior officials on the political, presentational and legal aspects of protective security policy; supporting the Director Business Resilience as Security Process Owner and in providing assurance to the DAC that security risks are being effectively addressed or managed. Responsibilities cover personnel security (including vetting); leak investigations; policing policy & physical security (including guarding); nuclear security & safety (including nuclear accident response); and technical and international security issues (including the security relationship with industry).This role also has responsibility for Business Continuity (including pandemic flu policy and planning).","Ministry of Defence","Ministry of Defence","Head Office and Corporate Services","0207 218 9507","HOCSFIN-HeadGroupMailbox@mod.uk","00111789","1279631","1","0","0","","Policy","","1"
"00111800","N/D","SCS1","DBR-Head of Common Law Claims & Policy","Head of DBR-Common Law Claims & Policy (DBR-CLC&P) is primarily responsible for processing common law, non-contractual, compensation claims against and on behalf of the MOD at home and overseas emanating from Employers Liability (Service and Civilian), Public Liability, Low Flying military aircraft, Maritime and Clinical Negligence. DBR-CLC&P also has responsibility for providing claims policy advice to Ministers and senior officials; handling claims against foreign forces based in the UK in accordance with NATO SOFA; providing advice on insurance and indemnities, and as Role Owner for Area Claims Officers in operational theatres. The annual claims budget is approx £100M.","Ministry of Defence","Ministry of Defence","Head Office and Corporate Services","0207 218 9507","HOCSFIN-HeadGroupMailbox@mod.uk","00111789","508188","1","0","0","","Other","","1"
"197658","Mike Stone","SCS2","Chief Executive Defence Business Services","Responsible for Serving the MOD through one service delivery organisation managed through one top management structure. The pillars in this new organisation: Civilian HR, Finance, Information services, Business Management, Programme Management and National Security Vetting","Ministry of Defence","Ministry of Defence","Head Office and Corporate Services","0207 218 9507","HOCSFIN-HeadGroupMailbox@mod.uk","00106000","2752780","1","0","0","","Human Resources","","1"
"194546","N/D","SCS1","Head of Defence Buiness Services Finance","Defence Business Services (DBS) Finance provides expert information, advice and services to and on behalf of MOD business areas. Responsible for payments to MOD suppliers and for recovering in respect of MOD invoices. Also Responsible for generating the associated accruals, debtors, and creditors in the Departmental Financial Management System and accounting for MOD’s fixed assets. Focused on central transaction processing and leading the simplification of financial processes, allowing MOD to concentrate on value added activities","Ministry of Defence","Ministry of Defence","Head Office and Corporate Services","0207 218 9507","HOCSFIN-HeadGroupMailbox@mod.uk","197658","7926810","1","0","0","","Finance","","1"
"153965","N/D","SCS1","Head of Human Resources Service Delivery","DBS Civilian HR provides a full range of civilian human resources and pay services to Defence, its civilian staff and their managers","Ministry of Defence","Ministry of Defence","Head Office and Corporate Services","0207 218 9507","HOCSFIN-HeadGroupMailbox@mod.uk","197658","14904693","1","0","0","","Human Resources","","1"
"106013","N/D","SCS1","Head of Defence Business Services Information Services","Delivers information and data management and communication services which support Defence","Ministry of Defence","Ministry of Defence","Head Office and Corporate Services","0207 218 9507","HOCSFIN-HeadGroupMailbox@mod.uk","197658","8650549","1","0","0","","Information Technology","","1"
"104025","N/D","SCS1","Head of National Security Vetting","Responsible for processing National Security Vetting (NSV) checks and clearances. Including Counter Terrorist Check (CTC), Security Check (SC) and Developed Vetting (DV).","Ministry of Defence","Ministry of Defence","Head Office and Corporate Services","0207 218 9507","HOCSFIN-HeadGroupMailbox@mod.uk","197658","8373358","1","0","0","","Other","","1"
"191185","AM T Anderson","OF-8","Director General Military Aviation Authority","The Director General of the Military Aviation Authority has full oversight of all Defence Aviation activity, and is the single regulatory authority responsible for regulating all aspects of Air Safety across Defence. He achieves this through establishing and maintaining an appropriate regulatory framework, given effect by a certification, approvals and inspection process extending across the acquisition, operation and continued airworthiness of air systems within the Defence aviation environment, and by independant surveillance of relevant Departmental planning and programming processes. The Director General provides assurance to the Secretary of State for Defence through the Second Permanent Under Secretary of State that high standards of Air Safety are maintained in the conduct of military aviation. He attends the Defence Environment and Safety Board, but, as an independant Regulator, is not formally accountable to it. The Director General is the Convening Authority for all Service Inquiries into military aircraft occurrences.","Ministry of Defence","Ministry of Defence","Head Office and Corporate Services","0207 218 9507","HOCSFIN-HeadGroupMailbox@mod.uk","00109715","3065548","1","130000","134999","","Military","","1"
"191191","R Adm S Charlier","OF-7","Director Operations Military Aviation Authority","Member of the MAA Executive Board. Lead and direct the Operations Group of the MAA; overseeing coherent regulation and safe conduct of all military flying operations and acting as operating regulatory lead with FLCs, DE&S and Industry; link to OGDs and Agencies outside Government on aviation operating matters, including international liaison. In addition he is charged with continuously improving and transforming the organisation to fully meet the role of independent regulator.","Ministry of Defence","Ministry of Defence","Head Office and Corporate Services","0207 218 9507","HOCSFIN-HeadGroupMailbox@mod.uk","191185","0","1","110000","114999","","Military","Added to Position 191185","1"
"185281","Air Cdre Clark","OF-7","Director Technical Military Aviation Authority","Member of the MAA Executive Board. Lead and direct the Technical Group of the MAA; technical regulatory lead with FLCs, DE&S and Industry; link to OGDs and Agencies outside Government on aviation operating matters, including international liaison.","Ministry of Defence","Ministry of Defence","Head Office and Corporate Services","0207 218 9507","HOCSFIN-HeadGroupMailbox@mod.uk","191185","0","1","110000","114999","","Military","Added to Position 191185","1"
"191217","Vacant","OF-6","Head Oversight & Approvals Military Aviation Authority","MAA Oversight and Approvals regulates, on behalf of DG MAA, the operation of all aircraft registered as UK Military Aircraft (manned and unmanned) covering all aerial activities of FLCs, DE&S and contractors’. MAA O&A regulation activities also extend to Military Registered Civil-Owned Aircraft (MRCOA). In addition, a key output is the contribution to assurance of the airworthiness of aviation on the UKMR through airworthiness organisation and key individual approvals.","Ministry of Defence","Ministry of Defence","Head Office and Corporate Services","N/A","HOCSFIN-HeadGroupMailbox@mod.uk","185281","3761501","1","0","0","","Military","","1"
"164078","N/D","SCS1","Head Analysis & Plans Military Aviation Authority","The maintenance and promulgation of the MoD’s through-life Airworthiness Regulations, Standards and associated publications. Regulation and Policy publication coherence. Take the lead for the harmonization of airworthiness across European military authorities. Develop the MAA approach to Risk Management. Responsible for the end-to-end output of AUP considering the full spectrum of the Military Air Environment. Exploit Air Safety knowledge assessing performance and risk to develop an evidence based prioritized plan pan MAA.","Ministry of Defence","Ministry of Defence","Head Office and Corporate Services","0207 218 9507","HOCSFIN-HeadGroupMailbox@mod.uk","191191","1642778","1","0","0","","Programme and Project Management (PPM)","","1"
