FREEDOM OF INFORMATION,,
23-02-2011-140136-002,23/03/2011,Details of the expenses claimed by each of the MoD board members in each of the last two financial years 2009-10 and 2010-11(to present date).
23-02-2011-141128-003,22/03/2011,Information on the reduction in weather stations
23-02-2011-142825-004,23/03/2011,Information about the Mesothelioma claim that was paid to a specified individual at the end of 2010.
23-02-2011-143842-005,23/03/2011,The cost (in GBP) of transporting Guernsey's Lieutenant-Governor from Guernsey to the UK following his departure from the island and his post on the 23rd February 2011.
23-02-2011-150535-006,23/03/2011,How much do the British spend on Black projects?
23-02-2011-153123-007,23/03/2011,"Please list all MOD flights that arrived and departed Glasgow airport on the following dates:29.06.2007, 30.06.2007, 01.06.2007"
23-02-2011-153309-001,17/03/2011,The running costs of Boscombe Down before it was managed in-house by the MoD prior to it being managed by QinetiQ
23-02-2011-153955-001,08/03/2011,Bidding documents for SAR-H contract
23-02-2011-161122-002,01/03/2011,Cost of away days and teambuilding by MOD Whitehall staff.
23-02-2011-164439-008,23/03/2011,Details of the number of mobile phones used by the police force and  their respective usage costs over the last financial year
24-02-2011-105212-001,23/03/2011,All communications both to and from the Secretary of State and ministers regarding the discharge of soldiers who are medically unfit for service.
24-02-2011-110145-002,23/03/2011,Lists of Regiments that were stationed in Exeter between 1810 - 1839
24-02-2011-110546-003,24/03/2011,Headcount figures for MoD and it's executive agencies/NDPBs in offices located in the Greater Manchester area.
24-02-2011-122849-004,24/03/2011,"The number of military personnel of different categories (i.e. privates, non-commissioned officers, officers, generals and equivalent ranks) in the U.K. armed forces?"
24-02-2011-135436-001,24/03/2011,"	The location of Veterans in the UK preferably by Local Authority and 	Health and welfare issues of Veterans living in the UK"
24-02-2011-153802-001,24/03/2011,"Information relating to break/cancellation clauses in contracts for any long lead items that were placed for the fourth Astute class submarine, called “Audacious” "
24-02-2011-155305-002,24/03/2011,Casualty (body counts of US and UK soldiers) figures in the First Gulf War (1990-1991) on a monthly basis
24-02-2011-155945-003,24/03/2011,Information on British soldiers appearing before a court-martial.
24-02-2011-161016-004,24/03/2011,"Information on mine accident involving a Ferret Scout car on 31st Dec 1964 in Monks Field/Blairs Field in the Radfan, Aden"
24-02-2011-161436-005,24/03/2011,"From the number of Hindus and Buddhists in the three forces, how many are Ghurkhas?"
25-02-2011-093635-001,23/03/2011,Names of the potential suppliers of the FACITS framework
25-02-2011-095254-001,24/03/2011,"Information on safety inspections carried out on Airship Road, Cranwell"
25-02-2011-102508-002,24/03/2011,What is the project name or Operational name for the military providing cover for Prison officers in the event of strike action.
25-02-2011-105743-003,25/03/2011,"When was your current logo, corporate style, graphics and branding implemented? Who designed it? How much were the designers paid for their services?"
25-02-2011-120345-004,25/03/2011,"The ""framework documents"" governing the relationships between British executive agencies and central government departments."
25-02-2011-121114-001,25/03/2011,The number and percentage of females within the Royal Navy for the last twenty years
25-02-2011-134355-001,25/03/2011,Information regarding breakdowns of Hercules transport planes from the inception of the Afghan war.
25-02-2011-135144-002,25/03/2011,Detailed information regarding the Current Medals Review.
25-02-2011-141109-003,25/03/2011,"Has MoD held any inquiry into the killing of RIR soldier xxxxxxxxx, who was shot dead by xxxxxxxxxxxx at Four Ways Hotel in Fivemiletown in Northern Ireland in October 2001."
25-02-2011-144418-004,25/03/2011,Please advise who decides to which countries Defence Attaches will be sent. MOD or FCO or a combination of both?
25-02-2011-152226-005,23/03/2011,Information on the requisition of land at Holdingham from Rauceby Estates to enable the construction of the Sleaford Cranwell Railway Line (1915 - 1917).
25-02-2011-155528-001,25/03/2011,A list of forces personnel who died whose permanent residence was Bolton or specifically Horwich or Blackrod in Bolton?
25-02-2011-162855-006,25/03/2011,Who decides to which countries Defence Attaches will be sent. MOD or FCO or a combination of both?
25-02-2011-163437-007,25/03/2011,Has your department or any of its agencies conducted any reports since 1st January 2010 into the impact of the Bribery Act 2010
25-02-2011-165513-008,25/03/2011,Information about the departments staff internet usage.
25-02-2011-165921-009,25/03/2011,Information on food consumption and dietary preference aboard  Astute class nuclear submarines.
