FREEDOM OF INFORMATION,,
11-02-2011-145231-002,11/03/2011,"Detailed information regarding the Directorate of Targeting Information Operations (DTIO) including history, structure, activities, performance, staffing."
11-02-2011-145852-003,11/03/2011,Information on a lynx crash that occurred in France on the 17th Sept 1986
11-02-2011-160043-001,09/03/2011,"Copy of a report regarding the weight of equipment and muscular skeletal injuries, provided by AWE Div to Wethersfield approximately 18 months ago."
11-02-2011-160934-002,24/02/2011,Information on Operation SANDCASTLE 
11-02-2011-161358-004,28/02/2011,What are the current bursary costs for military officer’s children? How many children of military officers are at Public Boarding Schools? How long have these military officers been on overseas operational service in relation to the Public Boarding School terms?
11-02-2011-161840-003,09/03/2011,"Information on permanent staff in Bands D, C2 and C1 at Sealand within the DARA and DSG and IT systems"
14-02-2011-095915-001,11/03/2011,"Statistics concerning Army recruitment in specific areas of the country, for example how many people joined the Army who were from Sunderland between 2000-2010. "
14-02-2011-101446-002,11/03/2011,"Details of all Navy, RAF and British Army personnel who have undergone Human Intelligence training courses at the DISC, Chicksands, in the years 2008-2010"
14-02-2011-101953-003,11/03/2011,Information pertaining to service accommodation for entitled personnel posted at RAF Honington with estates managed by Defence Estates Operations
14-02-2011-103106-004,14/03/2011,Information on HMS Moravia
14-02-2011-104817-005,14/03/2011,Deliberations and reports reference:1981 Defence Review (White Paper) - Also known as the Nott Report. 
14-02-2011-111807-001,14/03/2011,Unpublished version of annual report.
14-02-2011-112840-006,14/03/2011,Copy of Partnering Agreement CHC/087entered into in 2006 between MOD and the Boeing company relating to through life contract support of the Chinook Helicopter Fleet
14-02-2011-113613-007,14/03/2011,Information the MoD has on the specific term 'Solar Warden'. 
14-02-2011-115021-001,11/03/2011,"Copies of ""Babcock Event No 19720: Failure to Reinstate Primary Safety Systems"" and ""Nuclear Propulsion Project Team, Organisation for Delivery of Nuclear Safety by the Approval Authority role"
14-02-2011-115046-008,14/03/2011,"How many guns, bullets grenades, weapons and other military ordinance has been stolen over the last three years. Dating back to February 2008."
14-02-2011-131123-009,14/03/2011,"Copy of Non-Proliferation file Reference: ES 13/116, Covering dates: 1977 Jan 01 - 1977 Dec 31 "
14-02-2011-132238-001,14/03/2011,"Copy of the current policy on the care of under-18s in the armed forces, including the rules and process by which a recruit under the age of 18 may request permission to leave."
14-02-2011-154627-001,12/01/2011,Results of swab tests for the requester and advise whether any biological and chemical agents or radioactive substances were present.
14-02-2011-143643-002,14/03/2011,How many animals have been deployed to Iraq and Afghanistan as part of Operation Telic and Herrick respectively. How many of these died while serving on these operations.
14-02-2011-145242-003,14/03/2011,"Details of any written, verbal or email negotiations in respect of ABP acquisition of the Sea Mounting Centre in Marchwood."
14-02-2011-172503-004,14/03/2011,Information on 15 (UK) Psyops Group
15-02-2011-092552-001,14/03/2011,All analyses and correspondence detailing the security implications to British forces in Afghanistan of releasing the information contained in the announcements made by Gordon Brown on 12-14 December 2009 on roadside bombs. 
15-02-2011-093156-002,14/03/2011,"Information regarding the cost of training an RAF Typhoon pilot, from entry into the RAF, until becoming operational on the front-line. "
15-02-2011-093607-003,14/03/2011,How many IED attacks have there been on UK forces in Afghanistan per month for the first quarter of 2011 and 2010?
15-02-2011-094432-001,09/03/2011,Information on Job Requisition No: 368171
15-02-2011-094642-004,14/03/2011,How many weapons and type for which the Department has responsibility have been recorded as (a) lost and (b) stolen in each of the last two years; 2009 and 2010?
15-02-2011-095004-005,14/03/2011,"How much money was spent by the MoD school fees for the children of soldiers and officers in 2007/2008, 2008/2009, 2009/2010, 2010/2011?"
15-02-2011-095425-006,14/03/2011,"Which UK companies/agencies have got contracts with the M.O.D. abroad, I am seeking a contract of employment in places such as Afghanistan"
15-02-2011-124632-007,15/03/2011,"Please disclose all correspondence between the PJHQs and xxxxxxxxxx, who has acted as a consultant for PJHQ."
15-02-2011-125423-008,15/03/2011,Information relating to the standard of armed service single living and family accommodation since March 2009. 
15-02-2011-130630-002,11/03/2011,Additional information regarding TAPL for XG-380 Grease
15-02-2011-130749-003,09/03/2011,Information on Veterans ID Cards
15-02-2011-133231-001,11/02/2011,"A copy of the Defence Equipment and Support, Defence Clothing, for Tunics Other Ranks Foot Guards"
15-02-2011-133443-002,22/02/2011,"What connection a specified individual has with HR Armed Forces? What branch did they serve in, if any, what academic qualifications they hold for such a prestige role at SPVA."
15-02-2011-135045-001,14/03/2011,Statistics of untrained female personnel within the Army in 2010
15-02-2011-135328-003,04/03/2011,Information and a sample of a hard armour plate used for body armour.
15-02-2011-140134-002,14/03/2011,Please provide Army recruitment statistics for the whole United Kingdom. Also provide any information about recruitment from World War One and World War Two.
15-02-2011-141514-003,11/03/2011,Detailed information on RAF pilots in 1967.
15-02-2011-144422-004,14/03/2011,Information on advertising on the Met Office website
15-02-2011-145054-004,10/03/2011,Information on number of UK Armed Forces claiming the Home to Duty allowance
15-02-2011-145840-005,15/03/2011,Information related to the basing of United States Ground Launched Cruise Missiles
15-02-2011-151810-006,15/03/2011,"A copy of the terms of reference, which were used as the baseline for the Current Youth Engagement Review (YER)."
15-02-2011-154014-005,04/03/2011,"A TAPL copy for BS 2626:1992, Type A, Grade 68 OM-70 Refrigeration oils"
15-02-2011-154305-007,14/03/2011,Detailed information on 15 (UK) Psyops Group.    
15-02-2011-154734-006,28/02/2011,"Copies of Catering Flight's Safety, Health & Environmental Audit Reports dated Dec 2009 & Dec 2010. RAF Coningsby Sgt's Mess shift roster for January 2010. Copy of the Minimum Manning Staffing Levels for Coningsby Catering "
15-02-2011-161126-008,15/03/2011,"Information about how MoD managed Great Wood, located in North Yorkshire, near Sneaton, especially between the years of 1920-1966"
15-02-2011-161951-009,15/03/2011,"Which part of the armed forces occupied Sutton Park, Sutton, Bedfordshire between 1939 and 1945/46, and what their role was."
15-02-2011-164440-010,15/03/2011,Information about the use of MoD resources in the making of any television programs and/or films.
15-02-2011-170121-011,15/03/2011,All photographs taken of barracks where members of the armed forces are housed and which show decay/need of repair/safety issues (past 3 years)
15-02-2011-172728-001,25/02/2011,Request for two ABRO documents related to Warrior firing circuit
16-02-2011-095249-001,15/03/2011,"How many reports of ADR (Adverse Drug Reaction) to Lariam (Mefloquine) were reported by the MoD to the MHRA through the yellow card system, year by year since 1996."
16-02-2011-124825-001,07/03/2011,"Copies of all Defence Ministerial speeches reference: energy security, defence procurement, armed forces logistics and purposes of the UK military's expeditionary capability that are stored in electronic form at mid-2005"
16-02-2011-144623-002,16/03/2011,"Information about the history of the Territorial Army and any statistics, especially relating to how many volunteers are in the TA and how many members of the TA have fought in Afghanistan over the last year and in total."
16-02-2011-150238-003,15/03/2011,"Suffolk, Wiltshire, Hertfordshire, Norfolk barracks - Records of Health and Safety inspections, fire drill, fire safety inspections, food hygiene inspection reports"
16-02-2011-150655-004,15/03/2011,"Suffolk, Norfolk, Cambridgeshire, Norfolk, Surrey barracks - Records of Health and Safety inspections, fire drill, fire safety inspections, food hygiene inspection reports"
16-02-2011-150922-005,15/03/2011,"Surrey, Hampshire barracks - Records of Health and Safety inspections, fire drill, fire safety inspections, food hygiene inspection reports"
16-02-2011-151157-006,15/03/2011,"Oxfordshire, Berkshire, Kent barracks - Records of Health and Safety inspections, fire drill, fire safety inspections, food hygiene inspection reports"
16-02-2011-151455-007,15/03/2011,"Kent, East Sussex barracks - Records of Health and Safety inspections, fire drill, fire safety inspections, food hygiene inspection reports"
16-02-2011-151716-008,15/03/2011,"Dorset, Devon barracks - Records of Health and Safety inspections, fire drill, fire safety inspections, food hygiene inspection reports"
16-02-2011-151924-009,15/03/2011,"Devon, Cornwall, Hampshire, West Sussex barracks - Records of Health and Safety inspections, fire drill, fire safety inspections, food hygiene inspection reports"
16-02-2011-152152-010,15/03/2011,"Hampshire, Wiltshire barracks - Records of Health and Safety inspections, fire drill, fire safety inspections, food hygiene inspection reports"
16-02-2011-152417-011,15/03/2011,"Hampshire, Wiltshire, Bristol barracks - Records of Health and Safety inspections, fire drill, fire safety inspections, food hygiene inspection reports"
16-02-2011-152656-012,15/03/2011,"Wiltshire, Gloucestershire, Somerset, Warwickshire barracks - Records of Health and Safety inspections, fire drill, fire safety inspections, food hygiene inspection reports"
16-02-2011-152916-013,15/03/2011,"Herefordshire, Shropshire, Staffordshire, Leicestershire barracks - Records of Health and Safety inspections, fire drill, fire safety inspections, food hygiene inspection reports"
16-02-2011-153122-014,15/03/2011,"Lincolnshire, Leicestershire, West Yorkshire barracks - Records of Health and Safety inspections, fire drill, fire safety inspections, food hygiene inspection reports"
16-02-2011-153339-015,15/03/2011,"Lincolnshire, North Yorkshire, York, North Humberside barracks - Records of Health and Safety inspections, fire drill, fire safety inspections, food hygiene inspection reports"
16-02-2011-153540-016,15/03/2011,"Lincolnshire, North Yorkshire, York, North Humberside barracks - Records of Health and Safety inspections, fire drill, fire safety inspections, food hygiene inspection reports"
16-02-2011-153745-017,15/03/2011,"Manchester, Staffordshire, Liverpool, Cumbria, Lancashire barracks - Records of Health and Safety inspections, fire drill, fire safety inspections, food hygiene inspection reports"
16-02-2011-155559-018,16/03/2011,Information on HM Armed Forces Veterans Badge.
16-02-2011-160033-019,16/03/2011,"The numbers of personnel by rank, and service (Army, Navy, RAF) and the numbers of formations, vessels, aircraft and vehicles (Army, NAVY, RAF) as of January 1st 2011."
16-02-2011-160431-020,16/03/2011,Details of all vacant properties the Ministry of Defence has responsibility for. 
16-02-2011-160920-021,16/03/2011,"What guidance is given to forecasters who appear on TV, specifically relating to how they use gestures and hand movements to forecast the weather"
16-02-2011-161809-002,15/03/2011,Please provide an update and progress on a service complaint.
16-02-2011-163421-022,16/03/2011,How many current MoD employees have UKAEA reserved rights?
16-02-2011-171932-023,16/03/2011,Information Re: Regular Armed Forces Redundancy Programme.
17-02-2011-101101-001,15/03/2011,Request for the salary details and allowances of  xxxxxxxxxxxxx.
17-02-2011-112630-002,16/03/2011,Results of an RAF board of inquiry that was held at RAF Linton on Ouse following an alleged AIRPROX by aircraft registration G-SCOL on 17 August 2010. 
17-02-2011-113640-003,16/03/2011,A breakdown of the religion/faith of those serving in our armed forces.
17-02-2011-114317-004,16/03/2011,Information on the Medal review
17-02-2011-120009-005,17/03/2011,Information regarding the number of personnel currently in the armed forces from the Wigan area.
17-02-2011-120715-006,17/03/2011,How many Deaf people are in the Army Forces?
17-02-2011-122202-007,17/03/2011,Detailed information re: 15 (UK) Psyops Group.
17-02-2011-140826-001,17/03/2011,Do you have any stats on the Outflow from UK Regular Forces by gender?
17-02-2011-142412-002,17/03/2011,Previous students from Rivington & Blackrod High School who have been killed in service since WWII.
17-02-2011-144651-001,17/03/2011,Please provide information on the Joint Services Intelligence Organisation operating out of Chicksands.
17-02-2011-144657-001,17/03/2011,What is the cost per pair of fighter pilot boots that the ministry plans to buy in replacement to those bought at Haynes and Cann Ltd of Northampton until last year?
17-02-2011-145116-002,17/03/2011,When was JSP346 last fully reviewed in respect of eye conditions in general and cataracts in particular? 
17-02-2011-150230-003,17/03/2011,"Details, from May 11 2010, of the number of taxis taken from the place of work to a staff member's home which were paid for by the department, due to a staff member working late."
17-02-2011-151007-004,17/03/2011,"Please could you provide the names of your suppliers, in order that we may introduce camouflage coating technology for leather army boots."
17-02-2011-171645-003,01/02/2011,Medical spend as part of MOD equipment spend
17-02-2011-172911-005,15/03/2011,Can you please advise the Callsigns allocated to Anthorn and Skelton for their 19.6 and 22.1 KHz transmissions.
17-02-2011-184317-004,17/03/2011,"Copies of all guidance, advice and instructions issued to and by the MoD and Royal Navy relating to the impact of human rights legislation on the confrontation and arrest of pirates."
17-02-2011-184824-005,17/03/2011,Information on the number of P226 and P228 (aka L117A1) currently in use within the MOD and the number of personnel authorised to carry and use these items.
17-02-2011-185649-006,17/03/2011,Copy of the Chinook Airworthiness Review Report. Please provide details of when each recommendation was implemented.
18-02-2011-094837-001,17/03/2011,Argentine POW record in the Royal Navy in 1982 for historical research on the war in the South Atlantic.
18-02-2011-100315-002,17/03/2011,Report of the joint US-UK enquiry into the death of xxxxxxxxx. 
18-02-2011-101233-003,18/03/2011,My question is if you have any information about this in form of statistics or articles? Would it be possible for me to take a look at them?
18-02-2011-104623-004,18/03/2011,"Information on all arms sales, sales of technology and expertise provided related to arms and defence supplied free or paid for, to and related with North African and Middle Eastern countries"
18-02-2011-111109-005,18/03/2011,"The name and rank of the commanding officers of Squadron Nos 737, 801, 809, 815, 820, 824, 825, 826, 829, 845, 846, 847, 848 and 899. OIC aboard Hermes or Invincible"
18-02-2011-145025-001,18/03/2011,How many SPVA Staff are employed in IT functions? Does SPVA have an internal Information Technology team or is it outsourced?
18-02-2011-152655-002,18/03/2011,Information on recruits entering the army with lower than the U.K's national average in literacy skills from 2000. And the numbers of army personnel leaving with lower than the national average in literacy skills
18-02-2011-160515-003,18/03/2011,Detailed information regarding the Directorate of Targeting Information Operations (DTIO).
18-02-2011-161408-004,18/03/2011,The inclusive annual cost of maintaining the: Royal Air Force Red Arrows display team.
18-02-2011-163656-005,18/03/2011,"The salary of each Absence Recovery Warrant Officers, 11 in total. A breakdown of their individual expenses claimed for since the creation of the posts."
18-02-2011-164412-006,18/03/2011,Details of the number of British troops who have been referred to Priory clinics.
21-02-2011-091814-001,21/03/2011,MoD measurements of its staff workloads and how the needed division of manpower is calculated
21-02-2011-093132-002,18/03/2011,"Information relating to the number of armed forces personnel found to have smuggled drugs back to the UK from Afghanistan from October 7th, 2001 until the most recent available figures. "
21-02-2011-093609-003,21/03/2011,"In 2010, how many serving or former personnel were asked to repay money that had been paid to them in error under the Armed Forces Compensation Scheme?"
21-02-2011-093917-004,21/03/2011,What compensation does the MoD pay to families/relatives of service men and women who are required to move home from one property owned by the MoD to another.
21-02-2011-095411-005,21/03/2011,Information on Bahraini officers trained at Sandhurst from 1995
21-02-2011-095732-006,21/03/2011,In the last 2 years how many training sorties have been conducted by RAF Search and Rescue squadrons on Public Bank Holidays?
21-02-2011-100059-007,21/03/2011,All documents and correspondence between US and UK officials concerning xxxxxxxx; and all documents and correspondence between US and UK officials concerning US special forces member TM5
21-02-2011-101147-008,18/03/2011,Information about various helicopter contracts
21-02-2011-111958-010,21/03/2011,Records of all aircraft arrivals and departures on Netheravon Airfield (within the Salisbury Plain Training Area)
21-02-2011-113336-001,07/03/2011,Information surrounding the death of xxxxxxxxxxxxxxxxxx. 
21-02-2011-120145-001,17/03/2011,Information on the radiation readings inside the mushroom cloud for Operation Grapple Y on 28 April 1958 and Operation Pennant on 22 August 1958
21-02-2011-122604-002,21/03/2011,Please advise what happened at the Roswell Army Air base in 1947.
21-02-2011-123117-011,21/03/2011,The Post Operation Report for 3 Commando Brigade Royal Marines for Operation Telic 1: and the 3 Commando Brigade Royal Marine commander's diary for the above operation.
21-02-2011-124105-012,21/03/2011,Report prepared in September 2010 by Defence Equipment  and  Support Assessors at Abbey Wood to validate the safety case of Nimrod MRA4 aircraft.
21-02-2011-131956-001,17/03/2011,Operation Crabstick details in respect of Hawkinge Airfield
21-02-2011-141018-001,17/03/2011,Details of requester's transfer to RM and failure to re-enlist in the RN
21-02-2011-141529-002,18/03/2011,Details in respect of framework agreements: suppliers who applied for inclusion on each framework below and were successful and not successful at the PQQ &  & ITT stage 
21-02-2011-142105-003,18/03/2011,Details in respect of framework agreements: suppliers who applied for inclusion on each framework below and were successful & not successful at the PQQ &  & ITT stage 
21-02-2011-142651-004,18/03/2011,Details in respect of framework agreements:  suppliers who applied for inclusion on each framework below and were successful & not successful at the PQQ & ITT stage
21-02-2011-142935-002,18/03/2011,Any information on the MMS 294 minesweepers built for the Royal Navy between 1940 and 1945.
21-02-2011-145541-003,21/03/2011,Information on delays to flights of service personnel travelling to and from Afghanistan.
21-02-2011-145710-005,18/03/2011,Details in respect of framework agreements: suppliers who applied for inclusion on each framework below and were successful & not successful at the PQQ &  & ITT stage 
21-02-2011-150155-006,18/03/2011,Details in respect of framework agreements: suppliers who applied for inclusion on each framework below and were successful & not successful at the PQQ & ITT stage
21-02-2011-151110-004,21/03/2011,"How many operations were carried out in the Kandahar, Uruzgan, Nuristan, Zabul and Ghazni regions during 2010? How many mobile phones are there on commercial networks in Afghanistan?"
21-02-2011-152236-007,18/03/2011,Details in respect of framework agreements: suppliers who applied for inclusion on each framework below and were successful & not successful at the PQQ & ITT stage 
21-02-2011-152717-008,18/03/2011,Details in respect of framework agreements: suppliers who applied for inclusion on each framework below and were successful & not successful at the PQQ & ITT stage 
21-02-2011-161809-009,18/03/2011,Information which is held on file for the positions of Operational  Bases used by the British Auxillary Units during WW2 on the Isle of Wight.
21-02-2011-163338-005,21/03/2011,Please can you provide me with files 3 & 4 of the xxxxx fraud/theft case.
21-02-2011-163948-006,15/03/2011,"A list of your Low Value Purchasing officers with, if available, a list of the types of items they purchase as a 'one-off'?"
21-02-2011-171057-007,21/03/2011,"The number and % of untrained Army soldiers who left during training and the % breakdown for the reasons for discharge to include medical, SNLR and any other categories recorded"
21-02-2011-171519-008,21/03/2011,Information on entry requirements to REME as an apprentice vehicle mechanic in 2005 for an individual aged 16 years.
22-02-2011-095944-001,22/03/2011,What plans had been created by the military for the post-war situation in Iraq in 2003 and when were the plans decided upon?
22-02-2011-101231-002,22/03/2011,Copy of the Joint Service Publication 755 Tri-Service Positions and Assignments Instructions.
22-02-2011-112407-001,22/03/2011,"Recent Edition of WAR PENSIONERS RESIDENT IN UK BY POSTCODE and similar data for those in receipt of standard service pensions, including widows ( i.e. not war widows or war/disablement pensions)."
22-02-2011-113334-001,03/03/2011,"Request for copies, or titles, of STO for Tornado engines produced between 1969 and 1987"
22-02-2011-123239-002,22/03/2011,"The number of callouts for coast and maritime locations from 2000 onwards, up to the most recent data"
22-02-2011-142844-001,22/03/2011,Information on the effect of wind turbines on radar installations and the MOD's stance on the development of a site at Unst in Shetland
22-02-2011-144848-002,22/03/2011,A map of Hazardous Material (Misc 076) and a map of Dangerous Areas in Kosovo (Misc 033). 
22-02-2011-150515-003,22/03/2011,"For any one year between 1951 and 1961 how many men commissioned for the first time in the Armed Forces were avowed agnostics or atheists, and what proportion of the total number of men commissioned were agnostics or atheists?"
23-02-2011-085823-001,21/03/2011,"Archived File, Women at Sea, closure date 5/12/1989"
23-02-2011-090140-002,21/03/2011,"Archived File, Women at Sea, closure date 7/6/1990"
23-02-2011-090811-003,21/03/2011,"Archived File, Women at Sea, closure date 24/1/1991"
23-02-2011-091013-004,21/03/2011,"Archived File, Women at Sea, closure date 12/7/1991"
23-02-2011-091127-005,21/03/2011,"Archived File, Women at Sea, closure date 27/11/1992"
23-02-2011-091311-006,21/03/2011,"Archived File, Women at Sea, closure date 5/3/1993"
23-02-2011-091521-007,21/03/2011,"Archived File, Women at Sea, closure date 9/10/1990"
23-02-2011-091645-008,21/03/2011,"Archived File, Women at Sea, closure date 18/12/1991"
23-02-2011-091824-009,21/03/2011,File 'MOD HQ Navy Board Papers Headmark 2000' closed 16/6/1989
23-02-2011-091959-010,21/03/2011,File 'Offshore Task/Fishery Patrol General/Women at Sea' closed 23/01/1991
23-02-2011-092132-011,21/03/2011,File 'Women’s Royal Naval Service – Methods of Discharge from Service' closed 8/10/1992
23-02-2011-092254-012,21/03/2011,"Archived File, Women at Sea, closure date 14/10/1998"
23-02-2011-092419-013,21/03/2011,"Archived File, 'Employment of WRNS and Continuation Study Women at Sea' , closure date 3/2/1998"
23-02-2011-092538-014,21/03/2011,"Archived File, Women at Sea, closure date 6/8/1999"
23-02-2011-094403-015,21/03/2011,"Naval Archived Files Employment of Women Aircrew 1980, 1990 and 1991"
23-02-2011-094607-016,21/03/2011,Naval Archived Files Manpower Review 1982-1989
23-02-2011-094616-001,22/03/2011,Updated copy of Service Funds Regulations Army Code No 60450 dated March 1981
23-02-2011-094748-017,21/03/2011,Naval Archived Files Arming of Upper Deck Personnel 1989 - 1993
23-02-2011-094952-018,21/03/2011,Naval Archived Files Manpower Shortages 1977 - 1979
23-02-2011-104712-002,22/03/2011,Information on Arms company employees on secondment to Ministry of Defence
23-02-2011-105459-003,22/03/2011,"Battle Damage Assessment reports drawn up by NATO forces which took part in the bombing campaign of Yugoslavia from March 22 to June 11, 1999."
23-02-2011-105950-004,22/03/2011,Please can you provide numbers of personnel currently enlisted in the Armed Forces which are on the sexual offences register and have been retained by the service.
23-02-2011-111103-001,23/03/2011,What market research the MOD has done towards identifying how to increase recruitment to the British Army.  
23-02-2011-112622-005,23/03/2011,Information on Arms licences for Bahrain and Libya. 
23-02-2011-113133-006,23/03/2011,Details of the pay package General Sir Kevin O'Donoghue received upon stepping down from his post as Chief of Defence Material.
23-02-2011-133837-001,23/03/2011,Information pertaining to the financing of the Army Recovery Capability scheme since 1st October 2010.
